{
  "page_number": 69,
  "source": "v3_flight_logs_pdf",
  "extraction_date": "2025-10-28T17:58:36.115693",
  "chunk": "chunk_031-040",
  "flights": [
    {
      "date": {
        "original": "09/02/1999",
        "parsed": "1999-09-02",
        "display": "09/02/1999",
        "confidence": "high"
      },
      "aircraft": {
        "make_model": "G-1159B",
        "tail_number": "N908JE",
        "type": "Jet",
        "seats": 22,
        "confidence": "high"
      },
      "route": {
        "from": "TEB",
        "to": "SAF",
        "from_codes": [
          "TEB"
        ],
        "to_codes": [
          "SAF"
        ],
        "from_full": "Teterboro, NJ, United States",
        "to_full": "Santa Fe, NM, United States",
        "confidence": "high"
      },
      "flight_data": {
        "flight_number": "1274",
        "iidd": "2446",
        "confidence": "high"
      },
      "passengers": [
        {
          "name": "Tiffany Gramza",
          "code": "TG",
          "type": "identified",
          "notable": true,
          "confidence": "high"
        },
        {
          "name": "Alberto Pinto",
          "code": "AP",
          "type": "identified",
          "notable": true,
          "confidence": "high"
        },
        {
          "name": "Linda Pinto",
          "code": "LP",
          "type": "identified",
          "notable": true,
          "confidence": "high"
        }
      ],
      "data_source": "Flight Log",
      "source_chunk": "031-040",
      "v3_flight_id": "chunk_031-040_p001_r0001"
    },
    {
      "date": {
        "original": "09/05/1999",
        "parsed": "1999-09-05",
        "display": "09/05/1999",
        "confidence": "high"
      },
      "aircraft": {
        "make_model": "G-1159B",
        "tail_number": "N908JE",
        "type": "Jet",
        "seats": 22,
        "confidence": "high"
      },
      "route": {
        "from": "SAF",
        "to": "SAN",
        "from_codes": [
          "SAF"
        ],
        "to_codes": [
          "SAN"
        ],
        "from_full": "Santa Fe, NM, United States",
        "to_full": "San Diego, CA, United States",
        "confidence": "high"
      },
      "flight_data": {
        "flight_number": "1275",
        "iidd": "2449",
        "confidence": "high"
      },
      "passengers": [
        {
          "name": "Jeff Epstein",
          "code": "JE",
          "type": "identified",
          "notable": true,
          "confidence": "high"
        },
        {
          "name": "Shannon Healy",
          "code": "SH",
          "type": "identified",
          "notable": true,
          "confidence": "high"
        },
        {
          "name": "Tiffany Gramza",
          "code": "TG",
          "type": "identified",
          "notable": true,
          "confidence": "high"
        },
        {
          "name": "Shelley Lewis",
          "code": "SL",
          "type": "identified",
          "notable": true,
          "confidence": "high"
        }
      ],
      "data_source": "Flight Log",
      "source_chunk": "031-040",
      "v3_flight_id": "chunk_031-040_p001_r0004"
    },
    {
      "date": {
        "original": "09/05/1999",
        "parsed": "1999-09-05",
        "display": "09/05/1999",
        "confidence": "high"
      },
      "aircraft": {
        "make_model": "G-1159B",
        "tail_number": "N908JE",
        "type": "Jet",
        "seats": 22,
        "confidence": "high"
      },
      "route": {
        "from": "SAN",
        "to": "SAF",
        "from_codes": [
          "SAN"
        ],
        "to_codes": [
          "SAF"
        ],
        "from_full": "San Diego, CA, United States",
        "to_full": "Santa Fe, NM, United States",
        "confidence": "high"
      },
      "flight_data": {
        "flight_number": "1276",
        "iidd": "2453",
        "confidence": "high"
      },
      "passengers": [
        {
          "name": "Jeff Epstein",
          "code": "JE",
          "type": "identified",
          "notable": true,
          "confidence": "high"
        },
        {
          "name": "Shannon Healy",
          "code": "SH",
          "type": "identified",
          "notable": true,
          "confidence": "high"
        }
      ],
      "data_source": "Flight Log",
      "source_chunk": "031-040",
      "v3_flight_id": "chunk_031-040_p001_r0008"
    },
    {
      "date": {
        "original": "09/07/1999",
        "parsed": "1999-09-07",
        "display": "09/07/1999",
        "confidence": "high"
      },
      "aircraft": {
        "make_model": "G-1159B",
        "tail_number": "N908JE",
        "type": "Jet",
        "seats": 22,
        "confidence": "high"
      },
      "route": {
        "from": "SAF",
        "to": "TEB",
        "from_codes": [
          "SAF"
        ],
        "to_codes": [
          "TEB"
        ],
        "from_full": "Santa Fe, NM, United States",
        "to_full": "Teterboro, NJ, United States",
        "confidence": "high"
      },
      "flight_data": {
        "flight_number": "1277",
        "iidd": "2455",
        "confidence": "high"
      },
      "passengers": [
        {
          "name": "Jeff Epstein",
          "code": "JE",
          "type": "identified",
          "notable": true,
          "confidence": "high"
        },
        {
          "name": "Clare Hazell- Iveagh",
          "code": "CH",
          "type": "identified",
          "notable": true,
          "confidence": "high"
        },
        {
          "name": "Victoria Hazell",
          "code": "VH",
          "type": "identified",
          "notable": true,
          "confidence": "high"
        },
        {
          "name": "Adam PerryLang",
          "code": "AP",
          "type": "identified",
          "notable": true,
          "confidence": "high"
        }
      ],
      "data_source": "Flight Log",
      "source_chunk": "031-040",
      "v3_flight_id": "chunk_031-040_p001_r0010"
    },
    {
      "date": {
        "original": "09/08/1999",
        "parsed": "1999-09-08",
        "display": "09/08/1999",
        "confidence": "high"
      },
      "aircraft": {
        "make_model": "G-1159B",
        "tail_number": "N908JE",
        "type": "Jet",
        "seats": 22,
        "confidence": "high"
      },
      "route": {
        "from": "TEB",
        "to": "CMH",
        "from_codes": [
          "TEB"
        ],
        "to_codes": [
          "CMH"
        ],
        "from_full": "Teterboro, NJ, United States",
        "to_full": "Columbus, OH, United States",
        "confidence": "high"
      },
      "flight_data": {
        "flight_number": "1278",
        "iidd": "2459",
        "confidence": "high"
      },
      "passengers": [
        {
          "name": "Jeff Epstein",
          "code": "JE",
          "type": "identified",
          "notable": true,
          "confidence": "high"
        },
        {
          "name": "Clare Hazell- Iveagh",
          "code": "CH",
          "type": "identified",
          "notable": true,
          "confidence": "high"
        }
      ],
      "data_source": "Flight Log",
      "source_chunk": "031-040",
      "v3_flight_id": "chunk_031-040_p001_r0014"
    },
    {
      "date": {
        "original": "09/08/1999",
        "parsed": "1999-09-08",
        "display": "09/08/1999",
        "confidence": "high"
      },
      "aircraft": {
        "make_model": "G-1159B",
        "tail_number": "N908JE",
        "type": "Jet",
        "seats": 22,
        "confidence": "high"
      },
      "route": {
        "from": "CMH",
        "to": "TEB",
        "from_codes": [
          "CMH"
        ],
        "to_codes": [
          "TEB"
        ],
        "from_full": "Columbus, OH, United States",
        "to_full": "Teterboro, NJ, United States",
        "confidence": "high"
      },
      "flight_data": {
        "flight_number": "1279",
        "iidd": "2461",
        "confidence": "high"
      },
      "passengers": [
        {
          "name": "Jeff Epstein",
          "code": "JE",
          "type": "identified",
          "notable": true,
          "confidence": "high"
        },
        {
          "name": "Clare Hazell- Iveagh",
          "code": "CH",
          "type": "identified",
          "notable": true,
          "confidence": "high"
        },
        {
          "name": "Marshall ?",
          "code": "M?",
          "type": "unidentified",
          "notable": false,
          "confidence": "high"
        },
        {
          "name": "Male (1)",
          "code": "?",
          "type": "unidentified",
          "notable": false,
          "confidence": "high"
        }
      ],
      "data_source": "Flight Log",
      "source_chunk": "031-040",
      "v3_flight_id": "chunk_031-040_p001_r0016"
    },
    {
      "date": {
        "original": "09/09/1999",
        "parsed": "1999-09-09",
        "display": "09/09/1999",
        "confidence": "high"
      },
      "aircraft": {
        "make_model": "G-1159B",
        "tail_number": "N908JE",
        "type": "Jet",
        "seats": 22,
        "confidence": "high"
      },
      "route": {
        "from": "TEB",
        "to": "PBI",
        "from_codes": [
          "TEB"
        ],
        "to_codes": [
          "PBI"
        ],
        "from_full": "Teterboro, NJ, United States",
        "to_full": "West Palm Beach, FL, United States",
        "confidence": "high"
      },
      "flight_data": {
        "flight_number": "1280",
        "iidd": "2465",
        "confidence": "high"
      },
      "passengers": [
        {
          "name": "Jeff Epstein",
          "code": "JE",
          "type": "identified",
          "notable": true,
          "confidence": "high"
        },
        {
          "name": "Elizabeth ?",
          "code": "E?",
          "type": "unidentified",
          "notable": false,
          "confidence": "high"
        }
      ],
      "data_source": "Flight Log",
      "source_chunk": "031-040",
      "v3_flight_id": "chunk_031-040_p001_r0020"
    },
    {
      "date": {
        "original": "09/13/1999",
        "parsed": "1999-09-13",
        "display": "09/13/1999",
        "confidence": "high"
      },
      "aircraft": {
        "make_model": "G-1159B",
        "tail_number": "N908JE",
        "type": "Jet",
        "seats": 22,
        "confidence": "high"
      },
      "route": {
        "from": "PBI",
        "to": "TEB",
        "from_codes": [
          "PBI"
        ],
        "to_codes": [
          "TEB"
        ],
        "from_full": "West Palm Beach, FL, United States",
        "to_full": "Teterboro, NJ, United States",
        "confidence": "high"
      },
      "flight_data": {
        "flight_number": "1281",
        "iidd": "2467",
        "confidence": "high"
      },
      "passengers": [
        {
          "name": "Jeff Epstein",
          "code": "JE",
          "type": "identified",
          "notable": true,
          "confidence": "high"
        },
        {
          "name": "Ghislaine Maxwell",
          "code": "GM",
          "type": "identified",
          "notable": true,
          "confidence": "high"
        },
        {
          "name": "Paula Epstein",
          "code": "PE",
          "type": "identified",
          "notable": true,
          "confidence": "high"
        },
        {
          "name": "Mandy Ellison",
          "code": "ME",
          "type": "identified",
          "notable": true,
          "confidence": "high"
        },
        {
          "name": "Clare Hazell- Iveagh",
          "code": "CH",
          "type": "identified",
          "notable": true,
          "confidence": "high"
        }
      ],
      "data_source": "Flight Log",
      "source_chunk": "031-040",
      "v3_flight_id": "chunk_031-040_p001_r0022"
    },
    {
      "date": {
        "original": "09/17/1999",
        "parsed": "1999-09-17",
        "display": "09/17/1999",
        "confidence": "high"
      },
      "aircraft": {
        "make_model": "G-1159B",
        "tail_number": "N908JE",
        "type": "Jet",
        "seats": 22,
        "confidence": "high"
      },
      "route": {
        "from": "TEB",
        "to": "PBI",
        "from_codes": [
          "TEB"
        ],
        "to_codes": [
          "PBI"
        ],
        "from_full": "Teterboro, NJ, United States",
        "to_full": "West Palm Beach, FL, United States",
        "confidence": "high"
      },
      "flight_data": {
        "flight_number": "1282",
        "iidd": "2472",
        "confidence": "high"
      },
      "passengers": [
        {
          "name": "Jeff Epstein",
          "code": "JE",
          "type": "identified",
          "notable": true,
          "confidence": "high"
        },
        {
          "name": "Ghislaine Maxwell",
          "code": "GM",
          "type": "identified",
          "notable": true,
          "confidence": "high"
        },
        {
          "name": "Paula Epstein",
          "code": "PE",
          "type": "identified",
          "notable": true,
          "confidence": "high"
        },
        {
          "name": "Emmy Tayler",
          "code": "ET",
          "type": "identified",
          "notable": true,
          "confidence": "high"
        },
        {
          "name": "Clare Hazell- Iveagh",
          "code": "CH",
          "type": "identified",
          "notable": true,
          "confidence": "high"
        }
      ],
      "data_source": "Flight Log",
      "source_chunk": "031-040",
      "v3_flight_id": "chunk_031-040_p001_r0027"
    },
    {
      "date": {
        "original": "09/20/1999",
        "parsed": "1999-09-20",
        "display": "09/20/1999",
        "confidence": "high"
      },
      "aircraft": {
        "make_model": "G-1159B",
        "tail_number": "N908JE",
        "type": "Jet",
        "seats": 22,
        "confidence": "high"
      },
      "route": {
        "from": "PBI",
        "to": "TEB",
        "from_codes": [
          "PBI"
        ],
        "to_codes": [
          "TEB"
        ],
        "from_full": "West Palm Beach, FL, United States",
        "to_full": "Teterboro, NJ, United States",
        "confidence": "high"
      },
      "flight_data": {
        "flight_number": "1283",
        "iidd": "2477",
        "confidence": "high"
      },
      "passengers": [
        {
          "name": "Jeff Epstein",
          "code": "JE",
          "type": "identified",
          "notable": true,
          "confidence": "high"
        },
        {
          "name": "Ghislaine Maxwell",
          "code": "GM",
          "type": "identified",
          "notable": true,
          "confidence": "high"
        },
        {
          "name": "Clare Hazell- Iveagh",
          "code": "CH",
          "type": "identified",
          "notable": true,
          "confidence": "high"
        },
        {
          "name": "Emmy Tayler",
          "code": "ET",
          "type": "identified",
          "notable": true,
          "confidence": "high"
        }
      ],
      "data_source": "Flight Log",
      "source_chunk": "031-040",
      "v3_flight_id": "chunk_031-040_p001_r0032"
    },
    {
      "date": {
        "original": "09/22/1999",
        "parsed": "1999-09-22",
        "display": "09/22/1999",
        "confidence": "high"
      },
      "aircraft": {
        "make_model": "G-1159B",
        "tail_number": "N908JE",
        "type": "Jet",
        "seats": 22,
        "confidence": "high"
      },
      "route": {
        "from": "TEB",
        "to": "PBI",
        "from_codes": [
          "TEB"
        ],
        "to_codes": [
          "PBI"
        ],
        "from_full": "Teterboro, NJ, United States",
        "to_full": "West Palm Beach, FL, United States",
        "confidence": "high"
      },
      "flight_data": {
        "flight_number": "1284",
        "iidd": "2481",
        "confidence": "high"
      },
      "passengers": [
        {
          "name": "Jeff Epstein",
          "code": "JE",
          "type": "identified",
          "notable": true,
          "confidence": "high"
        },
        {
          "name": "Emmy Tayler",
          "code": "ET",
          "type": "identified",
          "notable": true,
          "confidence": "high"
        },
        {
          "name": "A P",
          "code": "AP",
          "type": "unidentified",
          "notable": false,
          "confidence": "high"
        }
      ],
      "data_source": "Flight Log",
      "source_chunk": "031-040",
      "v3_flight_id": "chunk_031-040_p001_r0036"
    },
    {
      "date": {
        "original": "09/25/1999",
        "parsed": "1999-09-25",
        "display": "09/25/1999",
        "confidence": "high"
      },
      "aircraft": {
        "make_model": "G-1159B",
        "tail_number": "N908JE",
        "type": "Jet",
        "seats": 22,
        "confidence": "high"
      },
      "route": {
        "from": "PBI",
        "to": "TIST",
        "from_codes": [
          "PBI"
        ],
        "to_codes": [
          "TIST"
        ],
        "from_full": "West Palm Beach, FL, United States",
        "to_full": "Charlotte Amalie, St. Thomas, United States Virgin Islands",
        "confidence": "high"
      },
      "flight_data": {
        "flight_number": "1285",
        "iidd": "2484",
        "confidence": "high"
      },
      "passengers": [
        {
          "name": "Jeff Epstein",
          "code": "JE",
          "type": "identified",
          "notable": true,
          "confidence": "high"
        },
        {
          "name": "Ghislaine Maxwell",
          "code": "GM",
          "type": "identified",
          "notable": true,
          "confidence": "high"
        },
        {
          "name": "A P",
          "code": "AP",
          "type": "unidentified",
          "notable": false,
          "confidence": "high"
        },
        {
          "name": "Shelly Harrison",
          "code": "SH",
          "type": "identified",
          "notable": true,
          "confidence": "high"
        }
      ],
      "data_source": "Flight Log",
      "source_chunk": "031-040",
      "v3_flight_id": "chunk_031-040_p001_r0039"
    },
    {
      "date": {
        "original": "09/26/1999",
        "parsed": "1999-09-26",
        "display": "09/26/1999",
        "confidence": "high"
      },
      "aircraft": {
        "make_model": "G-1159B",
        "tail_number": "N908JE",
        "type": "Jet",
        "seats": 22,
        "confidence": "high"
      },
      "route": {
        "from": "TIST",
        "to": "TEB",
        "from_codes": [
          "TIST"
        ],
        "to_codes": [
          "TEB"
        ],
        "from_full": "Charlotte Amalie, St. Thomas, United States Virgin Islands",
        "to_full": "Teterboro, NJ, United States",
        "confidence": "high"
      },
      "flight_data": {
        "flight_number": "1286",
        "iidd": "2488",
        "confidence": "high"
      },
      "passengers": [
        {
          "name": "Jeff Epstein",
          "code": "JE",
          "type": "identified",
          "notable": true,
          "confidence": "high"
        },
        {
          "name": "Ghislaine Maxwell",
          "code": "GM",
          "type": "identified",
          "notable": true,
          "confidence": "high"
        },
        {
          "name": "A P",
          "code": "AP",
          "type": "unidentified",
          "notable": false,
          "confidence": "high"
        },
        {
          "name": "Shelly Harrison",
          "code": "SH",
          "type": "identified",
          "notable": true,
          "confidence": "high"
        }
      ],
      "data_source": "Flight Log",
      "source_chunk": "031-040",
      "v3_flight_id": "chunk_031-040_p001_r0043"
    }
  ]
}