{
  "page_number": 143,
  "source": "v3_flight_logs_pdf",
  "extraction_date": "2025-10-28T17:59:47.269292",
  "chunk": "chunk_101-110",
  "flights": [
    {
      "date": {
        "original": "05/12/2005",
        "parsed": "2005-05-12",
        "display": "05/12/2005",
        "confidence": "high"
      },
      "aircraft": {
        "make_model": "B-727-31H",
        "tail_number": "N908JE",
        "type": "Jet",
        "seats": 134,
        "confidence": "high"
      },
      "route": {
        "from": "JFK",
        "to": "TIST",
        "from_codes": [
          "JFK"
        ],
        "to_codes": [
          "TIST"
        ],
        "from_full": "New York, NY, United States",
        "to_full": "Charlotte Amalie, St. Thomas, United States Virgin Islands",
        "confidence": "high"
      },
      "flight_data": {
        "flight_number": "339",
        "iidd": "2000",
        "confidence": "high"
      },
      "passengers": [
        {
          "name": "Jeff Epstein",
          "code": "JE",
          "type": "identified",
          "notable": true,
          "confidence": "high"
        },
        {
          "name": "Adriana Mucinska",
          "code": "AM",
          "type": "identified",
          "notable": true,
          "confidence": "high"
        },
        {
          "name": "David Mullen",
          "code": "DM",
          "type": "identified",
          "notable": true,
          "confidence": "high"
        },
        {
          "name": "Nadia Marcinkova",
          "code": "NM",
          "type": "identified",
          "notable": true,
          "confidence": "high"
        },
        {
          "name": "D B",
          "code": "DB",
          "type": "unidentified",
          "notable": false,
          "confidence": "high"
        },
        {
          "name": "Bill Hammond",
          "code": "BH",
          "type": "identified",
          "notable": true,
          "confidence": "high"
        },
        {
          "name": "Larry Morrison",
          "code": "LM",
          "type": "identified",
          "notable": true,
          "confidence": "high"
        }
      ],
      "data_source": "Flight Log",
      "source_chunk": "101-110",
      "v3_flight_id": "chunk_101-110_p005_r0003"
    },
    {
      "date": {
        "original": "05/16/2005",
        "parsed": "2005-05-16",
        "display": "05/16/2005",
        "confidence": "high"
      },
      "aircraft": {
        "make_model": "B-727-31H",
        "tail_number": "N908JE",
        "type": "Jet",
        "seats": 134,
        "confidence": "high"
      },
      "route": {
        "from": "TIST",
        "to": "JFK",
        "from_codes": [
          "TIST"
        ],
        "to_codes": [
          "JFK"
        ],
        "from_full": "Charlotte Amalie, St. Thomas, United States Virgin Islands",
        "to_full": "New York, NY, United States",
        "confidence": "high"
      },
      "flight_data": {
        "flight_number": "340",
        "iidd": "2007",
        "confidence": "high"
      },
      "passengers": [
        {
          "name": "Jeff Epstein",
          "code": "JE",
          "type": "identified",
          "notable": true,
          "confidence": "high"
        },
        {
          "name": "Nadia Marcinkova",
          "code": "NM",
          "type": "identified",
          "notable": true,
          "confidence": "high"
        },
        {
          "name": "D B",
          "code": "DB",
          "type": "unidentified",
          "notable": false,
          "confidence": "high"
        },
        {
          "name": "David Mullen",
          "code": "DM",
          "type": "identified",
          "notable": true,
          "confidence": "high"
        },
        {
          "name": "Adriana Mucinska",
          "code": "AM",
          "type": "identified",
          "notable": true,
          "confidence": "high"
        },
        {
          "name": "Bill Hammond",
          "code": "BH",
          "type": "identified",
          "notable": true,
          "confidence": "high"
        },
        {
          "name": "Larry Morrison",
          "code": "LM",
          "type": "identified",
          "notable": true,
          "confidence": "high"
        }
      ],
      "data_source": "Flight Log",
      "source_chunk": "101-110",
      "v3_flight_id": "chunk_101-110_p005_r0010"
    },
    {
      "date": {
        "original": "05/19/2005",
        "parsed": "2005-05-19",
        "display": "05/19/2005",
        "confidence": "high"
      },
      "aircraft": {
        "make_model": "G-1159B",
        "tail_number": "N909JE",
        "type": "Jet",
        "seats": 22,
        "confidence": "high"
      },
      "route": {
        "from": "TEB",
        "to": "PBI",
        "from_codes": [
          "TEB"
        ],
        "to_codes": [
          "PBI"
        ],
        "from_full": "Teterboro, NJ, United States",
        "to_full": "West Palm Beach, FL, United States",
        "confidence": "high"
      },
      "flight_data": {
        "flight_number": "1777",
        "iidd": "2014",
        "confidence": "high"
      },
      "passengers": [
        {
          "name": "Jeff Epstein",
          "code": "JE",
          "type": "identified",
          "notable": true,
          "confidence": "high"
        },
        {
          "name": "A M",
          "code": "AM",
          "type": "unidentified",
          "notable": false,
          "confidence": "high"
        },
        {
          "name": "Sarah Kellen",
          "code": "SK",
          "type": "identified",
          "notable": true,
          "confidence": "high"
        },
        {
          "name": "Bill Hammond",
          "code": "BH",
          "type": "identified",
          "notable": true,
          "confidence": "high"
        }
      ],
      "data_source": "Flight Log",
      "source_chunk": "101-110",
      "v3_flight_id": "chunk_101-110_p005_r0017"
    },
    {
      "date": {
        "original": "05/24/2005",
        "parsed": "2005-05-24",
        "display": "05/24/2005",
        "confidence": "high"
      },
      "aircraft": {
        "make_model": "G-1159B",
        "tail_number": "N909JE",
        "type": "Jet",
        "seats": 22,
        "confidence": "high"
      },
      "route": {
        "from": "PBI",
        "to": "TEB",
        "from_codes": [
          "PBI"
        ],
        "to_codes": [
          "TEB"
        ],
        "from_full": "West Palm Beach, FL, United States",
        "to_full": "Teterboro, NJ, United States",
        "confidence": "high"
      },
      "flight_data": {
        "flight_number": "1778",
        "iidd": "2018",
        "confidence": "high"
      },
      "passengers": [
        {
          "name": "Jeff Epstein",
          "code": "JE",
          "type": "identified",
          "notable": true,
          "confidence": "high"
        },
        {
          "name": "Adriana Mucinska",
          "code": "AM",
          "type": "identified",
          "notable": true,
          "confidence": "high"
        },
        {
          "name": "Sarah Kellen",
          "code": "SK",
          "type": "identified",
          "notable": true,
          "confidence": "high"
        },
        {
          "name": "Larry Visoski",
          "code": "LV",
          "type": "identified",
          "notable": true,
          "confidence": "high"
        }
      ],
      "data_source": "Flight Log",
      "source_chunk": "101-110",
      "v3_flight_id": "chunk_101-110_p005_r0021"
    },
    {
      "date": {
        "original": "06/01/2005",
        "parsed": "2005-06-01",
        "display": "06/01/2005",
        "confidence": "high"
      },
      "aircraft": {
        "make_model": "G-1159B",
        "tail_number": "N909JE",
        "type": "Jet",
        "seats": 22,
        "confidence": "high"
      },
      "route": {
        "from": "PBI",
        "to": "TEB",
        "from_codes": [
          "PBI"
        ],
        "to_codes": [
          "TEB"
        ],
        "from_full": "West Palm Beach, FL, United States",
        "to_full": "Teterboro, NJ, United States",
        "confidence": "high"
      },
      "flight_data": {
        "flight_number": "1781",
        "iidd": "2022",
        "confidence": "high"
      },
      "passengers": [
        {
          "name": "Jeff Epstein",
          "code": "JE",
          "type": "identified",
          "notable": true,
          "confidence": "high"
        },
        {
          "name": "Adriana Mucinska",
          "code": "AM",
          "type": "identified",
          "notable": true,
          "confidence": "high"
        },
        {
          "name": "Sarah Kellen",
          "code": "SK",
          "type": "identified",
          "notable": true,
          "confidence": "high"
        },
        {
          "name": "Larry Visoski",
          "code": "LV",
          "type": "identified",
          "notable": true,
          "confidence": "high"
        }
      ],
      "data_source": "Flight Log",
      "source_chunk": "101-110",
      "v3_flight_id": "chunk_101-110_p005_r0025"
    },
    {
      "date": {
        "original": "06/09/2005",
        "parsed": "2005-06-09",
        "display": "06/09/2005",
        "confidence": "high"
      },
      "aircraft": {
        "make_model": "B-727-31H",
        "tail_number": "N908JE",
        "type": "Jet",
        "seats": 134,
        "confidence": "high"
      },
      "route": {
        "from": "JFK",
        "to": "PBI",
        "from_codes": [
          "JFK"
        ],
        "to_codes": [
          "PBI"
        ],
        "from_full": "New York, NY, United States",
        "to_full": "West Palm Beach, FL, United States",
        "confidence": "high"
      },
      "flight_data": {
        "flight_number": "FOIA-341",
        "iidd": "4088",
        "confidence": "high"
      },
      "passengers": [],
      "data_source": "FOIA",
      "source_chunk": "101-110",
      "v3_flight_id": "chunk_101-110_p005_r0029"
    },
    {
      "date": {
        "original": "06/22/2005",
        "parsed": "2005-06-22",
        "display": "06/22/2005",
        "confidence": "high"
      },
      "aircraft": {
        "make_model": "B-727-31H",
        "tail_number": "N908JE",
        "type": "Jet",
        "seats": 134,
        "confidence": "high"
      },
      "route": {
        "from": "PBI",
        "to": "GNV",
        "from_codes": [
          "PBI"
        ],
        "to_codes": [
          "GNV"
        ],
        "from_full": "West Palm Beach, FL, United States",
        "to_full": "Gainesville, FL, United States",
        "confidence": "high"
      },
      "flight_data": {
        "flight_number": "FOIA-342",
        "iidd": "4089",
        "confidence": "high"
      },
      "passengers": [],
      "data_source": "FOIA",
      "source_chunk": "101-110",
      "v3_flight_id": "chunk_101-110_p005_r0030"
    },
    {
      "date": {
        "original": "06/27/2005",
        "parsed": "2005-06-27",
        "display": "06/27/2005",
        "confidence": "high"
      },
      "aircraft": {
        "make_model": "G-1159B",
        "tail_number": "N909JE",
        "type": "Jet",
        "seats": 22,
        "confidence": "high"
      },
      "route": {
        "from": "TEB",
        "to": "PBI",
        "from_codes": [
          "TEB"
        ],
        "to_codes": [
          "PBI"
        ],
        "from_full": "Teterboro, NJ, United States",
        "to_full": "West Palm Beach, FL, United States",
        "confidence": "high"
      },
      "flight_data": {
        "flight_number": "1786",
        "iidd": "2026",
        "confidence": "high"
      },
      "passengers": [
        {
          "name": "Jeff Epstein",
          "code": "JE",
          "type": "identified",
          "notable": true,
          "confidence": "high"
        },
        {
          "name": "D B",
          "code": "DB",
          "type": "unidentified",
          "notable": false,
          "confidence": "high"
        },
        {
          "name": "Sarah Kellen",
          "code": "SK",
          "type": "identified",
          "notable": true,
          "confidence": "high"
        }
      ],
      "data_source": "Flight Log",
      "source_chunk": "101-110",
      "v3_flight_id": "chunk_101-110_p005_r0031"
    },
    {
      "date": {
        "original": "07/05/2005",
        "parsed": "2005-07-05",
        "display": "07/05/2005",
        "confidence": "high"
      },
      "aircraft": {
        "make_model": "G-1159B",
        "tail_number": "N909JE",
        "type": "Jet",
        "seats": 22,
        "confidence": "high"
      },
      "route": {
        "from": "PBI",
        "to": "TEB",
        "from_codes": [
          "PBI"
        ],
        "to_codes": [
          "TEB"
        ],
        "from_full": "West Palm Beach, FL, United States",
        "to_full": "Teterboro, NJ, United States",
        "confidence": "high"
      },
      "flight_data": {
        "flight_number": "1787",
        "iidd": "2029",
        "confidence": "high"
      },
      "passengers": [
        {
          "name": "Jeff Epstein",
          "code": "JE",
          "type": "identified",
          "notable": true,
          "confidence": "high"
        },
        {
          "name": "Adriana Mucinska",
          "code": "AM",
          "type": "identified",
          "notable": true,
          "confidence": "high"
        },
        {
          "name": "Sarah Kellen",
          "code": "SK",
          "type": "identified",
          "notable": true,
          "confidence": "high"
        },
        {
          "name": "Larry Visoski",
          "code": "LV",
          "type": "identified",
          "notable": true,
          "confidence": "high"
        }
      ],
      "data_source": "Flight Log",
      "source_chunk": "101-110",
      "v3_flight_id": "chunk_101-110_p005_r0034"
    },
    {
      "date": {
        "original": "07/10/2005",
        "parsed": "2005-07-10",
        "display": "07/10/2005",
        "confidence": "high"
      },
      "aircraft": {
        "make_model": "G-1159B",
        "tail_number": "N909JE",
        "type": "Jet",
        "seats": 22,
        "confidence": "high"
      },
      "route": {
        "from": "TIST",
        "to": "TEB",
        "from_codes": [
          "TIST"
        ],
        "to_codes": [
          "TEB"
        ],
        "from_full": "Charlotte Amalie, St. Thomas, United States Virgin Islands",
        "to_full": "Teterboro, NJ, United States",
        "confidence": "high"
      },
      "flight_data": {
        "flight_number": "1789",
        "iidd": "2033",
        "confidence": "high"
      },
      "passengers": [
        {
          "name": "Jeff Epstein",
          "code": "JE",
          "type": "identified",
          "notable": true,
          "confidence": "high"
        },
        {
          "name": "Adriana Mucinska",
          "code": "AM",
          "type": "identified",
          "notable": true,
          "confidence": "high"
        },
        {
          "name": "D B",
          "code": "DB",
          "type": "unidentified",
          "notable": false,
          "confidence": "high"
        },
        {
          "name": "Nadia Marcinkova",
          "code": "NM",
          "type": "identified",
          "notable": true,
          "confidence": "high"
        },
        {
          "name": "Bill Hammond",
          "code": "BH",
          "type": "identified",
          "notable": true,
          "confidence": "high"
        }
      ],
      "data_source": "Flight Log",
      "source_chunk": "101-110",
      "v3_flight_id": "chunk_101-110_p005_r0038"
    }
  ]
}