{
  "page_number": 81,
  "source": "v3_flight_logs_pdf",
  "extraction_date": "2025-10-28T17:58:46.405545",
  "chunk": "chunk_041-050",
  "flights": [
    {
      "date": {
        "original": "02/01/2001",
        "parsed": "2001-02-01",
        "display": "02/01/2001",
        "confidence": "high"
      },
      "aircraft": {
        "make_model": "G-1159B",
        "tail_number": "N908JE",
        "type": "Jet",
        "seats": 22,
        "confidence": "high"
      },
      "route": {
        "from": "PBI",
        "to": "SAF",
        "from_codes": [
          "PBI"
        ],
        "to_codes": [
          "SAF"
        ],
        "from_full": "West Palm Beach, FL, United States",
        "to_full": "Santa Fe, NM, United States",
        "confidence": "high"
      },
      "flight_data": {
        "flight_number": "FOIA-144 8",
        "iidd": "4020",
        "confidence": "high"
      },
      "passengers": [],
      "data_source": "FOIA",
      "source_chunk": "041-050",
      "v3_flight_id": "chunk_041-050_p003_r0002"
    },
    {
      "date": {
        "original": "02/04/2001",
        "parsed": "2001-02-04",
        "display": "02/04/2001",
        "confidence": "high"
      },
      "aircraft": {
        "make_model": "G-1159B",
        "tail_number": "N908JE",
        "type": "Jet",
        "seats": 22,
        "confidence": "high"
      },
      "route": {
        "from": "SAF",
        "to": "VNY",
        "from_codes": [
          "SAF"
        ],
        "to_codes": [
          "VNY"
        ],
        "from_full": "Santa Fe, NM, United States",
        "to_full": "Van Nuys, CA, United States",
        "confidence": "high"
      },
      "flight_data": {
        "flight_number": "FOIA-144 9",
        "iidd": "4021",
        "confidence": "high"
      },
      "passengers": [],
      "data_source": "FOIA",
      "source_chunk": "041-050",
      "v3_flight_id": "chunk_041-050_p003_r0003"
    },
    {
      "date": {
        "original": "02/05/2001",
        "parsed": "2001-02-05",
        "display": "02/05/2001",
        "confidence": "high"
      },
      "aircraft": {
        "make_model": "G-1159B",
        "tail_number": "N908JE",
        "type": "Jet",
        "seats": 22,
        "confidence": "high"
      },
      "route": {
        "from": "VNY",
        "to": "TEB",
        "from_codes": [
          "VNY"
        ],
        "to_codes": [
          "TEB"
        ],
        "from_full": "Van Nuys, CA, United States",
        "to_full": "Teterboro, NJ, United States",
        "confidence": "high"
      },
      "flight_data": {
        "flight_number": "FOIA-145 0",
        "iidd": "4022",
        "confidence": "high"
      },
      "passengers": [],
      "data_source": "FOIA",
      "source_chunk": "041-050",
      "v3_flight_id": "chunk_041-050_p003_r0004"
    },
    {
      "date": {
        "original": "02/09/2001",
        "parsed": "2001-02-09",
        "display": "02/09/2001",
        "confidence": "high"
      },
      "aircraft": {
        "make_model": "G-1159B",
        "tail_number": "N908JE",
        "type": "Jet",
        "seats": 22,
        "confidence": "high"
      },
      "route": {
        "from": "TEB",
        "to": "BED",
        "from_codes": [
          "TEB"
        ],
        "to_codes": [
          "BED"
        ],
        "from_full": "Teterboro, NJ, United States",
        "to_full": "Bedford, MA, United States",
        "confidence": "high"
      },
      "flight_data": {
        "flight_number": "FOIA-145 1",
        "iidd": "4023",
        "confidence": "high"
      },
      "passengers": [],
      "data_source": "FOIA",
      "source_chunk": "041-050",
      "v3_flight_id": "chunk_041-050_p003_r0005"
    },
    {
      "date": {
        "original": "02/10/2001",
        "parsed": "2001-02-10",
        "display": "02/10/2001",
        "confidence": "high"
      },
      "aircraft": {
        "make_model": "G-1159B",
        "tail_number": "N908JE",
        "type": "Jet",
        "seats": 22,
        "confidence": "high"
      },
      "route": {
        "from": "BED",
        "to": "PBI",
        "from_codes": [
          "BED"
        ],
        "to_codes": [
          "PBI"
        ],
        "from_full": "Bedford, MA, United States",
        "to_full": "West Palm Beach, FL, United States",
        "confidence": "high"
      },
      "flight_data": {
        "flight_number": "FOIA-145 2",
        "iidd": "4024",
        "confidence": "high"
      },
      "passengers": [],
      "data_source": "FOIA",
      "source_chunk": "041-050",
      "v3_flight_id": "chunk_041-050_p003_r0006"
    },
    {
      "date": {
        "original": "02/11/2001",
        "parsed": "2001-02-11",
        "display": "02/11/2001",
        "confidence": "high"
      },
      "aircraft": {
        "make_model": "G-1159B",
        "tail_number": "N908JE",
        "type": "Jet",
        "seats": 22,
        "confidence": "high"
      },
      "route": {
        "from": "PBI",
        "to": "ABY",
        "from_codes": [
          "PBI"
        ],
        "to_codes": [
          "ABY"
        ],
        "from_full": "West Palm Beach, FL, United States",
        "to_full": "Albany, GA, United States",
        "confidence": "high"
      },
      "flight_data": {
        "flight_number": "FOIA-145 3",
        "iidd": "4025",
        "confidence": "high"
      },
      "passengers": [],
      "data_source": "FOIA",
      "source_chunk": "041-050",
      "v3_flight_id": "chunk_041-050_p003_r0007"
    },
    {
      "date": {
        "original": "02/11/2001",
        "parsed": "2001-02-11",
        "display": "02/11/2001",
        "confidence": "high"
      },
      "aircraft": {
        "make_model": "G-1159B",
        "tail_number": "N908JE",
        "type": "Jet",
        "seats": 22,
        "confidence": "high"
      },
      "route": {
        "from": "ABY",
        "to": "PBI",
        "from_codes": [
          "ABY"
        ],
        "to_codes": [
          "PBI"
        ],
        "from_full": "Albany, GA, United States",
        "to_full": "West Palm Beach, FL, United States",
        "confidence": "high"
      },
      "flight_data": {
        "flight_number": "FOIA-145 4",
        "iidd": "4026",
        "confidence": "high"
      },
      "passengers": [],
      "data_source": "FOIA",
      "source_chunk": "041-050",
      "v3_flight_id": "chunk_041-050_p003_r0008"
    },
    {
      "date": {
        "original": "02/13/2001",
        "parsed": "2001-02-13",
        "display": "02/13/2001",
        "confidence": "high"
      },
      "aircraft": {
        "make_model": "G-1159B",
        "tail_number": "N908JE",
        "type": "Jet",
        "seats": 22,
        "confidence": "high"
      },
      "route": {
        "from": "PBI",
        "to": "TEB",
        "from_codes": [
          "PBI"
        ],
        "to_codes": [
          "TEB"
        ],
        "from_full": "West Palm Beach, FL, United States",
        "to_full": "Teterboro, NJ, United States",
        "confidence": "high"
      },
      "flight_data": {
        "flight_number": "FOIA-145 5",
        "iidd": "4027",
        "confidence": "high"
      },
      "passengers": [],
      "data_source": "FOIA",
      "source_chunk": "041-050",
      "v3_flight_id": "chunk_041-050_p003_r0009"
    },
    {
      "date": {
        "original": "02/16/2001",
        "parsed": "2001-02-16",
        "display": "02/16/2001",
        "confidence": "high"
      },
      "aircraft": {
        "make_model": "G-1159B",
        "tail_number": "N908JE",
        "type": "Jet",
        "seats": 22,
        "confidence": "high"
      },
      "route": {
        "from": "TEB",
        "to": "PBI",
        "from_codes": [
          "TEB"
        ],
        "to_codes": [
          "PBI"
        ],
        "from_full": "Teterboro, NJ, United States",
        "to_full": "West Palm Beach, FL, United States",
        "confidence": "high"
      },
      "flight_data": {
        "flight_number": "FOIA-145 6",
        "iidd": "4028",
        "confidence": "high"
      },
      "passengers": [],
      "data_source": "FOIA",
      "source_chunk": "041-050",
      "v3_flight_id": "chunk_041-050_p003_r0010"
    },
    {
      "date": {
        "original": "02/18/2001",
        "parsed": "2001-02-18",
        "display": "02/18/2001",
        "confidence": "high"
      },
      "aircraft": {
        "make_model": "G-1159B",
        "tail_number": "N908JE",
        "type": "Jet",
        "seats": 22,
        "confidence": "high"
      },
      "route": {
        "from": "PBI",
        "to": "TIST",
        "from_codes": [
          "PBI"
        ],
        "to_codes": [
          "TIST"
        ],
        "from_full": "West Palm Beach, FL, United States",
        "to_full": "Charlotte Amalie, St. Thomas, United States Virgin Islands",
        "confidence": "high"
      },
      "flight_data": {
        "flight_number": "FOIA-145 7",
        "iidd": "4029",
        "confidence": "high"
      },
      "passengers": [],
      "data_source": "FOIA",
      "source_chunk": "041-050",
      "v3_flight_id": "chunk_041-050_p003_r0011"
    },
    {
      "date": {
        "original": "02/19/2001",
        "parsed": "2001-02-19",
        "display": "02/19/2001",
        "confidence": "high"
      },
      "aircraft": {
        "make_model": "G-1159B",
        "tail_number": "N908JE",
        "type": "Jet",
        "seats": 22,
        "confidence": "high"
      },
      "route": {
        "from": "TIST",
        "to": "PBI",
        "from_codes": [
          "TIST"
        ],
        "to_codes": [
          "PBI"
        ],
        "from_full": "Charlotte Amalie, St. Thomas, United States Virgin Islands",
        "to_full": "West Palm Beach, FL, United States",
        "confidence": "high"
      },
      "flight_data": {
        "flight_number": "FOIA-145 8",
        "iidd": "4030",
        "confidence": "high"
      },
      "passengers": [],
      "data_source": "FOIA",
      "source_chunk": "041-050",
      "v3_flight_id": "chunk_041-050_p003_r0012"
    },
    {
      "date": {
        "original": "02/22/2001",
        "parsed": "2001-02-22",
        "display": "02/22/2001",
        "confidence": "high"
      },
      "aircraft": {
        "make_model": "G-1159B",
        "tail_number": "N908JE",
        "type": "Jet",
        "seats": 22,
        "confidence": "high"
      },
      "route": {
        "from": "PBI",
        "to": "MRY",
        "from_codes": [
          "PBI"
        ],
        "to_codes": [
          "MRY"
        ],
        "from_full": "West Palm Beach, FL, United States",
        "to_full": "Carmel, CA, United States",
        "confidence": "high"
      },
      "flight_data": {
        "flight_number": "FOIA-145 9",
        "iidd": "4031",
        "confidence": "high"
      },
      "passengers": [],
      "data_source": "FOIA",
      "source_chunk": "041-050",
      "v3_flight_id": "chunk_041-050_p003_r0013"
    },
    {
      "date": {
        "original": "02/24/2001",
        "parsed": "2001-02-24",
        "display": "02/24/2001",
        "confidence": "high"
      },
      "aircraft": {
        "make_model": "G-1159B",
        "tail_number": "N908JE",
        "type": "Jet",
        "seats": 22,
        "confidence": "high"
      },
      "route": {
        "from": "MRY",
        "to": "VNY",
        "from_codes": [
          "MRY"
        ],
        "to_codes": [
          "VNY"
        ],
        "from_full": "Carmel, CA, United States",
        "to_full": "Van Nuys, CA, United States",
        "confidence": "high"
      },
      "flight_data": {
        "flight_number": "FOIA-146 0",
        "iidd": "4032",
        "confidence": "high"
      },
      "passengers": [],
      "data_source": "FOIA",
      "source_chunk": "041-050",
      "v3_flight_id": "chunk_041-050_p003_r0014"
    },
    {
      "date": {
        "original": "02/26/2001",
        "parsed": "2001-02-26",
        "display": "02/26/2001",
        "confidence": "high"
      },
      "aircraft": {
        "make_model": "G-1159B",
        "tail_number": "N908JE",
        "type": "Jet",
        "seats": 22,
        "confidence": "high"
      },
      "route": {
        "from": "VNY",
        "to": "SAF",
        "from_codes": [
          "VNY"
        ],
        "to_codes": [
          "SAF"
        ],
        "from_full": "Van Nuys, CA, United States",
        "to_full": "Santa Fe, NM, United States",
        "confidence": "high"
      },
      "flight_data": {
        "flight_number": "FOIA-146 1",
        "iidd": "4033",
        "confidence": "high"
      },
      "passengers": [],
      "data_source": "FOIA",
      "source_chunk": "041-050",
      "v3_flight_id": "chunk_041-050_p003_r0015"
    },
    {
      "date": {
        "original": "02/27/2001",
        "parsed": "2001-02-27",
        "display": "02/27/2001",
        "confidence": "high"
      },
      "aircraft": {
        "make_model": "G-1159B",
        "tail_number": "N908JE",
        "type": "Jet",
        "seats": 22,
        "confidence": "high"
      },
      "route": {
        "from": "SAF",
        "to": "TEB",
        "from_codes": [
          "SAF"
        ],
        "to_codes": [
          "TEB"
        ],
        "from_full": "Santa Fe, NM, United States",
        "to_full": "Teterboro, NJ, United States",
        "confidence": "high"
      },
      "flight_data": {
        "flight_number": "FOIA-146 2",
        "iidd": "4034",
        "confidence": "high"
      },
      "passengers": [],
      "data_source": "FOIA",
      "source_chunk": "041-050",
      "v3_flight_id": "chunk_041-050_p003_r0016"
    },
    {
      "date": {
        "original": "03/02/2001",
        "parsed": "2001-03-02",
        "display": "03/02/2001",
        "confidence": "high"
      },
      "aircraft": {
        "make_model": "G-1159B",
        "tail_number": "N908JE",
        "type": "Jet",
        "seats": 22,
        "confidence": "high"
      },
      "route": {
        "from": "TEB",
        "to": "PBI",
        "from_codes": [
          "TEB"
        ],
        "to_codes": [
          "PBI"
        ],
        "from_full": "Teterboro, NJ, United States",
        "to_full": "West Palm Beach, FL, United States",
        "confidence": "high"
      },
      "flight_data": {
        "flight_number": "FOIA-146 3",
        "iidd": "4035",
        "confidence": "high"
      },
      "passengers": [],
      "data_source": "FOIA",
      "source_chunk": "041-050",
      "v3_flight_id": "chunk_041-050_p003_r0017"
    },
    {
      "date": {
        "original": "03/03/2001",
        "parsed": "2001-03-03",
        "display": "03/03/2001",
        "confidence": "high"
      },
      "aircraft": {
        "make_model": "C-421B",
        "tail_number": "N908GM",
        "type": "Fixed Wing",
        "seats": 8,
        "confidence": "high"
      },
      "route": {
        "from": "PBI",
        "to": "LCQ",
        "from_codes": [
          "PBI"
        ],
        "to_codes": [
          "LCQ"
        ],
        "from_full": "West Palm Beach, FL, United States",
        "to_full": "Lake City, FL, United States",
        "confidence": "high"
      },
      "flight_data": {
        "flight_number": "",
        "iidd": "2873",
        "confidence": "high"
      },
      "passengers": [
        {
          "name": "Kristy Rodgers",
          "code": "KR",
          "type": "identified",
          "notable": true,
          "confidence": "high"
        }
      ],
      "data_source": "Flight Log",
      "source_chunk": "041-050",
      "v3_flight_id": "chunk_041-050_p003_r0018"
    },
    {
      "date": {
        "original": "03/03/2001",
        "parsed": "2001-03-03",
        "display": "03/03/2001",
        "confidence": "high"
      },
      "aircraft": {
        "make_model": "C-421B",
        "tail_number": "N908GM",
        "type": "Fixed Wing",
        "seats": 8,
        "confidence": "high"
      },
      "route": {
        "from": "LCQ",
        "to": "LAL",
        "from_codes": [
          "LCQ"
        ],
        "to_codes": [
          "LAL"
        ],
        "from_full": "Lake City, FL, United States",
        "to_full": "Lakeland, FL, United States",
        "confidence": "high"
      },
      "flight_data": {
        "flight_number": "",
        "iidd": "2874",
        "confidence": "high"
      },
      "passengers": [
        {
          "name": "Kristy Rodgers",
          "code": "KR",
          "type": "identified",
          "notable": true,
          "confidence": "high"
        }
      ],
      "data_source": "Flight Log",
      "source_chunk": "041-050",
      "v3_flight_id": "chunk_041-050_p003_r0019"
    },
    {
      "date": {
        "original": "03/03/2001",
        "parsed": "2001-03-03",
        "display": "03/03/2001",
        "confidence": "high"
      },
      "aircraft": {
        "make_model": "C-421B",
        "tail_number": "N908GM",
        "type": "Fixed Wing",
        "seats": 8,
        "confidence": "high"
      },
      "route": {
        "from": "LAL",
        "to": "PBI",
        "from_codes": [
          "LAL"
        ],
        "to_codes": [
          "PBI"
        ],
        "from_full": "Lakeland, FL, United States",
        "to_full": "West Palm Beach, FL, United States",
        "confidence": "high"
      },
      "flight_data": {
        "flight_number": "",
        "iidd": "2875",
        "confidence": "high"
      },
      "passengers": [
        {
          "name": "Kristy Rodgers",
          "code": "KR",
          "type": "identified",
          "notable": true,
          "confidence": "high"
        }
      ],
      "data_source": "Flight Log",
      "source_chunk": "041-050",
      "v3_flight_id": "chunk_041-050_p003_r0020"
    },
    {
      "date": {
        "original": "03/04/2001",
        "parsed": "2001-03-04",
        "display": "03/04/2001",
        "confidence": "high"
      },
      "aircraft": {
        "make_model": "C-421B",
        "tail_number": "N908GM",
        "type": "Fixed Wing",
        "seats": 8,
        "confidence": "high"
      },
      "route": {
        "from": "LEE",
        "to": "PBI",
        "from_codes": [
          "LEE"
        ],
        "to_codes": [
          "PBI"
        ],
        "from_full": "Leesburg, FL, United States",
        "to_full": "West Palm Beach, FL, United States",
        "confidence": "high"
      },
      "flight_data": {
        "flight_number": "",
        "iidd": "3353",
        "confidence": "high"
      },
      "passengers": [
        {
          "name": "Chris Wagner",
          "code": "CW",
          "type": "identified",
          "notable": true,
          "confidence": "high"
        }
      ],
      "data_source": "Flight Log",
      "source_chunk": "041-050",
      "v3_flight_id": "chunk_041-050_p003_r0021"
    },
    {
      "date": {
        "original": "03/05/2001",
        "parsed": "2001-03-05",
        "display": "03/05/2001",
        "confidence": "high"
      },
      "aircraft": {
        "make_model": "G-1159B",
        "tail_number": "N909JE",
        "type": "Jet",
        "seats": 22,
        "confidence": "high"
      },
      "route": {
        "from": "PBI",
        "to": "CYJT",
        "from_codes": [
          "PBI"
        ],
        "to_codes": [
          "CYJT"
        ],
        "from_full": "West Palm Beach, FL, United States",
        "to_full": "Stephenville, Newfoundland, Canada",
        "confidence": "high"
      },
      "flight_data": {
        "flight_number": "1464",
        "iidd": "2876",
        "confidence": "high"
      },
      "passengers": [
        {
          "name": "Jeff Epstein",
          "code": "JE",
          "type": "identified",
          "notable": true,
          "confidence": "high"
        },
        {
          "name": "Ghislaine Maxwell",
          "code": "GM",
          "type": "identified",
          "notable": true,
          "confidence": "high"
        },
        {
          "name": "Emmy Tayler",
          "code": "ET",
          "type": "identified",
          "notable": true,
          "confidence": "high"
        },
        {
          "name": "Virginia Roberts",
          "code": "VR",
          "type": "identified",
          "notable": true,
          "confidence": "high"
        },
        {
          "name": "Gary Roxburgh",
          "code": "GR",
          "type": "identified",
          "notable": true,
          "confidence": "high"
        }
      ],
      "data_source": "Flight Log",
      "source_chunk": "041-050",
      "v3_flight_id": "chunk_041-050_p003_r0022"
    },
    {
      "date": {
        "original": "03/06/2001",
        "parsed": "2001-03-06",
        "display": "03/06/2001",
        "confidence": "high"
      },
      "aircraft": {
        "make_model": "G-1159B",
        "tail_number": "N909JE",
        "type": "Jet",
        "seats": 22,
        "confidence": "high"
      },
      "route": {
        "from": "CYJT",
        "to": "LFPB",
        "from_codes": [
          "CYJT"
        ],
        "to_codes": [
          "LFPB"
        ],
        "from_full": "Stephenville, Newfoundland, Canada",
        "to_full": "Paris, France",
        "confidence": "high"
      },
      "flight_data": {
        "flight_number": "1465",
        "iidd": "2881",
        "confidence": "high"
      },
      "passengers": [
        {
          "name": "Jeff Epstein",
          "code": "JE",
          "type": "identified",
          "notable": true,
          "confidence": "high"
        },
        {
          "name": "Ghislaine Maxwell",
          "code": "GM",
          "type": "identified",
          "notable": true,
          "confidence": "high"
        },
        {
          "name": "Emmy Tayler",
          "code": "ET",
          "type": "identified",
          "notable": true,
          "confidence": "high"
        },
        {
          "name": "Virginia Roberts",
          "code": "VR",
          "type": "identified",
          "notable": true,
          "confidence": "high"
        },
        {
          "name": "Gary Roxburgh",
          "code": "GR",
          "type": "identified",
          "notable": true,
          "confidence": "high"
        }
      ],
      "data_source": "Flight Log",
      "source_chunk": "041-050",
      "v3_flight_id": "chunk_041-050_p003_r0027"
    },
    {
      "date": {
        "original": "03/08/2001",
        "parsed": "2001-03-08",
        "display": "03/08/2001",
        "confidence": "high"
      },
      "aircraft": {
        "make_model": "G-1159B",
        "tail_number": "N909JE",
        "type": "Jet",
        "seats": 22,
        "confidence": "high"
      },
      "route": {
        "from": "LFPB",
        "to": "LEGR",
        "from_codes": [
          "LFPB"
        ],
        "to_codes": [
          "LEGR"
        ],
        "from_full": "Paris, France",
        "to_full": "Granada, Spain",
        "confidence": "high"
      },
      "flight_data": {
        "flight_number": "1466",
        "iidd": "2886",
        "confidence": "high"
      },
      "passengers": [
        {
          "name": "Jeff Epstein",
          "code": "JE",
          "type": "identified",
          "notable": true,
          "confidence": "high"
        },
        {
          "name": "Ghislaine Maxwell",
          "code": "GM",
          "type": "identified",
          "notable": true,
          "confidence": "high"
        },
        {
          "name": "Emmy Tayler",
          "code": "ET",
          "type": "identified",
          "notable": true,
          "confidence": "high"
        },
        {
          "name": "Virginia Roberts",
          "code": "VR",
          "type": "identified",
          "notable": true,
          "confidence": "high"
        },
        {
          "name": "Alberto Pinto",
          "code": "AP",
          "type": "identified",
          "notable": true,
          "confidence": "high"
        },
        {
          "name": "Linda Pinto",
          "code": "LP",
          "type": "identified",
          "notable": true,
          "confidence": "high"
        },
        {
          "name": "Female (1)",
          "code": "?",
          "type": "unidentified",
          "notable": false,
          "confidence": "high"
        },
        {
          "name": "Ricardo Legoretta",
          "code": "RL",
          "type": "identified",
          "notable": true,
          "confidence": "high"
        },
        {
          "name": "Roger ?",
          "code": "R?",
          "type": "unidentified",
          "notable": false,
          "confidence": "high"
        }
      ],
      "data_source": "Flight Log",
      "source_chunk": "041-050",
      "v3_flight_id": "chunk_041-050_p003_r0032"
    }
  ]
}