{
  "page_number": 43,
  "source": "v3_flight_logs_pdf",
  "extraction_date": "2025-10-28T17:58:03.062698",
  "chunk": "chunk_001-010",
  "flights": [
    {
      "date": {
        "original": "06/18/1996",
        "parsed": "1996-06-18",
        "display": "06/18/1996",
        "confidence": "high"
      },
      "aircraft": {
        "make_model": "G-1159B",
        "tail_number": "N908JE",
        "type": "Jet",
        "seats": 22,
        "confidence": "high"
      },
      "route": {
        "from": "PBI",
        "to": "TEB",
        "from_codes": [
          "PBI"
        ],
        "to_codes": [
          "TEB"
        ],
        "from_full": "West Palm Beach, FL, United States",
        "to_full": "Teterboro, NJ, United States",
        "confidence": "high"
      },
      "flight_data": {
        "flight_number": "850",
        "iidd": "4465",
        "confidence": "high"
      },
      "passengers": [
        {
          "name": "No Passengers",
          "code": "NP",
          "type": "unidentified",
          "notable": false,
          "confidence": "high"
        }
      ],
      "data_source": "Flight Log",
      "source_chunk": "001-010",
      "v3_flight_id": "chunk_001-010_p005_r0004"
    },
    {
      "date": {
        "original": "06/19/1996",
        "parsed": "1996-06-19",
        "display": "06/19/1996",
        "confidence": "high"
      },
      "aircraft": {
        "make_model": "G-1159B",
        "tail_number": "N908JE",
        "type": "Jet",
        "seats": 22,
        "confidence": "high"
      },
      "route": {
        "from": "TEB",
        "to": "SAF",
        "from_codes": [
          "TEB"
        ],
        "to_codes": [
          "SAF"
        ],
        "from_full": "Teterboro, NJ, United States",
        "to_full": "Santa Fe, NM, United States",
        "confidence": "high"
      },
      "flight_data": {
        "flight_number": "851",
        "iidd": "4466",
        "confidence": "high"
      },
      "passengers": [
        {
          "name": "Jeff Epstein",
          "code": "JE",
          "type": "identified",
          "notable": true,
          "confidence": "high"
        },
        {
          "name": "Ghislaine Maxwell",
          "code": "GM",
          "type": "identified",
          "notable": true,
          "confidence": "high"
        }
      ],
      "data_source": "Flight Log",
      "source_chunk": "001-010",
      "v3_flight_id": "chunk_001-010_p005_r0005"
    },
    {
      "date": {
        "original": "07/09/1996",
        "parsed": "1996-07-09",
        "display": "07/09/1996",
        "confidence": "high"
      },
      "aircraft": {
        "make_model": "G-1159B",
        "tail_number": "N908JE",
        "type": "Jet",
        "seats": 22,
        "confidence": "high"
      },
      "route": {
        "from": "SAF",
        "to": "CMH",
        "from_codes": [
          "SAF"
        ],
        "to_codes": [
          "CMH"
        ],
        "from_full": "Santa Fe, NM, United States",
        "to_full": "Columbus, OH, United States",
        "confidence": "high"
      },
      "flight_data": {
        "flight_number": "860",
        "iidd": "4468",
        "confidence": "high"
      },
      "passengers": [
        {
          "name": "Jeff Epstein",
          "code": "JE",
          "type": "identified",
          "notable": true,
          "confidence": "high"
        },
        {
          "name": "Ghislaine Maxwell",
          "code": "GM",
          "type": "identified",
          "notable": true,
          "confidence": "high"
        }
      ],
      "data_source": "Flight Log",
      "source_chunk": "001-010",
      "v3_flight_id": "chunk_001-010_p005_r0007"
    },
    {
      "date": {
        "original": "07/10/1996",
        "parsed": "1996-07-10",
        "display": "07/10/1996",
        "confidence": "high"
      },
      "aircraft": {
        "make_model": "G-1159B",
        "tail_number": "N908JE",
        "type": "Jet",
        "seats": 22,
        "confidence": "high"
      },
      "route": {
        "from": "CMH",
        "to": "TEB",
        "from_codes": [
          "CMH"
        ],
        "to_codes": [
          "TEB"
        ],
        "from_full": "Columbus, OH, United States",
        "to_full": "Teterboro, NJ, United States",
        "confidence": "high"
      },
      "flight_data": {
        "flight_number": "861",
        "iidd": "4470",
        "confidence": "high"
      },
      "passengers": [
        {
          "name": "Jeff Epstein",
          "code": "JE",
          "type": "identified",
          "notable": true,
          "confidence": "high"
        },
        {
          "name": "Ghislaine Maxwell",
          "code": "GM",
          "type": "identified",
          "notable": true,
          "confidence": "high"
        },
        {
          "name": "Ira Zicherman",
          "code": "IZ",
          "type": "identified",
          "notable": true,
          "confidence": "high"
        }
      ],
      "data_source": "Flight Log",
      "source_chunk": "001-010",
      "v3_flight_id": "chunk_001-010_p005_r0009"
    },
    {
      "date": {
        "original": "07/12/1996",
        "parsed": "1996-07-12",
        "display": "07/12/1996",
        "confidence": "high"
      },
      "aircraft": {
        "make_model": "G-1159B",
        "tail_number": "N908JE",
        "type": "Jet",
        "seats": 22,
        "confidence": "high"
      },
      "route": {
        "from": "TEB",
        "to": "MVY",
        "from_codes": [
          "TEB"
        ],
        "to_codes": [
          "MVY"
        ],
        "from_full": "Teterboro, NJ, United States",
        "to_full": "Martha's Vineyard, MA, United States",
        "confidence": "high"
      },
      "flight_data": {
        "flight_number": "862",
        "iidd": "4473",
        "confidence": "high"
      },
      "passengers": [
        {
          "name": "Jeff Epstein",
          "code": "JE",
          "type": "identified",
          "notable": true,
          "confidence": "high"
        }
      ],
      "data_source": "Flight Log",
      "source_chunk": "001-010",
      "v3_flight_id": "chunk_001-010_p005_r0012"
    },
    {
      "date": {
        "original": "07/12/1996",
        "parsed": "1996-07-12",
        "display": "07/12/1996",
        "confidence": "high"
      },
      "aircraft": {
        "make_model": "G-1159B",
        "tail_number": "N908JE",
        "type": "Jet",
        "seats": 22,
        "confidence": "high"
      },
      "route": {
        "from": "MVY",
        "to": "TEB",
        "from_codes": [
          "MVY"
        ],
        "to_codes": [
          "TEB"
        ],
        "from_full": "Martha's Vineyard, MA, United States",
        "to_full": "Teterboro, NJ, United States",
        "confidence": "high"
      },
      "flight_data": {
        "flight_number": "863",
        "iidd": "4474",
        "confidence": "high"
      },
      "passengers": [
        {
          "name": "Jeff Epstein",
          "code": "JE",
          "type": "identified",
          "notable": true,
          "confidence": "high"
        }
      ],
      "data_source": "Flight Log",
      "source_chunk": "001-010",
      "v3_flight_id": "chunk_001-010_p005_r0013"
    },
    {
      "date": {
        "original": "07/12/1996",
        "parsed": "1996-07-12",
        "display": "07/12/1996",
        "confidence": "high"
      },
      "aircraft": {
        "make_model": "G-1159B",
        "tail_number": "N908JE",
        "type": "Jet",
        "seats": 22,
        "confidence": "high"
      },
      "route": {
        "from": "TEB",
        "to": "PBI",
        "from_codes": [
          "TEB"
        ],
        "to_codes": [
          "PBI"
        ],
        "from_full": "Teterboro, NJ, United States",
        "to_full": "West Palm Beach, FL, United States",
        "confidence": "high"
      },
      "flight_data": {
        "flight_number": "864",
        "iidd": "4475",
        "confidence": "high"
      },
      "passengers": [
        {
          "name": "Jeff Epstein",
          "code": "JE",
          "type": "identified",
          "notable": true,
          "confidence": "high"
        },
        {
          "name": "Ghislaine Maxwell",
          "code": "GM",
          "type": "identified",
          "notable": true,
          "confidence": "high"
        }
      ],
      "data_source": "Flight Log",
      "source_chunk": "001-010",
      "v3_flight_id": "chunk_001-010_p005_r0014"
    },
    {
      "date": {
        "original": "07/15/1996",
        "parsed": "1996-07-15",
        "display": "07/15/1996",
        "confidence": "high"
      },
      "aircraft": {
        "make_model": "G-1159B",
        "tail_number": "N908JE",
        "type": "Jet",
        "seats": 22,
        "confidence": "high"
      },
      "route": {
        "from": "PBI",
        "to": "TEB",
        "from_codes": [
          "PBI"
        ],
        "to_codes": [
          "TEB"
        ],
        "from_full": "West Palm Beach, FL, United States",
        "to_full": "Teterboro, NJ, United States",
        "confidence": "high"
      },
      "flight_data": {
        "flight_number": "865",
        "iidd": "4477",
        "confidence": "high"
      },
      "passengers": [
        {
          "name": "Jeff Epstein",
          "code": "JE",
          "type": "identified",
          "notable": true,
          "confidence": "high"
        },
        {
          "name": "Ghislaine Maxwell",
          "code": "GM",
          "type": "identified",
          "notable": true,
          "confidence": "high"
        }
      ],
      "data_source": "Flight Log",
      "source_chunk": "001-010",
      "v3_flight_id": "chunk_001-010_p005_r0016"
    },
    {
      "date": {
        "original": "07/16/1996",
        "parsed": "1996-07-16",
        "display": "07/16/1996",
        "confidence": "high"
      },
      "aircraft": {
        "make_model": "G-1159B",
        "tail_number": "N908JE",
        "type": "Jet",
        "seats": 22,
        "confidence": "high"
      },
      "route": {
        "from": "TEB",
        "to": "PBI",
        "from_codes": [
          "TEB"
        ],
        "to_codes": [
          "PBI"
        ],
        "from_full": "Teterboro, NJ, United States",
        "to_full": "West Palm Beach, FL, United States",
        "confidence": "high"
      },
      "flight_data": {
        "flight_number": "866",
        "iidd": "4479",
        "confidence": "high"
      },
      "passengers": [
        {
          "name": "Jeff Epstein",
          "code": "JE",
          "type": "identified",
          "notable": true,
          "confidence": "high"
        },
        {
          "name": "Celina ?",
          "code": "C?",
          "type": "unidentified",
          "notable": false,
          "confidence": "high"
        }
      ],
      "data_source": "Flight Log",
      "source_chunk": "001-010",
      "v3_flight_id": "chunk_001-010_p005_r0018"
    },
    {
      "date": {
        "original": "07/17/1996",
        "parsed": "1996-07-17",
        "display": "07/17/1996",
        "confidence": "high"
      },
      "aircraft": {
        "make_model": "G-1159B",
        "tail_number": "N908JE",
        "type": "Jet",
        "seats": 22,
        "confidence": "high"
      },
      "route": {
        "from": "PBI",
        "to": "SAV",
        "from_codes": [
          "PBI"
        ],
        "to_codes": [
          "SAV"
        ],
        "from_full": "West Palm Beach, FL, United States",
        "to_full": "Savannah, GA, United States",
        "confidence": "high"
      },
      "flight_data": {
        "flight_number": "867",
        "iidd": "4481",
        "confidence": "high"
      },
      "passengers": [
        {
          "name": "Inspection",
          "code": "?",
          "type": "unidentified",
          "notable": false,
          "confidence": "high"
        }
      ],
      "data_source": "Flight Log",
      "source_chunk": "001-010",
      "v3_flight_id": "chunk_001-010_p005_r0020"
    },
    {
      "date": {
        "original": "08/03/1996",
        "parsed": "1996-08-03",
        "display": "08/03/1996",
        "confidence": "high"
      },
      "aircraft": {
        "make_model": "G-1159B",
        "tail_number": "N908JE",
        "type": "Jet",
        "seats": 22,
        "confidence": "high"
      },
      "route": {
        "from": "SAV",
        "to": "EWR",
        "from_codes": [
          "SAV"
        ],
        "to_codes": [
          "EWR"
        ],
        "from_full": "Savannah, GA, United States",
        "to_full": "Newark, NJ, United States",
        "confidence": "high"
      },
      "flight_data": {
        "flight_number": "868",
        "iidd": "4482",
        "confidence": "high"
      },
      "passengers": [
        {
          "name": "Inspection",
          "code": "?",
          "type": "unidentified",
          "notable": false,
          "confidence": "high"
        }
      ],
      "data_source": "Flight Log",
      "source_chunk": "001-010",
      "v3_flight_id": "chunk_001-010_p005_r0021"
    },
    {
      "date": {
        "original": "08/12/1996",
        "parsed": "1996-08-12",
        "display": "08/12/1996",
        "confidence": "high"
      },
      "aircraft": {
        "make_model": "G-1159B",
        "tail_number": "N908JE",
        "type": "Jet",
        "seats": 22,
        "confidence": "high"
      },
      "route": {
        "from": "PBI",
        "to": "TEB",
        "from_codes": [
          "PBI"
        ],
        "to_codes": [
          "TEB"
        ],
        "from_full": "West Palm Beach, FL, United States",
        "to_full": "Teterboro, NJ, United States",
        "confidence": "high"
      },
      "flight_data": {
        "flight_number": "873",
        "iidd": "4483",
        "confidence": "high"
      },
      "passengers": [
        {
          "name": "Jeff Epstein",
          "code": "JE",
          "type": "identified",
          "notable": true,
          "confidence": "high"
        },
        {
          "name": "Ghislaine Maxwell",
          "code": "GM",
          "type": "identified",
          "notable": true,
          "confidence": "high"
        },
        {
          "name": "Andy ?",
          "code": "A?",
          "type": "unidentified",
          "notable": false,
          "confidence": "high"
        },
        {
          "name": "Mandy ?",
          "code": "M?",
          "type": "unidentified",
          "notable": false,
          "confidence": "high"
        },
        {
          "name": "Ralph ?",
          "code": "R?",
          "type": "unidentified",
          "notable": false,
          "confidence": "high"
        }
      ],
      "data_source": "Flight Log",
      "source_chunk": "001-010",
      "v3_flight_id": "chunk_001-010_p005_r0022"
    },
    {
      "date": {
        "original": "08/14/1996",
        "parsed": "1996-08-14",
        "display": "08/14/1996",
        "confidence": "high"
      },
      "aircraft": {
        "make_model": "G-1159B",
        "tail_number": "N908JE",
        "type": "Jet",
        "seats": 22,
        "confidence": "high"
      },
      "route": {
        "from": "TEB",
        "to": "TVC",
        "from_codes": [
          "TEB"
        ],
        "to_codes": [
          "TVC"
        ],
        "from_full": "Teterboro, NJ, United States",
        "to_full": "Traverse City, MI, United States",
        "confidence": "high"
      },
      "flight_data": {
        "flight_number": "874",
        "iidd": "4488",
        "confidence": "high"
      },
      "passengers": [
        {
          "name": "Jeff Epstein",
          "code": "JE",
          "type": "identified",
          "notable": true,
          "confidence": "high"
        },
        {
          "name": "Ghislaine Maxwell",
          "code": "GM",
          "type": "identified",
          "notable": true,
          "confidence": "high"
        }
      ],
      "data_source": "Flight Log",
      "source_chunk": "001-010",
      "v3_flight_id": "chunk_001-010_p005_r0027"
    },
    {
      "date": {
        "original": "08/16/1996",
        "parsed": "1996-08-16",
        "display": "08/16/1996",
        "confidence": "high"
      },
      "aircraft": {
        "make_model": "G-1159B",
        "tail_number": "N908JE",
        "type": "Jet",
        "seats": 22,
        "confidence": "high"
      },
      "route": {
        "from": "TVC",
        "to": "TEB",
        "from_codes": [
          "TVC"
        ],
        "to_codes": [
          "TEB"
        ],
        "from_full": "Traverse City, MI, United States",
        "to_full": "Teterboro, NJ, United States",
        "confidence": "high"
      },
      "flight_data": {
        "flight_number": "875",
        "iidd": "4490",
        "confidence": "high"
      },
      "passengers": [
        {
          "name": "Jeff Epstein",
          "code": "JE",
          "type": "identified",
          "notable": true,
          "confidence": "high"
        },
        {
          "name": "Ghislaine Maxwell",
          "code": "GM",
          "type": "identified",
          "notable": true,
          "confidence": "high"
        }
      ],
      "data_source": "Flight Log",
      "source_chunk": "001-010",
      "v3_flight_id": "chunk_001-010_p005_r0029"
    },
    {
      "date": {
        "original": "08/18/1996",
        "parsed": "1996-08-18",
        "display": "08/18/1996",
        "confidence": "high"
      },
      "aircraft": {
        "make_model": "G-1159B",
        "tail_number": "N908JE",
        "type": "Jet",
        "seats": 22,
        "confidence": "high"
      },
      "route": {
        "from": "TEB",
        "to": "MVY",
        "from_codes": [
          "TEB"
        ],
        "to_codes": [
          "MVY"
        ],
        "from_full": "Teterboro, NJ, United States",
        "to_full": "Martha's Vineyard, MA, United States",
        "confidence": "high"
      },
      "flight_data": {
        "flight_number": "876",
        "iidd": "4492",
        "confidence": "high"
      },
      "passengers": [
        {
          "name": "Jeff Epstein",
          "code": "JE",
          "type": "identified",
          "notable": true,
          "confidence": "high"
        },
        {
          "name": "Ghislaine Maxwell",
          "code": "GM",
          "type": "identified",
          "notable": true,
          "confidence": "high"
        },
        {
          "name": "David Rothman",
          "code": "DR",
          "type": "identified",
          "notable": true,
          "confidence": "high"
        },
        {
          "name": "Felicia Taylor",
          "code": "FT",
          "type": "identified",
          "notable": true,
          "confidence": "high"
        },
        {
          "name": "Passenger (2)",
          "code": "?",
          "type": "unidentified",
          "notable": false,
          "confidence": "high"
        }
      ],
      "data_source": "Flight Log",
      "source_chunk": "001-010",
      "v3_flight_id": "chunk_001-010_p005_r0031"
    },
    {
      "date": {
        "original": "08/18/1996",
        "parsed": "1996-08-18",
        "display": "08/18/1996",
        "confidence": "high"
      },
      "aircraft": {
        "make_model": "G-1159B",
        "tail_number": "N908JE",
        "type": "Jet",
        "seats": 22,
        "confidence": "high"
      },
      "route": {
        "from": "MVY",
        "to": "TEB",
        "from_codes": [
          "MVY"
        ],
        "to_codes": [
          "TEB"
        ],
        "from_full": "Martha's Vineyard, MA, United States",
        "to_full": "Teterboro, NJ, United States",
        "confidence": "high"
      },
      "flight_data": {
        "flight_number": "877",
        "iidd": "4497",
        "confidence": "high"
      },
      "passengers": [
        {
          "name": "Jeff Epstein",
          "code": "JE",
          "type": "identified",
          "notable": true,
          "confidence": "high"
        },
        {
          "name": "David Rothman",
          "code": "DR",
          "type": "identified",
          "notable": true,
          "confidence": "high"
        },
        {
          "name": "Felicia Taylor",
          "code": "FT",
          "type": "identified",
          "notable": true,
          "confidence": "high"
        },
        {
          "name": "Passenger (1)",
          "code": "?",
          "type": "unidentified",
          "notable": false,
          "confidence": "high"
        }
      ],
      "data_source": "Flight Log",
      "source_chunk": "001-010",
      "v3_flight_id": "chunk_001-010_p005_r0036"
    },
    {
      "date": {
        "original": "08/18/1996",
        "parsed": "1996-08-18",
        "display": "08/18/1996",
        "confidence": "high"
      },
      "aircraft": {
        "make_model": "G-1159B",
        "tail_number": "N908JE",
        "type": "Jet",
        "seats": 22,
        "confidence": "high"
      },
      "route": {
        "from": "TEB",
        "to": "PBI",
        "from_codes": [
          "TEB"
        ],
        "to_codes": [
          "PBI"
        ],
        "from_full": "Teterboro, NJ, United States",
        "to_full": "West Palm Beach, FL, United States",
        "confidence": "high"
      },
      "flight_data": {
        "flight_number": "878",
        "iidd": "4501",
        "confidence": "high"
      },
      "passengers": [
        {
          "name": "Jeff Epstein",
          "code": "JE",
          "type": "identified",
          "notable": true,
          "confidence": "high"
        },
        {
          "name": "Celina Midelfart",
          "code": "CM",
          "type": "identified",
          "notable": true,
          "confidence": "high"
        }
      ],
      "data_source": "Flight Log",
      "source_chunk": "001-010",
      "v3_flight_id": "chunk_001-010_p005_r0040"
    }
  ]
}