{
  "page_number": 40,
  "source": "v3_flight_logs_pdf",
  "extraction_date": "2025-10-28T17:58:03.062698",
  "chunk": "chunk_001-010",
  "flights": [
    {
      "date": {
        "original": "01/31/1996",
        "parsed": "1996-01-31",
        "display": "01/31/1996",
        "confidence": "high"
      },
      "aircraft": {
        "make_model": "G-1159B",
        "tail_number": "N908JE",
        "type": "Jet",
        "seats": 22,
        "confidence": "high"
      },
      "route": {
        "from": "TEB",
        "to": "PBI",
        "from_codes": [
          "TEB"
        ],
        "to_codes": [
          "PBI"
        ],
        "from_full": "Teterboro, NJ, United States",
        "to_full": "West Palm Beach, FL, United States",
        "confidence": "high"
      },
      "flight_data": {
        "flight_number": "801",
        "iidd": "4326",
        "confidence": "high"
      },
      "passengers": [
        {
          "name": "Jeff Epstein",
          "code": "JE",
          "type": "identified",
          "notable": true,
          "confidence": "high"
        }
      ],
      "data_source": "Flight Log",
      "source_chunk": "001-010",
      "v3_flight_id": "chunk_001-010_p002_r0002"
    },
    {
      "date": {
        "original": "02/05/1996",
        "parsed": "1996-02-05",
        "display": "02/05/1996",
        "confidence": "high"
      },
      "aircraft": {
        "make_model": "G-1159B",
        "tail_number": "N908JE",
        "type": "Jet",
        "seats": 22,
        "confidence": "high"
      },
      "route": {
        "from": "PBI",
        "to": "TNCM",
        "from_codes": [
          "PBI"
        ],
        "to_codes": [
          "TNCM"
        ],
        "from_full": "West Palm Beach, FL, United States",
        "to_full": "Philipsburg, Netherlands Antilles",
        "confidence": "high"
      },
      "flight_data": {
        "flight_number": "802",
        "iidd": "4327",
        "confidence": "high"
      },
      "passengers": [
        {
          "name": "Jeff Epstein",
          "code": "JE",
          "type": "identified",
          "notable": true,
          "confidence": "high"
        },
        {
          "name": "Ghislaine Maxwell",
          "code": "GM",
          "type": "identified",
          "notable": true,
          "confidence": "high"
        }
      ],
      "data_source": "Flight Log",
      "source_chunk": "001-010",
      "v3_flight_id": "chunk_001-010_p002_r0003"
    },
    {
      "date": {
        "original": "02/07/1996",
        "parsed": "1996-02-07",
        "display": "02/07/1996",
        "confidence": "high"
      },
      "aircraft": {
        "make_model": "G-1159B",
        "tail_number": "N908JE",
        "type": "Jet",
        "seats": 22,
        "confidence": "high"
      },
      "route": {
        "from": "TNCM",
        "to": "TEB",
        "from_codes": [
          "TNCM"
        ],
        "to_codes": [
          "TEB"
        ],
        "from_full": "Philipsburg, Netherlands Antilles",
        "to_full": "Teterboro, NJ, United States",
        "confidence": "high"
      },
      "flight_data": {
        "flight_number": "803",
        "iidd": "4329",
        "confidence": "high"
      },
      "passengers": [
        {
          "name": "Jeff Epstein",
          "code": "JE",
          "type": "identified",
          "notable": true,
          "confidence": "high"
        },
        {
          "name": "Ghislaine Maxwell",
          "code": "GM",
          "type": "identified",
          "notable": true,
          "confidence": "high"
        }
      ],
      "data_source": "Flight Log",
      "source_chunk": "001-010",
      "v3_flight_id": "chunk_001-010_p002_r0005"
    },
    {
      "date": {
        "original": "02/09/1996",
        "parsed": "1996-02-09",
        "display": "02/09/1996",
        "confidence": "high"
      },
      "aircraft": {
        "make_model": "G-1159B",
        "tail_number": "N908JE",
        "type": "Jet",
        "seats": 22,
        "confidence": "high"
      },
      "route": {
        "from": "TEB",
        "to": "PBI",
        "from_codes": [
          "TEB"
        ],
        "to_codes": [
          "PBI"
        ],
        "from_full": "Teterboro, NJ, United States",
        "to_full": "West Palm Beach, FL, United States",
        "confidence": "high"
      },
      "flight_data": {
        "flight_number": "804",
        "iidd": "4331",
        "confidence": "high"
      },
      "passengers": [
        {
          "name": "Jeff Epstein",
          "code": "JE",
          "type": "identified",
          "notable": true,
          "confidence": "high"
        },
        {
          "name": "Ghislaine Maxwell",
          "code": "GM",
          "type": "identified",
          "notable": true,
          "confidence": "high"
        },
        {
          "name": "Sharon Reynolds",
          "code": "SR",
          "type": "identified",
          "notable": true,
          "confidence": "high"
        }
      ],
      "data_source": "Flight Log",
      "source_chunk": "001-010",
      "v3_flight_id": "chunk_001-010_p002_r0007"
    },
    {
      "date": {
        "original": "02/12/1996",
        "parsed": "1996-02-12",
        "display": "02/12/1996",
        "confidence": "high"
      },
      "aircraft": {
        "make_model": "G-1159B",
        "tail_number": "N908JE",
        "type": "Jet",
        "seats": 22,
        "confidence": "high"
      },
      "route": {
        "from": "PBI",
        "to": "TEB",
        "from_codes": [
          "PBI"
        ],
        "to_codes": [
          "TEB"
        ],
        "from_full": "West Palm Beach, FL, United States",
        "to_full": "Teterboro, NJ, United States",
        "confidence": "high"
      },
      "flight_data": {
        "flight_number": "805",
        "iidd": "4334",
        "confidence": "high"
      },
      "passengers": [
        {
          "name": "Jeff Epstein",
          "code": "JE",
          "type": "identified",
          "notable": true,
          "confidence": "high"
        },
        {
          "name": "Ghislaine Maxwell",
          "code": "GM",
          "type": "identified",
          "notable": true,
          "confidence": "high"
        },
        {
          "name": "Sharon Reynolds",
          "code": "SR",
          "type": "identified",
          "notable": true,
          "confidence": "high"
        }
      ],
      "data_source": "Flight Log",
      "source_chunk": "001-010",
      "v3_flight_id": "chunk_001-010_p002_r0010"
    },
    {
      "date": {
        "original": "02/15/1996",
        "parsed": "1996-02-15",
        "display": "02/15/1996",
        "confidence": "high"
      },
      "aircraft": {
        "make_model": "G-1159B",
        "tail_number": "N908JE",
        "type": "Jet",
        "seats": 22,
        "confidence": "high"
      },
      "route": {
        "from": "TEB",
        "to": "BCT",
        "from_codes": [
          "TEB"
        ],
        "to_codes": [
          "BCT"
        ],
        "from_full": "Teterboro, NJ, United States",
        "to_full": "Boca Raton, FL, United States",
        "confidence": "high"
      },
      "flight_data": {
        "flight_number": "806",
        "iidd": "4337",
        "confidence": "high"
      },
      "passengers": [
        {
          "name": "Jim Cayne",
          "code": "JC",
          "type": "identified",
          "notable": true,
          "confidence": "high"
        },
        {
          "name": "Patricia Cayne",
          "code": "PC",
          "type": "identified",
          "notable": true,
          "confidence": "high"
        },
        {
          "name": "Alison Cayne",
          "code": "AC",
          "type": "identified",
          "notable": true,
          "confidence": "high"
        },
        {
          "name": "Warren ?",
          "code": "W?",
          "type": "unidentified",
          "notable": false,
          "confidence": "high"
        },
        {
          "name": "Karv Deweidy",
          "code": "KD",
          "type": "identified",
          "notable": true,
          "confidence": "high"
        },
        {
          "name": "Sophie Biddle",
          "code": "SB",
          "type": "identified",
          "notable": true,
          "confidence": "high"
        },
        {
          "name": "Passenger (1)",
          "code": "?",
          "type": "unidentified",
          "notable": false,
          "confidence": "high"
        }
      ],
      "data_source": "Flight Log",
      "source_chunk": "001-010",
      "v3_flight_id": "chunk_001-010_p002_r0013"
    },
    {
      "date": {
        "original": "02/19/1996",
        "parsed": "1996-02-19",
        "display": "02/19/1996",
        "confidence": "high"
      },
      "aircraft": {
        "make_model": "G-1159B",
        "tail_number": "N908JE",
        "type": "Jet",
        "seats": 22,
        "confidence": "high"
      },
      "route": {
        "from": "BCT",
        "to": "TEB",
        "from_codes": [
          "BCT"
        ],
        "to_codes": [
          "TEB"
        ],
        "from_full": "Boca Raton, FL, United States",
        "to_full": "Teterboro, NJ, United States",
        "confidence": "high"
      },
      "flight_data": {
        "flight_number": "807",
        "iidd": "4344",
        "confidence": "high"
      },
      "passengers": [
        {
          "name": "Jim Cayne",
          "code": "JC",
          "type": "identified",
          "notable": true,
          "confidence": "high"
        },
        {
          "name": "Patricia Cayne",
          "code": "PC",
          "type": "identified",
          "notable": true,
          "confidence": "high"
        },
        {
          "name": "Alison Cayne",
          "code": "AC",
          "type": "identified",
          "notable": true,
          "confidence": "high"
        },
        {
          "name": "Warren ?",
          "code": "W?",
          "type": "unidentified",
          "notable": false,
          "confidence": "high"
        },
        {
          "name": "Sophie Biddle",
          "code": "SB",
          "type": "identified",
          "notable": true,
          "confidence": "high"
        },
        {
          "name": "Passenger (1)",
          "code": "?",
          "type": "unidentified",
          "notable": false,
          "confidence": "high"
        }
      ],
      "data_source": "Flight Log",
      "source_chunk": "001-010",
      "v3_flight_id": "chunk_001-010_p002_r0020"
    },
    {
      "date": {
        "original": "02/28/1996",
        "parsed": "1996-02-28",
        "display": "02/28/1996",
        "confidence": "high"
      },
      "aircraft": {
        "make_model": "G-1159B",
        "tail_number": "N908JE",
        "type": "Jet",
        "seats": 22,
        "confidence": "high"
      },
      "route": {
        "from": "TEB",
        "to": "PBI",
        "from_codes": [
          "TEB"
        ],
        "to_codes": [
          "PBI"
        ],
        "from_full": "Teterboro, NJ, United States",
        "to_full": "West Palm Beach, FL, United States",
        "confidence": "high"
      },
      "flight_data": {
        "flight_number": "808",
        "iidd": "4350",
        "confidence": "high"
      },
      "passengers": [
        {
          "name": "Jeff Epstein",
          "code": "JE",
          "type": "identified",
          "notable": true,
          "confidence": "high"
        },
        {
          "name": "Ghislaine Maxwell",
          "code": "GM",
          "type": "identified",
          "notable": true,
          "confidence": "high"
        },
        {
          "name": "A S",
          "code": "AS",
          "type": "unidentified",
          "notable": false,
          "confidence": "high"
        },
        {
          "name": "Sophie Biddle",
          "code": "SB",
          "type": "identified",
          "notable": true,
          "confidence": "high"
        }
      ],
      "data_source": "Flight Log",
      "source_chunk": "001-010",
      "v3_flight_id": "chunk_001-010_p002_r0026"
    },
    {
      "date": {
        "original": "03/04/1996",
        "parsed": "1996-03-04",
        "display": "03/04/1996",
        "confidence": "high"
      },
      "aircraft": {
        "make_model": "G-1159B",
        "tail_number": "N908JE",
        "type": "Jet",
        "seats": 22,
        "confidence": "high"
      },
      "route": {
        "from": "PBI",
        "to": "TEB",
        "from_codes": [
          "PBI"
        ],
        "to_codes": [
          "TEB"
        ],
        "from_full": "West Palm Beach, FL, United States",
        "to_full": "Teterboro, NJ, United States",
        "confidence": "high"
      },
      "flight_data": {
        "flight_number": "809",
        "iidd": "4354",
        "confidence": "high"
      },
      "passengers": [
        {
          "name": "Jeff Epstein",
          "code": "JE",
          "type": "identified",
          "notable": true,
          "confidence": "high"
        },
        {
          "name": "Ghislaine Maxwell",
          "code": "GM",
          "type": "identified",
          "notable": true,
          "confidence": "high"
        },
        {
          "name": "A S",
          "code": "AS",
          "type": "unidentified",
          "notable": false,
          "confidence": "high"
        },
        {
          "name": "Sophie Biddle",
          "code": "SB",
          "type": "identified",
          "notable": true,
          "confidence": "high"
        },
        {
          "name": "Maria ?",
          "code": "M?",
          "type": "unidentified",
          "notable": false,
          "confidence": "high"
        }
      ],
      "data_source": "Flight Log",
      "source_chunk": "001-010",
      "v3_flight_id": "chunk_001-010_p002_r0030"
    },
    {
      "date": {
        "original": "03/08/1996",
        "parsed": "1996-03-08",
        "display": "03/08/1996",
        "confidence": "high"
      },
      "aircraft": {
        "make_model": "G-1159B",
        "tail_number": "N908JE",
        "type": "Jet",
        "seats": 22,
        "confidence": "high"
      },
      "route": {
        "from": "TEB",
        "to": "PBI",
        "from_codes": [
          "TEB"
        ],
        "to_codes": [
          "PBI"
        ],
        "from_full": "Teterboro, NJ, United States",
        "to_full": "West Palm Beach, FL, United States",
        "confidence": "high"
      },
      "flight_data": {
        "flight_number": "810",
        "iidd": "4359",
        "confidence": "high"
      },
      "passengers": [
        {
          "name": "Jeff Epstein",
          "code": "JE",
          "type": "identified",
          "notable": true,
          "confidence": "high"
        },
        {
          "name": "Ghislaine Maxwell",
          "code": "GM",
          "type": "identified",
          "notable": true,
          "confidence": "high"
        },
        {
          "name": "A S",
          "code": "AS",
          "type": "unidentified",
          "notable": false,
          "confidence": "high"
        },
        {
          "name": "Diedri Neal",
          "code": "DN",
          "type": "identified",
          "notable": true,
          "confidence": "high"
        },
        {
          "name": "Female (1)",
          "code": "?",
          "type": "unidentified",
          "notable": false,
          "confidence": "high"
        }
      ],
      "data_source": "Flight Log",
      "source_chunk": "001-010",
      "v3_flight_id": "chunk_001-010_p002_r0035"
    },
    {
      "date": {
        "original": "03/11/1996",
        "parsed": "1996-03-11",
        "display": "03/11/1996",
        "confidence": "high"
      },
      "aircraft": {
        "make_model": "G-1159B",
        "tail_number": "N908JE",
        "type": "Jet",
        "seats": 22,
        "confidence": "high"
      },
      "route": {
        "from": "PBI",
        "to": "TEB",
        "from_codes": [
          "PBI"
        ],
        "to_codes": [
          "TEB"
        ],
        "from_full": "West Palm Beach, FL, United States",
        "to_full": "Teterboro, NJ, United States",
        "confidence": "high"
      },
      "flight_data": {
        "flight_number": "811",
        "iidd": "4364",
        "confidence": "high"
      },
      "passengers": [
        {
          "name": "Jeff Epstein",
          "code": "JE",
          "type": "identified",
          "notable": true,
          "confidence": "high"
        },
        {
          "name": "Ghislaine Maxwell",
          "code": "GM",
          "type": "identified",
          "notable": true,
          "confidence": "high"
        },
        {
          "name": "A S",
          "code": "AS",
          "type": "unidentified",
          "notable": false,
          "confidence": "high"
        },
        {
          "name": "Christine ?",
          "code": "C?",
          "type": "unidentified",
          "notable": false,
          "confidence": "high"
        },
        {
          "name": "Female (1)",
          "code": "?",
          "type": "unidentified",
          "notable": false,
          "confidence": "high"
        }
      ],
      "data_source": "Flight Log",
      "source_chunk": "001-010",
      "v3_flight_id": "chunk_001-010_p002_r0040"
    },
    {
      "date": {
        "original": "03/15/1996",
        "parsed": "1996-03-15",
        "display": "03/15/1996",
        "confidence": "high"
      },
      "aircraft": {
        "make_model": "G-1159B",
        "tail_number": "N908JE",
        "type": "Jet",
        "seats": 22,
        "confidence": "high"
      },
      "route": {
        "from": "TEB",
        "to": "PBI",
        "from_codes": [
          "TEB"
        ],
        "to_codes": [
          "PBI"
        ],
        "from_full": "Teterboro, NJ, United States",
        "to_full": "West Palm Beach, FL, United States",
        "confidence": "high"
      },
      "flight_data": {
        "flight_number": "812",
        "iidd": "4369",
        "confidence": "high"
      },
      "passengers": [
        {
          "name": "Jeff Epstein",
          "code": "JE",
          "type": "identified",
          "notable": true,
          "confidence": "high"
        },
        {
          "name": "Ghislaine Maxwell",
          "code": "GM",
          "type": "identified",
          "notable": true,
          "confidence": "high"
        },
        {
          "name": "A S",
          "code": "AS",
          "type": "unidentified",
          "notable": false,
          "confidence": "high"
        },
        {
          "name": "Female (1)",
          "code": "?",
          "type": "unidentified",
          "notable": false,
          "confidence": "high"
        }
      ],
      "data_source": "Flight Log",
      "source_chunk": "001-010",
      "v3_flight_id": "chunk_001-010_p002_r0045"
    }
  ]
}