{
  "page_number": 62,
  "source": "v3_flight_logs_pdf",
  "extraction_date": "2025-10-28T17:58:25.407056",
  "chunk": "chunk_021-030",
  "flights": [
    {
      "date": {
        "original": "08/29/1998",
        "parsed": "1998-08-29",
        "display": "08/29/1998",
        "confidence": "high"
      },
      "aircraft": {
        "make_model": "G-1159B",
        "tail_number": "N908JE",
        "type": "Jet",
        "seats": 22,
        "confidence": "high"
      },
      "route": {
        "from": "VNY",
        "to": "PBI",
        "from_codes": [
          "VNY"
        ],
        "to_codes": [
          "PBI"
        ],
        "from_full": "Van Nuys, CA, United States",
        "to_full": "West Palm Beach, FL, United States",
        "confidence": "high"
      },
      "flight_data": {
        "flight_number": "1152",
        "iidd": "3571",
        "confidence": "high"
      },
      "passengers": [
        {
          "name": "Jeff Epstein",
          "code": "JE",
          "type": "identified",
          "notable": true,
          "confidence": "high"
        }
      ],
      "data_source": "Flight Log",
      "source_chunk": "021-030",
      "v3_flight_id": "chunk_021-030_p004_r0003"
    },
    {
      "date": {
        "original": "09/01/1998",
        "parsed": "1998-09-01",
        "display": "09/01/1998",
        "confidence": "high"
      },
      "aircraft": {
        "make_model": "G-1159B",
        "tail_number": "N908JE",
        "type": "Jet",
        "seats": 22,
        "confidence": "high"
      },
      "route": {
        "from": "PBI",
        "to": "TEB",
        "from_codes": [
          "PBI"
        ],
        "to_codes": [
          "TEB"
        ],
        "from_full": "West Palm Beach, FL, United States",
        "to_full": "Teterboro, NJ, United States",
        "confidence": "high"
      },
      "flight_data": {
        "flight_number": "1153",
        "iidd": "3572",
        "confidence": "high"
      },
      "passengers": [
        {
          "name": "Jeff Epstein",
          "code": "JE",
          "type": "identified",
          "notable": true,
          "confidence": "high"
        },
        {
          "name": "Ghislaine Maxwell",
          "code": "GM",
          "type": "identified",
          "notable": true,
          "confidence": "high"
        }
      ],
      "data_source": "Flight Log",
      "source_chunk": "021-030",
      "v3_flight_id": "chunk_021-030_p004_r0004"
    },
    {
      "date": {
        "original": "09/04/1998",
        "parsed": "1998-09-04",
        "display": "09/04/1998",
        "confidence": "high"
      },
      "aircraft": {
        "make_model": "G-1159B",
        "tail_number": "N908JE",
        "type": "Jet",
        "seats": 22,
        "confidence": "high"
      },
      "route": {
        "from": "TEB",
        "to": "TIST",
        "from_codes": [
          "TEB"
        ],
        "to_codes": [
          "TIST"
        ],
        "from_full": "Teterboro, NJ, United States",
        "to_full": "Charlotte Amalie, St. Thomas, United States Virgin Islands",
        "confidence": "high"
      },
      "flight_data": {
        "flight_number": "1154",
        "iidd": "3574",
        "confidence": "high"
      },
      "passengers": [
        {
          "name": "Jeff Epstein",
          "code": "JE",
          "type": "identified",
          "notable": true,
          "confidence": "high"
        },
        {
          "name": "Ghislaine Maxwell",
          "code": "GM",
          "type": "identified",
          "notable": true,
          "confidence": "high"
        },
        {
          "name": "Emmy Tayler",
          "code": "ET",
          "type": "identified",
          "notable": true,
          "confidence": "high"
        }
      ],
      "data_source": "Flight Log",
      "source_chunk": "021-030",
      "v3_flight_id": "chunk_021-030_p004_r0006"
    },
    {
      "date": {
        "original": "09/04/1998",
        "parsed": "1998-09-04",
        "display": "09/04/1998",
        "confidence": "high"
      },
      "aircraft": {
        "make_model": "G-1159B",
        "tail_number": "N908JE",
        "type": "Jet",
        "seats": 22,
        "confidence": "high"
      },
      "route": {
        "from": "TIST",
        "to": "PBI",
        "from_codes": [
          "TIST"
        ],
        "to_codes": [
          "PBI"
        ],
        "from_full": "Charlotte Amalie, St. Thomas, United States Virgin Islands",
        "to_full": "West Palm Beach, FL, United States",
        "confidence": "high"
      },
      "flight_data": {
        "flight_number": "1155",
        "iidd": "3577",
        "confidence": "high"
      },
      "passengers": [
        {
          "name": "Jeff Epstein",
          "code": "JE",
          "type": "identified",
          "notable": true,
          "confidence": "high"
        },
        {
          "name": "Ghislaine Maxwell",
          "code": "GM",
          "type": "identified",
          "notable": true,
          "confidence": "high"
        },
        {
          "name": "Emmy Tayler",
          "code": "ET",
          "type": "identified",
          "notable": true,
          "confidence": "high"
        }
      ],
      "data_source": "Flight Log",
      "source_chunk": "021-030",
      "v3_flight_id": "chunk_021-030_p004_r0009"
    },
    {
      "date": {
        "original": "09/08/1998",
        "parsed": "1998-09-08",
        "display": "09/08/1998",
        "confidence": "high"
      },
      "aircraft": {
        "make_model": "G-1159B",
        "tail_number": "N908JE",
        "type": "Jet",
        "seats": 22,
        "confidence": "high"
      },
      "route": {
        "from": "PBI",
        "to": "TEB",
        "from_codes": [
          "PBI"
        ],
        "to_codes": [
          "TEB"
        ],
        "from_full": "West Palm Beach, FL, United States",
        "to_full": "Teterboro, NJ, United States",
        "confidence": "high"
      },
      "flight_data": {
        "flight_number": "1156",
        "iidd": "3580",
        "confidence": "high"
      },
      "passengers": [
        {
          "name": "Jeff Epstein",
          "code": "JE",
          "type": "identified",
          "notable": true,
          "confidence": "high"
        },
        {
          "name": "Ghislaine Maxwell",
          "code": "GM",
          "type": "identified",
          "notable": true,
          "confidence": "high"
        },
        {
          "name": "Emmy Tayler",
          "code": "ET",
          "type": "identified",
          "notable": true,
          "confidence": "high"
        },
        {
          "name": "Mandy Ellison",
          "code": "ME",
          "type": "identified",
          "notable": true,
          "confidence": "high"
        }
      ],
      "data_source": "Flight Log",
      "source_chunk": "021-030",
      "v3_flight_id": "chunk_021-030_p004_r0012"
    },
    {
      "date": {
        "original": "09/13/1998",
        "parsed": "1998-09-13",
        "display": "09/13/1998",
        "confidence": "high"
      },
      "aircraft": {
        "make_model": "G-1159B",
        "tail_number": "N908JE",
        "type": "Jet",
        "seats": 22,
        "confidence": "high"
      },
      "route": {
        "from": "TEB",
        "to": "SAF",
        "from_codes": [
          "TEB"
        ],
        "to_codes": [
          "SAF"
        ],
        "from_full": "Teterboro, NJ, United States",
        "to_full": "Santa Fe, NM, United States",
        "confidence": "high"
      },
      "flight_data": {
        "flight_number": "1157",
        "iidd": "3584",
        "confidence": "high"
      },
      "passengers": [
        {
          "name": "Jeff Epstein",
          "code": "JE",
          "type": "identified",
          "notable": true,
          "confidence": "high"
        },
        {
          "name": "Ghislaine Maxwell",
          "code": "GM",
          "type": "identified",
          "notable": true,
          "confidence": "high"
        },
        {
          "name": "Emmy Tayler",
          "code": "ET",
          "type": "identified",
          "notable": true,
          "confidence": "high"
        },
        {
          "name": "Alberto Pinto",
          "code": "AP",
          "type": "identified",
          "notable": true,
          "confidence": "high"
        },
        {
          "name": "Linda Pinto",
          "code": "LP",
          "type": "identified",
          "notable": true,
          "confidence": "high"
        }
      ],
      "data_source": "Flight Log",
      "source_chunk": "021-030",
      "v3_flight_id": "chunk_021-030_p004_r0016"
    },
    {
      "date": {
        "original": "09/17/1998",
        "parsed": "1998-09-17",
        "display": "09/17/1998",
        "confidence": "high"
      },
      "aircraft": {
        "make_model": "G-1159B",
        "tail_number": "N908JE",
        "type": "Jet",
        "seats": 22,
        "confidence": "high"
      },
      "route": {
        "from": "SAF",
        "to": "ASE",
        "from_codes": [
          "SAF"
        ],
        "to_codes": [
          "ASE"
        ],
        "from_full": "Santa Fe, NM, United States",
        "to_full": "Aspen, CO, United States",
        "confidence": "high"
      },
      "flight_data": {
        "flight_number": "1158",
        "iidd": "3589",
        "confidence": "high"
      },
      "passengers": [
        {
          "name": "Jeff Epstein",
          "code": "JE",
          "type": "identified",
          "notable": true,
          "confidence": "high"
        },
        {
          "name": "Emmy Tayler",
          "code": "ET",
          "type": "identified",
          "notable": true,
          "confidence": "high"
        }
      ],
      "data_source": "Flight Log",
      "source_chunk": "021-030",
      "v3_flight_id": "chunk_021-030_p004_r0021"
    },
    {
      "date": {
        "original": "09/19/1998",
        "parsed": "1998-09-19",
        "display": "09/19/1998",
        "confidence": "high"
      },
      "aircraft": {
        "make_model": "G-1159B",
        "tail_number": "N908JE",
        "type": "Jet",
        "seats": 22,
        "confidence": "high"
      },
      "route": {
        "from": "ASE",
        "to": "IAD",
        "from_codes": [
          "ASE"
        ],
        "to_codes": [
          "IAD"
        ],
        "from_full": "Aspen, CO, United States",
        "to_full": "Washington Dc, United States",
        "confidence": "high"
      },
      "flight_data": {
        "flight_number": "1159",
        "iidd": "3591",
        "confidence": "high"
      },
      "passengers": [
        {
          "name": "Jeff Epstein",
          "code": "JE",
          "type": "identified",
          "notable": true,
          "confidence": "high"
        },
        {
          "name": "Emmy Tayler",
          "code": "ET",
          "type": "identified",
          "notable": true,
          "confidence": "high"
        },
        {
          "name": "Larry Summers",
          "code": "LS",
          "type": "identified",
          "notable": true,
          "confidence": "high"
        },
        {
          "name": "Gwendolyn Beck",
          "code": "GB",
          "type": "identified",
          "notable": true,
          "confidence": "high"
        },
        {
          "name": "Illegible",
          "code": "?",
          "type": "unidentified",
          "notable": false,
          "confidence": "high"
        }
      ],
      "data_source": "Flight Log",
      "source_chunk": "021-030",
      "v3_flight_id": "chunk_021-030_p004_r0023"
    },
    {
      "date": {
        "original": "09/19/1998",
        "parsed": "1998-09-19",
        "display": "09/19/1998",
        "confidence": "high"
      },
      "aircraft": {
        "make_model": "G-1159B",
        "tail_number": "N908JE",
        "type": "Jet",
        "seats": 22,
        "confidence": "high"
      },
      "route": {
        "from": "IAD",
        "to": "TEB",
        "from_codes": [
          "IAD"
        ],
        "to_codes": [
          "TEB"
        ],
        "from_full": "Washington Dc, United States",
        "to_full": "Teterboro, NJ, United States",
        "confidence": "high"
      },
      "flight_data": {
        "flight_number": "1160",
        "iidd": "3596",
        "confidence": "high"
      },
      "passengers": [
        {
          "name": "Jeff Epstein",
          "code": "JE",
          "type": "identified",
          "notable": true,
          "confidence": "high"
        },
        {
          "name": "Emmy Tayler",
          "code": "ET",
          "type": "identified",
          "notable": true,
          "confidence": "high"
        },
        {
          "name": "Gwendolyn Beck",
          "code": "GB",
          "type": "identified",
          "notable": true,
          "confidence": "high"
        }
      ],
      "data_source": "Flight Log",
      "source_chunk": "021-030",
      "v3_flight_id": "chunk_021-030_p004_r0028"
    },
    {
      "date": {
        "original": "09/25/1998",
        "parsed": "1998-09-25",
        "display": "09/25/1998",
        "confidence": "high"
      },
      "aircraft": {
        "make_model": "G-1159B",
        "tail_number": "N908JE",
        "type": "Jet",
        "seats": 22,
        "confidence": "high"
      },
      "route": {
        "from": "TEB",
        "to": "DCA",
        "from_codes": [
          "TEB"
        ],
        "to_codes": [
          "DCA"
        ],
        "from_full": "Teterboro, NJ, United States",
        "to_full": "Washington Dc, United States",
        "confidence": "high"
      },
      "flight_data": {
        "flight_number": "1161",
        "iidd": "3599",
        "confidence": "high"
      },
      "passengers": [
        {
          "name": "Jeff Epstein",
          "code": "JE",
          "type": "identified",
          "notable": true,
          "confidence": "high"
        },
        {
          "name": "Lynn Forester",
          "code": "LF",
          "type": "identified",
          "notable": true,
          "confidence": "high"
        }
      ],
      "data_source": "Flight Log",
      "source_chunk": "021-030",
      "v3_flight_id": "chunk_021-030_p004_r0031"
    },
    {
      "date": {
        "original": "09/25/1998",
        "parsed": "1998-09-25",
        "display": "09/25/1998",
        "confidence": "high"
      },
      "aircraft": {
        "make_model": "G-1159B",
        "tail_number": "N908JE",
        "type": "Jet",
        "seats": 22,
        "confidence": "high"
      },
      "route": {
        "from": "DCA",
        "to": "IAD",
        "from_codes": [
          "DCA"
        ],
        "to_codes": [
          "IAD"
        ],
        "from_full": "Washington Dc, United States",
        "to_full": "Washington Dc, United States",
        "confidence": "high"
      },
      "flight_data": {
        "flight_number": "1162",
        "iidd": "3601",
        "confidence": "high"
      },
      "passengers": [
        {
          "name": "Reposition",
          "code": "?",
          "type": "unidentified",
          "notable": false,
          "confidence": "high"
        }
      ],
      "data_source": "Flight Log",
      "source_chunk": "021-030",
      "v3_flight_id": "chunk_021-030_p004_r0033"
    },
    {
      "date": {
        "original": "09/25/1998",
        "parsed": "1998-09-25",
        "display": "09/25/1998",
        "confidence": "high"
      },
      "aircraft": {
        "make_model": "G-1159B",
        "tail_number": "N908JE",
        "type": "Jet",
        "seats": 22,
        "confidence": "high"
      },
      "route": {
        "from": "IAD",
        "to": "TEB",
        "from_codes": [
          "IAD"
        ],
        "to_codes": [
          "TEB"
        ],
        "from_full": "Washington Dc, United States",
        "to_full": "Teterboro, NJ, United States",
        "confidence": "high"
      },
      "flight_data": {
        "flight_number": "1163",
        "iidd": "3602",
        "confidence": "high"
      },
      "passengers": [
        {
          "name": "Jeff Epstein",
          "code": "JE",
          "type": "identified",
          "notable": true,
          "confidence": "high"
        },
        {
          "name": "Lynn Forester",
          "code": "LF",
          "type": "identified",
          "notable": true,
          "confidence": "high"
        }
      ],
      "data_source": "Flight Log",
      "source_chunk": "021-030",
      "v3_flight_id": "chunk_021-030_p004_r0034"
    },
    {
      "date": {
        "original": "09/26/1998",
        "parsed": "1998-09-26",
        "display": "09/26/1998",
        "confidence": "high"
      },
      "aircraft": {
        "make_model": "G-1159B",
        "tail_number": "N908JE",
        "type": "Jet",
        "seats": 22,
        "confidence": "high"
      },
      "route": {
        "from": "TEB",
        "to": "PBI",
        "from_codes": [
          "TEB"
        ],
        "to_codes": [
          "PBI"
        ],
        "from_full": "Teterboro, NJ, United States",
        "to_full": "West Palm Beach, FL, United States",
        "confidence": "high"
      },
      "flight_data": {
        "flight_number": "1164",
        "iidd": "3604",
        "confidence": "high"
      },
      "passengers": [
        {
          "name": "Jeff Epstein",
          "code": "JE",
          "type": "identified",
          "notable": true,
          "confidence": "high"
        },
        {
          "name": "Ghislaine Maxwell",
          "code": "GM",
          "type": "identified",
          "notable": true,
          "confidence": "high"
        }
      ],
      "data_source": "Flight Log",
      "source_chunk": "021-030",
      "v3_flight_id": "chunk_021-030_p004_r0036"
    },
    {
      "date": {
        "original": "10/04/1998",
        "parsed": "1998-10-04",
        "display": "10/04/1998",
        "confidence": "high"
      },
      "aircraft": {
        "make_model": "G-1159B",
        "tail_number": "N908JE",
        "type": "Jet",
        "seats": 22,
        "confidence": "high"
      },
      "route": {
        "from": "PBI",
        "to": "TEB",
        "from_codes": [
          "PBI"
        ],
        "to_codes": [
          "TEB"
        ],
        "from_full": "West Palm Beach, FL, United States",
        "to_full": "Teterboro, NJ, United States",
        "confidence": "high"
      },
      "flight_data": {
        "flight_number": "1165",
        "iidd": "3606",
        "confidence": "high"
      },
      "passengers": [
        {
          "name": "Jeff Epstein",
          "code": "JE",
          "type": "identified",
          "notable": true,
          "confidence": "high"
        },
        {
          "name": "Emmy Tayler",
          "code": "ET",
          "type": "identified",
          "notable": true,
          "confidence": "high"
        },
        {
          "name": "Luba ?",
          "code": "L?",
          "type": "unidentified",
          "notable": false,
          "confidence": "high"
        },
        {
          "name": "Dara ?",
          "code": "D?",
          "type": "unidentified",
          "notable": false,
          "confidence": "high"
        }
      ],
      "data_source": "Flight Log",
      "source_chunk": "021-030",
      "v3_flight_id": "chunk_021-030_p004_r0038"
    },
    {
      "date": {
        "original": "10/06/1998",
        "parsed": "1998-10-06",
        "display": "10/06/1998",
        "confidence": "high"
      },
      "aircraft": {
        "make_model": "G-1159B",
        "tail_number": "N908JE",
        "type": "Jet",
        "seats": 22,
        "confidence": "high"
      },
      "route": {
        "from": "TEB",
        "to": "BED",
        "from_codes": [
          "TEB"
        ],
        "to_codes": [
          "BED"
        ],
        "from_full": "Teterboro, NJ, United States",
        "to_full": "Bedford, MA, United States",
        "confidence": "high"
      },
      "flight_data": {
        "flight_number": "1166",
        "iidd": "3610",
        "confidence": "high"
      },
      "passengers": [
        {
          "name": "Jeff Epstein",
          "code": "JE",
          "type": "identified",
          "notable": true,
          "confidence": "high"
        },
        {
          "name": "Rhonda Sherer",
          "code": "RS",
          "type": "identified",
          "notable": true,
          "confidence": "high"
        }
      ],
      "data_source": "Flight Log",
      "source_chunk": "021-030",
      "v3_flight_id": "chunk_021-030_p004_r0042"
    },
    {
      "date": {
        "original": "10/06/1998",
        "parsed": "1998-10-06",
        "display": "10/06/1998",
        "confidence": "high"
      },
      "aircraft": {
        "make_model": "G-1159B",
        "tail_number": "N908JE",
        "type": "Jet",
        "seats": 22,
        "confidence": "high"
      },
      "route": {
        "from": "BED",
        "to": "TEB",
        "from_codes": [
          "BED"
        ],
        "to_codes": [
          "TEB"
        ],
        "from_full": "Bedford, MA, United States",
        "to_full": "Teterboro, NJ, United States",
        "confidence": "high"
      },
      "flight_data": {
        "flight_number": "1167",
        "iidd": "3612",
        "confidence": "high"
      },
      "passengers": [
        {
          "name": "Jeff Epstein",
          "code": "JE",
          "type": "identified",
          "notable": true,
          "confidence": "high"
        },
        {
          "name": "Rhonda Sherer",
          "code": "RS",
          "type": "identified",
          "notable": true,
          "confidence": "high"
        },
        {
          "name": "Rhonda Sherer's",
          "code": "RS",
          "type": "identified",
          "notable": true,
          "confidence": "high"
        }
      ],
      "data_source": "Flight Log",
      "source_chunk": "021-030",
      "v3_flight_id": "chunk_021-030_p004_r0044"
    },
    {
      "date": {
        "original": "10/09/1998",
        "parsed": "1998-10-09",
        "display": "10/09/1998",
        "confidence": "high"
      },
      "aircraft": {
        "make_model": "G-1159B",
        "tail_number": "N908JE",
        "type": "Jet",
        "seats": 22,
        "confidence": "high"
      },
      "route": {
        "from": "TEB",
        "to": "DCA",
        "from_codes": [
          "TEB"
        ],
        "to_codes": [
          "DCA"
        ],
        "from_full": "Teterboro, NJ, United States",
        "to_full": "Washington Dc, United States",
        "confidence": "high"
      },
      "flight_data": {
        "flight_number": "1168",
        "iidd": "3615",
        "confidence": "high"
      },
      "passengers": [
        {
          "name": "Jeff Epstein",
          "code": "JE",
          "type": "identified",
          "notable": true,
          "confidence": "high"
        },
        {
          "name": "Emmy Tayler",
          "code": "ET",
          "type": "identified",
          "notable": true,
          "confidence": "high"
        },
        {
          "name": "Adam PerryLang",
          "code": "AP",
          "type": "identified",
          "notable": true,
          "confidence": "high"
        }
      ],
      "data_source": "Flight Log",
      "source_chunk": "021-030",
      "v3_flight_id": "chunk_021-030_p004_r0047"
    }
  ]
}