{
  "page_number": 91,
  "source": "v3_flight_logs_pdf",
  "extraction_date": "2025-10-28T17:58:56.833253",
  "chunk": "chunk_051-060",
  "flights": [
    {
      "date": {
        "original": "09/19/2001",
        "parsed": "2001-09-19",
        "display": "09/19/2001",
        "confidence": "high"
      },
      "aircraft": {
        "make_model": "B-727-31",
        "tail_number": "N908JE",
        "type": "Jet",
        "seats": 134,
        "confidence": "high"
      },
      "route": {
        "from": "PBI",
        "to": "HPN",
        "from_codes": [
          "PBI"
        ],
        "to_codes": [
          "HPN"
        ],
        "from_full": "West Palm Beach, FL, United States",
        "to_full": "Westchester County, NY, United States",
        "confidence": "high"
      },
      "flight_data": {
        "flight_number": "15",
        "iidd": "3213",
        "confidence": "high"
      },
      "passengers": [
        {
          "name": "Jeff Epstein",
          "code": "JE",
          "type": "identified",
          "notable": true,
          "confidence": "high"
        },
        {
          "name": "Ghislaine Maxwell",
          "code": "GM",
          "type": "identified",
          "notable": true,
          "confidence": "high"
        },
        {
          "name": "Emmy Tayler",
          "code": "ET",
          "type": "identified",
          "notable": true,
          "confidence": "high"
        }
      ],
      "data_source": "Flight Log",
      "source_chunk": "051-060",
      "v3_flight_id": "chunk_051-060_p003_r0004"
    },
    {
      "date": {
        "original": "09/21/2001",
        "parsed": "2001-09-21",
        "display": "09/21/2001",
        "confidence": "high"
      },
      "aircraft": {
        "make_model": "B-727-31",
        "tail_number": "N908JE",
        "type": "Jet",
        "seats": 134,
        "confidence": "high"
      },
      "route": {
        "from": "HPN",
        "to": "CYQX",
        "from_codes": [
          "HPN"
        ],
        "to_codes": [
          "CYQX"
        ],
        "from_full": "Westchester County, NY, United States",
        "to_full": "Gander, Canada",
        "confidence": "high"
      },
      "flight_data": {
        "flight_number": "16",
        "iidd": "3216",
        "confidence": "high"
      },
      "passengers": [
        {
          "name": "Jeff Epstein",
          "code": "JE",
          "type": "identified",
          "notable": true,
          "confidence": "high"
        },
        {
          "name": "Ghislaine Maxwell",
          "code": "GM",
          "type": "identified",
          "notable": true,
          "confidence": "high"
        },
        {
          "name": "Emmy Tayler",
          "code": "ET",
          "type": "identified",
          "notable": true,
          "confidence": "high"
        }
      ],
      "data_source": "Flight Log",
      "source_chunk": "051-060",
      "v3_flight_id": "chunk_051-060_p003_r0007"
    },
    {
      "date": {
        "original": "09/22/2001",
        "parsed": "2001-09-22",
        "display": "09/22/2001",
        "confidence": "high"
      },
      "aircraft": {
        "make_model": "B-727-31",
        "tail_number": "N908JE",
        "type": "Jet",
        "seats": 134,
        "confidence": "high"
      },
      "route": {
        "from": "CYQX",
        "to": "LFPB",
        "from_codes": [
          "CYQX"
        ],
        "to_codes": [
          "LFPB"
        ],
        "from_full": "Gander, Canada",
        "to_full": "Paris, France",
        "confidence": "high"
      },
      "flight_data": {
        "flight_number": "17",
        "iidd": "3219",
        "confidence": "high"
      },
      "passengers": [
        {
          "name": "Jeff Epstein",
          "code": "JE",
          "type": "identified",
          "notable": true,
          "confidence": "high"
        },
        {
          "name": "Ghislaine Maxwell",
          "code": "GM",
          "type": "identified",
          "notable": true,
          "confidence": "high"
        },
        {
          "name": "Emmy Tayler",
          "code": "ET",
          "type": "identified",
          "notable": true,
          "confidence": "high"
        }
      ],
      "data_source": "Flight Log",
      "source_chunk": "051-060",
      "v3_flight_id": "chunk_051-060_p003_r0010"
    },
    {
      "date": {
        "original": "09/25/2001",
        "parsed": "2001-09-25",
        "display": "09/25/2001",
        "confidence": "high"
      },
      "aircraft": {
        "make_model": "B-727-31",
        "tail_number": "N908JE",
        "type": "Jet",
        "seats": 134,
        "confidence": "high"
      },
      "route": {
        "from": "LFPB",
        "to": "CYXQ",
        "from_codes": [
          "LFPB"
        ],
        "to_codes": [
          "CYXQ"
        ],
        "from_full": "Paris, France",
        "to_full": "Beaver Creek, Yukon, Canada",
        "confidence": "high"
      },
      "flight_data": {
        "flight_number": "18",
        "iidd": "3222",
        "confidence": "high"
      },
      "passengers": [
        {
          "name": "Jeff Epstein",
          "code": "JE",
          "type": "identified",
          "notable": true,
          "confidence": "high"
        },
        {
          "name": "Emmy Tayler",
          "code": "ET",
          "type": "identified",
          "notable": true,
          "confidence": "high"
        },
        {
          "name": "Ed Tuttle",
          "code": "ET",
          "type": "identified",
          "notable": true,
          "confidence": "high"
        }
      ],
      "data_source": "Flight Log",
      "source_chunk": "051-060",
      "v3_flight_id": "chunk_051-060_p003_r0013"
    },
    {
      "date": {
        "original": "09/25/2001",
        "parsed": "2001-09-25",
        "display": "09/25/2001",
        "confidence": "high"
      },
      "aircraft": {
        "make_model": "B-727-31",
        "tail_number": "N908JE",
        "type": "Jet",
        "seats": 134,
        "confidence": "high"
      },
      "route": {
        "from": "CYXQ",
        "to": "HPN",
        "from_codes": [
          "CYXQ"
        ],
        "to_codes": [
          "HPN"
        ],
        "from_full": "Beaver Creek, Yukon, Canada",
        "to_full": "Westchester County, NY, United States",
        "confidence": "high"
      },
      "flight_data": {
        "flight_number": "19",
        "iidd": "3225",
        "confidence": "high"
      },
      "passengers": [
        {
          "name": "Jeff Epstein",
          "code": "JE",
          "type": "identified",
          "notable": true,
          "confidence": "high"
        },
        {
          "name": "Emmy Tayler",
          "code": "ET",
          "type": "identified",
          "notable": true,
          "confidence": "high"
        },
        {
          "name": "Ed Tuttle",
          "code": "ET",
          "type": "identified",
          "notable": true,
          "confidence": "high"
        }
      ],
      "data_source": "Flight Log",
      "source_chunk": "051-060",
      "v3_flight_id": "chunk_051-060_p003_r0016"
    },
    {
      "date": {
        "original": "09/28/2001",
        "parsed": "2001-09-28",
        "display": "09/28/2001",
        "confidence": "high"
      },
      "aircraft": {
        "make_model": "B-727-31",
        "tail_number": "N908JE",
        "type": "Jet",
        "seats": 134,
        "confidence": "high"
      },
      "route": {
        "from": "HPN",
        "to": "PBI",
        "from_codes": [
          "HPN"
        ],
        "to_codes": [
          "PBI"
        ],
        "from_full": "Westchester County, NY, United States",
        "to_full": "West Palm Beach, FL, United States",
        "confidence": "high"
      },
      "flight_data": {
        "flight_number": "20",
        "iidd": "3228",
        "confidence": "high"
      },
      "passengers": [
        {
          "name": "Jeff Epstein",
          "code": "JE",
          "type": "identified",
          "notable": true,
          "confidence": "high"
        },
        {
          "name": "Emmy Tayler",
          "code": "ET",
          "type": "identified",
          "notable": true,
          "confidence": "high"
        },
        {
          "name": "Paula Epstein",
          "code": "PE",
          "type": "identified",
          "notable": true,
          "confidence": "high"
        }
      ],
      "data_source": "Flight Log",
      "source_chunk": "051-060",
      "v3_flight_id": "chunk_051-060_p003_r0019"
    },
    {
      "date": {
        "original": "10/05/2001",
        "parsed": "2001-10-05",
        "display": "10/05/2001",
        "confidence": "high"
      },
      "aircraft": {
        "make_model": "B-727-31",
        "tail_number": "N908JE",
        "type": "Jet",
        "seats": 134,
        "confidence": "high"
      },
      "route": {
        "from": "PBI",
        "to": "ABQ",
        "from_codes": [
          "PBI"
        ],
        "to_codes": [
          "ABQ"
        ],
        "from_full": "West Palm Beach, FL, United States",
        "to_full": "Albuquerque, NM, United States",
        "confidence": "high"
      },
      "flight_data": {
        "flight_number": "21",
        "iidd": "3231",
        "confidence": "high"
      },
      "passengers": [
        {
          "name": "Jeff Epstein",
          "code": "JE",
          "type": "identified",
          "notable": true,
          "confidence": "high"
        },
        {
          "name": "Ghislaine Maxwell",
          "code": "GM",
          "type": "identified",
          "notable": true,
          "confidence": "high"
        },
        {
          "name": "Sarah Kellen",
          "code": "SK",
          "type": "identified",
          "notable": true,
          "confidence": "high"
        }
      ],
      "data_source": "Flight Log",
      "source_chunk": "051-060",
      "v3_flight_id": "chunk_051-060_p003_r0022"
    },
    {
      "date": {
        "original": "10/08/2001",
        "parsed": "2001-10-08",
        "display": "10/08/2001",
        "confidence": "high"
      },
      "aircraft": {
        "make_model": "B-727-31",
        "tail_number": "N908JE",
        "type": "Jet",
        "seats": 134,
        "confidence": "high"
      },
      "route": {
        "from": "ABQ",
        "to": "HPN",
        "from_codes": [
          "ABQ"
        ],
        "to_codes": [
          "HPN"
        ],
        "from_full": "Albuquerque, NM, United States",
        "to_full": "Westchester County, NY, United States",
        "confidence": "high"
      },
      "flight_data": {
        "flight_number": "22",
        "iidd": "3234",
        "confidence": "high"
      },
      "passengers": [
        {
          "name": "Jeff Epstein",
          "code": "JE",
          "type": "identified",
          "notable": true,
          "confidence": "high"
        },
        {
          "name": "Ghislaine Maxwell",
          "code": "GM",
          "type": "identified",
          "notable": true,
          "confidence": "high"
        },
        {
          "name": "Sarah Kellen",
          "code": "SK",
          "type": "identified",
          "notable": true,
          "confidence": "high"
        },
        {
          "name": "Female (2)",
          "code": "?",
          "type": "unidentified",
          "notable": false,
          "confidence": "high"
        }
      ],
      "data_source": "Flight Log",
      "source_chunk": "051-060",
      "v3_flight_id": "chunk_051-060_p003_r0025"
    },
    {
      "date": {
        "original": "10/08/2001",
        "parsed": "2001-10-08",
        "display": "10/08/2001",
        "confidence": "high"
      },
      "aircraft": {
        "make_model": "B-727-31",
        "tail_number": "N908JE",
        "type": "Jet",
        "seats": 134,
        "confidence": "high"
      },
      "route": {
        "from": "HPN",
        "to": "JAX",
        "from_codes": [
          "HPN"
        ],
        "to_codes": [
          "JAX"
        ],
        "from_full": "Westchester County, NY, United States",
        "to_full": "Jacksonville, FL, United States",
        "confidence": "high"
      },
      "flight_data": {
        "flight_number": "23",
        "iidd": "3238",
        "confidence": "high"
      },
      "passengers": [
        {
          "name": "Passenger (0)",
          "code": "?",
          "type": "unidentified",
          "notable": false,
          "confidence": "high"
        }
      ],
      "data_source": "Flight Log",
      "source_chunk": "051-060",
      "v3_flight_id": "chunk_051-060_p003_r0029"
    },
    {
      "date": {
        "original": "10/09/2001",
        "parsed": "2001-10-09",
        "display": "10/09/2001",
        "confidence": "high"
      },
      "aircraft": {
        "make_model": "B-727-31",
        "tail_number": "N908JE",
        "type": "Jet",
        "seats": 134,
        "confidence": "high"
      },
      "route": {
        "from": "JAX",
        "to": "LCQ",
        "from_codes": [
          "JAX"
        ],
        "to_codes": [
          "LCQ"
        ],
        "from_full": "Jacksonville, FL, United States",
        "to_full": "Lake City, FL, United States",
        "confidence": "high"
      },
      "flight_data": {
        "flight_number": "24",
        "iidd": "3700",
        "confidence": "high"
      },
      "passengers": [
        {
          "name": "Passenger (0)",
          "code": "?",
          "type": "unidentified",
          "notable": false,
          "confidence": "high"
        }
      ],
      "data_source": "Flight Log",
      "source_chunk": "051-060",
      "v3_flight_id": "chunk_051-060_p003_r0030"
    },
    {
      "date": {
        "original": "10/10/2001",
        "parsed": "2001-10-10",
        "display": "10/10/2001",
        "confidence": "high"
      },
      "aircraft": {
        "make_model": "G-1159B",
        "tail_number": "N909JE",
        "type": "Jet",
        "seats": 22,
        "confidence": "high"
      },
      "route": {
        "from": "PBI",
        "to": "TEB",
        "from_codes": [
          "PBI"
        ],
        "to_codes": [
          "TEB"
        ],
        "from_full": "West Palm Beach, FL, United States",
        "to_full": "Teterboro, NJ, United States",
        "confidence": "high"
      },
      "flight_data": {
        "flight_number": "1538",
        "iidd": "3701",
        "confidence": "high"
      },
      "passengers": [
        {
          "name": "Passenger (0)",
          "code": "?",
          "type": "unidentified",
          "notable": false,
          "confidence": "high"
        }
      ],
      "data_source": "Flight Log",
      "source_chunk": "051-060",
      "v3_flight_id": "chunk_051-060_p003_r0031"
    },
    {
      "date": {
        "original": "10/11/2001",
        "parsed": "2001-10-11",
        "display": "10/11/2001",
        "confidence": "high"
      },
      "aircraft": {
        "make_model": "G-1159B",
        "tail_number": "N909JE",
        "type": "Jet",
        "seats": 22,
        "confidence": "high"
      },
      "route": {
        "from": "TEB",
        "to": "PBI",
        "from_codes": [
          "TEB"
        ],
        "to_codes": [
          "PBI"
        ],
        "from_full": "Teterboro, NJ, United States",
        "to_full": "West Palm Beach, FL, United States",
        "confidence": "high"
      },
      "flight_data": {
        "flight_number": "1539",
        "iidd": "3702",
        "confidence": "high"
      },
      "passengers": [
        {
          "name": "Jeff Epstein",
          "code": "JE",
          "type": "identified",
          "notable": true,
          "confidence": "high"
        },
        {
          "name": "Sarah Kellen",
          "code": "SK",
          "type": "identified",
          "notable": true,
          "confidence": "high"
        }
      ],
      "data_source": "Flight Log",
      "source_chunk": "051-060",
      "v3_flight_id": "chunk_051-060_p003_r0032"
    },
    {
      "date": {
        "original": "10/15/2001",
        "parsed": "2001-10-15",
        "display": "10/15/2001",
        "confidence": "high"
      },
      "aircraft": {
        "make_model": "G-1159B",
        "tail_number": "N909JE",
        "type": "Jet",
        "seats": 22,
        "confidence": "high"
      },
      "route": {
        "from": "PBI",
        "to": "TEB",
        "from_codes": [
          "PBI"
        ],
        "to_codes": [
          "TEB"
        ],
        "from_full": "West Palm Beach, FL, United States",
        "to_full": "Teterboro, NJ, United States",
        "confidence": "high"
      },
      "flight_data": {
        "flight_number": "1540",
        "iidd": "3704",
        "confidence": "high"
      },
      "passengers": [
        {
          "name": "Jeff Epstein",
          "code": "JE",
          "type": "identified",
          "notable": true,
          "confidence": "high"
        },
        {
          "name": "Ghislaine Maxwell",
          "code": "GM",
          "type": "identified",
          "notable": true,
          "confidence": "high"
        },
        {
          "name": "Sarah Kellen",
          "code": "SK",
          "type": "identified",
          "notable": true,
          "confidence": "high"
        },
        {
          "name": "Larry ?",
          "code": "L?",
          "type": "unidentified",
          "notable": false,
          "confidence": "high"
        },
        {
          "name": "Steve ?",
          "code": "S?",
          "type": "unidentified",
          "notable": false,
          "confidence": "high"
        },
        {
          "name": "Female (1)",
          "code": "?",
          "type": "unidentified",
          "notable": false,
          "confidence": "high"
        }
      ],
      "data_source": "Flight Log",
      "source_chunk": "051-060",
      "v3_flight_id": "chunk_051-060_p003_r0034"
    }
  ]
}