{
  "page_number": 41,
  "source": "v3_flight_logs_pdf",
  "extraction_date": "2025-10-28T17:58:03.062698",
  "chunk": "chunk_001-010",
  "flights": [
    {
      "date": {
        "original": "03/16/1996",
        "parsed": "1996-03-16",
        "display": "03/16/1996",
        "confidence": "high"
      },
      "aircraft": {
        "make_model": "G-1159B",
        "tail_number": "N908JE",
        "type": "Jet",
        "seats": 22,
        "confidence": "high"
      },
      "route": {
        "from": "CMH",
        "to": "TEB",
        "from_codes": [
          "CMH"
        ],
        "to_codes": [
          "TEB"
        ],
        "from_full": "Columbus, OH, United States",
        "to_full": "Teterboro, NJ, United States",
        "confidence": "high"
      },
      "flight_data": {
        "flight_number": "814",
        "iidd": "4378",
        "confidence": "high"
      },
      "passengers": [
        {
          "name": "Jeff Epstein",
          "code": "JE",
          "type": "identified",
          "notable": true,
          "confidence": "high"
        },
        {
          "name": "Ghislaine Maxwell",
          "code": "GM",
          "type": "identified",
          "notable": true,
          "confidence": "high"
        },
        {
          "name": "A S",
          "code": "AS",
          "type": "unidentified",
          "notable": false,
          "confidence": "high"
        }
      ],
      "data_source": "Flight Log",
      "source_chunk": "001-010",
      "v3_flight_id": "chunk_001-010_p003_r0003"
    },
    {
      "date": {
        "original": "03/18/1996",
        "parsed": "1996-03-18",
        "display": "03/18/1996",
        "confidence": "high"
      },
      "aircraft": {
        "make_model": "G-1159B",
        "tail_number": "N908JE",
        "type": "Jet",
        "seats": 22,
        "confidence": "high"
      },
      "route": {
        "from": "PBI",
        "to": "CMH",
        "from_codes": [
          "PBI"
        ],
        "to_codes": [
          "CMH"
        ],
        "from_full": "West Palm Beach, FL, United States",
        "to_full": "Columbus, OH, United States",
        "confidence": "high"
      },
      "flight_data": {
        "flight_number": "813",
        "iidd": "4373",
        "confidence": "high"
      },
      "passengers": [
        {
          "name": "Jeff Epstein",
          "code": "JE",
          "type": "identified",
          "notable": true,
          "confidence": "high"
        },
        {
          "name": "Ghislaine Maxwell",
          "code": "GM",
          "type": "identified",
          "notable": true,
          "confidence": "high"
        },
        {
          "name": "A S",
          "code": "AS",
          "type": "unidentified",
          "notable": false,
          "confidence": "high"
        },
        {
          "name": "Clare Hazell- Iveagh",
          "code": "CH",
          "type": "identified",
          "notable": true,
          "confidence": "high"
        },
        {
          "name": "Female (1)",
          "code": "?",
          "type": "unidentified",
          "notable": false,
          "confidence": "high"
        }
      ],
      "data_source": "Flight Log",
      "source_chunk": "001-010",
      "v3_flight_id": "chunk_001-010_p003_r0006"
    },
    {
      "date": {
        "original": "03/22/1996",
        "parsed": "1996-03-22",
        "display": "03/22/1996",
        "confidence": "high"
      },
      "aircraft": {
        "make_model": "G-1159B",
        "tail_number": "N908JE",
        "type": "Jet",
        "seats": 22,
        "confidence": "high"
      },
      "route": {
        "from": "TEB",
        "to": "PBI",
        "from_codes": [
          "TEB"
        ],
        "to_codes": [
          "PBI"
        ],
        "from_full": "Teterboro, NJ, United States",
        "to_full": "West Palm Beach, FL, United States",
        "confidence": "high"
      },
      "flight_data": {
        "flight_number": "815",
        "iidd": "4381",
        "confidence": "high"
      },
      "passengers": [
        {
          "name": "Jeff Epstein",
          "code": "JE",
          "type": "identified",
          "notable": true,
          "confidence": "high"
        },
        {
          "name": "Frances ?",
          "code": "F?",
          "type": "unidentified",
          "notable": false,
          "confidence": "high"
        },
        {
          "name": "Sophie Biddle",
          "code": "SB",
          "type": "identified",
          "notable": true,
          "confidence": "high"
        },
        {
          "name": "Eva Dubin",
          "code": "ED",
          "type": "identified",
          "notable": true,
          "confidence": "high"
        },
        {
          "name": "Passenger (4)",
          "code": "?",
          "type": "unidentified",
          "notable": false,
          "confidence": "high"
        }
      ],
      "data_source": "Flight Log",
      "source_chunk": "001-010",
      "v3_flight_id": "chunk_001-010_p003_r0011"
    },
    {
      "date": {
        "original": "03/24/1996",
        "parsed": "1996-03-24",
        "display": "03/24/1996",
        "confidence": "high"
      },
      "aircraft": {
        "make_model": "G-1159B",
        "tail_number": "N908JE",
        "type": "Jet",
        "seats": 22,
        "confidence": "high"
      },
      "route": {
        "from": "PBI",
        "to": "TEB",
        "from_codes": [
          "PBI"
        ],
        "to_codes": [
          "TEB"
        ],
        "from_full": "West Palm Beach, FL, United States",
        "to_full": "Teterboro, NJ, United States",
        "confidence": "high"
      },
      "flight_data": {
        "flight_number": "816",
        "iidd": "4386",
        "confidence": "high"
      },
      "passengers": [
        {
          "name": "Jeff Epstein",
          "code": "JE",
          "type": "identified",
          "notable": true,
          "confidence": "high"
        },
        {
          "name": "Eva Dubin",
          "code": "ED",
          "type": "identified",
          "notable": true,
          "confidence": "high"
        },
        {
          "name": "Celina Dubin",
          "code": "CD",
          "type": "identified",
          "notable": true,
          "confidence": "high"
        },
        {
          "name": "Passenger (3)",
          "code": "?",
          "type": "unidentified",
          "notable": false,
          "confidence": "high"
        }
      ],
      "data_source": "Flight Log",
      "source_chunk": "001-010",
      "v3_flight_id": "chunk_001-010_p003_r0016"
    },
    {
      "date": {
        "original": "03/26/1996",
        "parsed": "1996-03-26",
        "display": "03/26/1996",
        "confidence": "high"
      },
      "aircraft": {
        "make_model": "G-1159B",
        "tail_number": "N908JE",
        "type": "Jet",
        "seats": 22,
        "confidence": "high"
      },
      "route": {
        "from": "TEB",
        "to": "VNY",
        "from_codes": [
          "TEB"
        ],
        "to_codes": [
          "VNY"
        ],
        "from_full": "Teterboro, NJ, United States",
        "to_full": "Van Nuys, CA, United States",
        "confidence": "high"
      },
      "flight_data": {
        "flight_number": "817",
        "iidd": "4390",
        "confidence": "high"
      },
      "passengers": [
        {
          "name": "Jeff Epstein",
          "code": "JE",
          "type": "identified",
          "notable": true,
          "confidence": "high"
        }
      ],
      "data_source": "Flight Log",
      "source_chunk": "001-010",
      "v3_flight_id": "chunk_001-010_p003_r0020"
    },
    {
      "date": {
        "original": "03/29/1996",
        "parsed": "1996-03-29",
        "display": "03/29/1996",
        "confidence": "high"
      },
      "aircraft": {
        "make_model": "G-1159B",
        "tail_number": "N908JE",
        "type": "Jet",
        "seats": 22,
        "confidence": "high"
      },
      "route": {
        "from": "VNY",
        "to": "PBI",
        "from_codes": [
          "VNY"
        ],
        "to_codes": [
          "PBI"
        ],
        "from_full": "Van Nuys, CA, United States",
        "to_full": "West Palm Beach, FL, United States",
        "confidence": "high"
      },
      "flight_data": {
        "flight_number": "818",
        "iidd": "4391",
        "confidence": "high"
      },
      "passengers": [
        {
          "name": "Jeff Epstein",
          "code": "JE",
          "type": "identified",
          "notable": true,
          "confidence": "high"
        }
      ],
      "data_source": "Flight Log",
      "source_chunk": "001-010",
      "v3_flight_id": "chunk_001-010_p003_r0021"
    },
    {
      "date": {
        "original": "04/08/1996",
        "parsed": "1996-04-08",
        "display": "04/08/1996",
        "confidence": "high"
      },
      "aircraft": {
        "make_model": "G-1159B",
        "tail_number": "N908JE",
        "type": "Jet",
        "seats": 22,
        "confidence": "high"
      },
      "route": {
        "from": "PBI",
        "to": "TEB",
        "from_codes": [
          "PBI"
        ],
        "to_codes": [
          "TEB"
        ],
        "from_full": "West Palm Beach, FL, United States",
        "to_full": "Teterboro, NJ, United States",
        "confidence": "high"
      },
      "flight_data": {
        "flight_number": "821",
        "iidd": "4392",
        "confidence": "high"
      },
      "passengers": [
        {
          "name": "Jeff Epstein",
          "code": "JE",
          "type": "identified",
          "notable": true,
          "confidence": "high"
        },
        {
          "name": "Ghislaine Maxwell",
          "code": "GM",
          "type": "identified",
          "notable": true,
          "confidence": "high"
        },
        {
          "name": "Eva Dubin",
          "code": "ED",
          "type": "identified",
          "notable": true,
          "confidence": "high"
        },
        {
          "name": "Glenn Dubin",
          "code": "GD",
          "type": "identified",
          "notable": true,
          "confidence": "high"
        },
        {
          "name": "Celina Dubin",
          "code": "CD",
          "type": "identified",
          "notable": true,
          "confidence": "high"
        },
        {
          "name": "Nanny (1)",
          "code": "?",
          "type": "unidentified",
          "notable": false,
          "confidence": "high"
        }
      ],
      "data_source": "Flight Log",
      "source_chunk": "001-010",
      "v3_flight_id": "chunk_001-010_p003_r0022"
    },
    {
      "date": {
        "original": "04/22/1996",
        "parsed": "1996-04-22",
        "display": "04/22/1996",
        "confidence": "high"
      },
      "aircraft": {
        "make_model": "G-1159B",
        "tail_number": "N908JE",
        "type": "Jet",
        "seats": 22,
        "confidence": "high"
      },
      "route": {
        "from": "PBI",
        "to": "TEB",
        "from_codes": [
          "PBI"
        ],
        "to_codes": [
          "TEB"
        ],
        "from_full": "West Palm Beach, FL, United States",
        "to_full": "Teterboro, NJ, United States",
        "confidence": "high"
      },
      "flight_data": {
        "flight_number": "828",
        "iidd": "4398",
        "confidence": "high"
      },
      "passengers": [
        {
          "name": "Jeff Epstein",
          "code": "JE",
          "type": "identified",
          "notable": true,
          "confidence": "high"
        },
        {
          "name": "Ghislaine Maxwell",
          "code": "GM",
          "type": "identified",
          "notable": true,
          "confidence": "high"
        }
      ],
      "data_source": "Flight Log",
      "source_chunk": "001-010",
      "v3_flight_id": "chunk_001-010_p003_r0028"
    },
    {
      "date": {
        "original": "04/26/1996",
        "parsed": "1996-04-26",
        "display": "04/26/1996",
        "confidence": "high"
      },
      "aircraft": {
        "make_model": "G-1159B",
        "tail_number": "N908JE",
        "type": "Jet",
        "seats": 22,
        "confidence": "high"
      },
      "route": {
        "from": "TEB",
        "to": "PBI",
        "from_codes": [
          "TEB"
        ],
        "to_codes": [
          "PBI"
        ],
        "from_full": "Teterboro, NJ, United States",
        "to_full": "West Palm Beach, FL, United States",
        "confidence": "high"
      },
      "flight_data": {
        "flight_number": "829",
        "iidd": "4400",
        "confidence": "high"
      },
      "passengers": [
        {
          "name": "Jeff Epstein",
          "code": "JE",
          "type": "identified",
          "notable": true,
          "confidence": "high"
        },
        {
          "name": "Ghislaine Maxwell",
          "code": "GM",
          "type": "identified",
          "notable": true,
          "confidence": "high"
        },
        {
          "name": "Passenger (3)",
          "code": "?",
          "type": "unidentified",
          "notable": false,
          "confidence": "high"
        }
      ],
      "data_source": "Flight Log",
      "source_chunk": "001-010",
      "v3_flight_id": "chunk_001-010_p003_r0030"
    },
    {
      "date": {
        "original": "04/29/1996",
        "parsed": "1996-04-29",
        "display": "04/29/1996",
        "confidence": "high"
      },
      "aircraft": {
        "make_model": "G-1159B",
        "tail_number": "N908JE",
        "type": "Jet",
        "seats": 22,
        "confidence": "high"
      },
      "route": {
        "from": "PBI",
        "to": "TEB",
        "from_codes": [
          "PBI"
        ],
        "to_codes": [
          "TEB"
        ],
        "from_full": "West Palm Beach, FL, United States",
        "to_full": "Teterboro, NJ, United States",
        "confidence": "high"
      },
      "flight_data": {
        "flight_number": "830",
        "iidd": "4403",
        "confidence": "high"
      },
      "passengers": [
        {
          "name": "Jeff Epstein",
          "code": "JE",
          "type": "identified",
          "notable": true,
          "confidence": "high"
        },
        {
          "name": "Ghislaine Maxwell",
          "code": "GM",
          "type": "identified",
          "notable": true,
          "confidence": "high"
        },
        {
          "name": "Matt Grippi",
          "code": "MG",
          "type": "identified",
          "notable": true,
          "confidence": "high"
        },
        {
          "name": "Male (1)",
          "code": "?",
          "type": "unidentified",
          "notable": false,
          "confidence": "high"
        },
        {
          "name": "Female (2)",
          "code": "?",
          "type": "unidentified",
          "notable": false,
          "confidence": "high"
        }
      ],
      "data_source": "Flight Log",
      "source_chunk": "001-010",
      "v3_flight_id": "chunk_001-010_p003_r0033"
    },
    {
      "date": {
        "original": "05/02/1996",
        "parsed": "1996-05-02",
        "display": "05/02/1996",
        "confidence": "high"
      },
      "aircraft": {
        "make_model": "G-1159B",
        "tail_number": "N908JE",
        "type": "Jet",
        "seats": 22,
        "confidence": "high"
      },
      "route": {
        "from": "TEB",
        "to": "EIDW",
        "from_codes": [
          "TEB"
        ],
        "to_codes": [
          "EIDW"
        ],
        "from_full": "Teterboro, NJ, United States",
        "to_full": "Dublin, Ireland",
        "confidence": "high"
      },
      "flight_data": {
        "flight_number": "831",
        "iidd": "4408",
        "confidence": "high"
      },
      "passengers": [
        {
          "name": "Jeff Epstein",
          "code": "JE",
          "type": "identified",
          "notable": true,
          "confidence": "high"
        },
        {
          "name": "Elizabeth Johnson",
          "code": "EJ",
          "type": "identified",
          "notable": true,
          "confidence": "high"
        },
        {
          "name": "Jordan Dubin",
          "code": "JD",
          "type": "identified",
          "notable": true,
          "confidence": "high"
        },
        {
          "name": "Illegible",
          "code": "?",
          "type": "unidentified",
          "notable": false,
          "confidence": "high"
        },
        {
          "name": "Illegible",
          "code": "?",
          "type": "unidentified",
          "notable": false,
          "confidence": "high"
        },
        {
          "name": "A Teal",
          "code": "AT",
          "type": "unidentified",
          "notable": false,
          "confidence": "high"
        },
        {
          "name": "J Teal",
          "code": "JT",
          "type": "unidentified",
          "notable": false,
          "confidence": "high"
        },
        {
          "name": "O Teal",
          "code": "OT",
          "type": "unidentified",
          "notable": false,
          "confidence": "high"
        }
      ],
      "data_source": "Flight Log",
      "source_chunk": "001-010",
      "v3_flight_id": "chunk_001-010_p003_r0038"
    },
    {
      "date": {
        "original": "05/03/1996",
        "parsed": "1996-05-03",
        "display": "05/03/1996",
        "confidence": "high"
      },
      "aircraft": {
        "make_model": "G-1159B",
        "tail_number": "N908JE",
        "type": "Jet",
        "seats": 22,
        "confidence": "high"
      },
      "route": {
        "from": "EIDW",
        "to": "EIWF",
        "from_codes": [
          "EIDW"
        ],
        "to_codes": [
          "EIWF"
        ],
        "from_full": "Dublin, Ireland",
        "to_full": "Waterford, Ireland, United Kingdom",
        "confidence": "high"
      },
      "flight_data": {
        "flight_number": "832",
        "iidd": "4416",
        "confidence": "high"
      },
      "passengers": [
        {
          "name": "Catherine Finglas",
          "code": "CF",
          "type": "identified",
          "notable": true,
          "confidence": "high"
        },
        {
          "name": "Elizabeth Johnson",
          "code": "EJ",
          "type": "identified",
          "notable": true,
          "confidence": "high"
        },
        {
          "name": "A Teal",
          "code": "AT",
          "type": "unidentified",
          "notable": false,
          "confidence": "high"
        },
        {
          "name": "J Teal",
          "code": "JT",
          "type": "unidentified",
          "notable": false,
          "confidence": "high"
        },
        {
          "name": "O Teal",
          "code": "OT",
          "type": "unidentified",
          "notable": false,
          "confidence": "high"
        }
      ],
      "data_source": "Flight Log",
      "source_chunk": "001-010",
      "v3_flight_id": "chunk_001-010_p003_r0046"
    }
  ]
}