{
  "page_number": 61,
  "source": "v3_flight_logs_pdf",
  "extraction_date": "2025-10-28T17:58:25.407056",
  "chunk": "chunk_021-030",
  "flights": [
    {
      "date": {
        "original": "06/23/1998",
        "parsed": "1998-06-23",
        "display": "06/23/1998",
        "confidence": "high"
      },
      "aircraft": {
        "make_model": "G-1159B",
        "tail_number": "N908JE",
        "type": "Jet",
        "seats": 22,
        "confidence": "high"
      },
      "route": {
        "from": "BED",
        "to": "TEB",
        "from_codes": [
          "BED"
        ],
        "to_codes": [
          "TEB"
        ],
        "from_full": "Bedford, MA, United States",
        "to_full": "Teterboro, NJ, United States",
        "confidence": "high"
      },
      "flight_data": {
        "flight_number": "1124",
        "iidd": "3523",
        "confidence": "high"
      },
      "passengers": [
        {
          "name": "Jeff Epstein",
          "code": "JE",
          "type": "identified",
          "notable": true,
          "confidence": "high"
        },
        {
          "name": "Henry Rosovsky",
          "code": "HR",
          "type": "identified",
          "notable": true,
          "confidence": "high"
        },
        {
          "name": "Gary Roxburgh",
          "code": "GR",
          "type": "identified",
          "notable": true,
          "confidence": "high"
        }
      ],
      "data_source": "Flight Log",
      "source_chunk": "021-030",
      "v3_flight_id": "chunk_021-030_p003_r0002"
    },
    {
      "date": {
        "original": "06/26/1998",
        "parsed": "1998-06-26",
        "display": "06/26/1998",
        "confidence": "high"
      },
      "aircraft": {
        "make_model": "G-1159B",
        "tail_number": "N908JE",
        "type": "Jet",
        "seats": 22,
        "confidence": "high"
      },
      "route": {
        "from": "TEB",
        "to": "PBI",
        "from_codes": [
          "TEB"
        ],
        "to_codes": [
          "PBI"
        ],
        "from_full": "Teterboro, NJ, United States",
        "to_full": "West Palm Beach, FL, United States",
        "confidence": "high"
      },
      "flight_data": {
        "flight_number": "1621",
        "iidd": "3526",
        "confidence": "high"
      },
      "passengers": [
        {
          "name": "Jeff Epstein",
          "code": "JE",
          "type": "identified",
          "notable": true,
          "confidence": "high"
        },
        {
          "name": "Ghislaine Maxwell",
          "code": "GM",
          "type": "identified",
          "notable": true,
          "confidence": "high"
        },
        {
          "name": "Melinda Luntz",
          "code": "ML",
          "type": "identified",
          "notable": true,
          "confidence": "high"
        },
        {
          "name": "Gary Roxburgh",
          "code": "GR",
          "type": "identified",
          "notable": true,
          "confidence": "high"
        }
      ],
      "data_source": "Flight Log",
      "source_chunk": "021-030",
      "v3_flight_id": "chunk_021-030_p003_r0005"
    },
    {
      "date": {
        "original": "07/05/1998",
        "parsed": "1998-07-05",
        "display": "07/05/1998",
        "confidence": "high"
      },
      "aircraft": {
        "make_model": "G-1159B",
        "tail_number": "N908JE",
        "type": "Jet",
        "seats": 22,
        "confidence": "high"
      },
      "route": {
        "from": "PBI",
        "to": "OXC",
        "from_codes": [
          "PBI"
        ],
        "to_codes": [
          "OXC"
        ],
        "from_full": "West Palm Beach, FL, United States",
        "to_full": "Oxford, CT, United States",
        "confidence": "high"
      },
      "flight_data": {
        "flight_number": "1126",
        "iidd": "3530",
        "confidence": "high"
      },
      "passengers": [
        {
          "name": "Jeff Epstein",
          "code": "JE",
          "type": "identified",
          "notable": true,
          "confidence": "high"
        }
      ],
      "data_source": "Flight Log",
      "source_chunk": "021-030",
      "v3_flight_id": "chunk_021-030_p003_r0009"
    },
    {
      "date": {
        "original": "07/05/1998",
        "parsed": "1998-07-05",
        "display": "07/05/1998",
        "confidence": "high"
      },
      "aircraft": {
        "make_model": "G-1159B",
        "tail_number": "N908JE",
        "type": "Jet",
        "seats": 22,
        "confidence": "high"
      },
      "route": {
        "from": "OXC",
        "to": "TEB",
        "from_codes": [
          "OXC"
        ],
        "to_codes": [
          "TEB"
        ],
        "from_full": "Oxford, CT, United States",
        "to_full": "Teterboro, NJ, United States",
        "confidence": "high"
      },
      "flight_data": {
        "flight_number": "1127",
        "iidd": "3531",
        "confidence": "high"
      },
      "passengers": [
        {
          "name": "Jeff Epstein",
          "code": "JE",
          "type": "identified",
          "notable": true,
          "confidence": "high"
        }
      ],
      "data_source": "Flight Log",
      "source_chunk": "021-030",
      "v3_flight_id": "chunk_021-030_p003_r0010"
    },
    {
      "date": {
        "original": "07/10/1998",
        "parsed": "1998-07-10",
        "display": "07/10/1998",
        "confidence": "high"
      },
      "aircraft": {
        "make_model": "G-1159B",
        "tail_number": "N908JE",
        "type": "Jet",
        "seats": 22,
        "confidence": "high"
      },
      "route": {
        "from": "TEB",
        "to": "PBI",
        "from_codes": [
          "TEB"
        ],
        "to_codes": [
          "PBI"
        ],
        "from_full": "Teterboro, NJ, United States",
        "to_full": "West Palm Beach, FL, United States",
        "confidence": "high"
      },
      "flight_data": {
        "flight_number": "1128",
        "iidd": "3532",
        "confidence": "high"
      },
      "passengers": [
        {
          "name": "Jeff Epstein",
          "code": "JE",
          "type": "identified",
          "notable": true,
          "confidence": "high"
        },
        {
          "name": "Sophie Biddle",
          "code": "SB",
          "type": "identified",
          "notable": true,
          "confidence": "high"
        },
        {
          "name": "Female (2)",
          "code": "?",
          "type": "unidentified",
          "notable": false,
          "confidence": "high"
        }
      ],
      "data_source": "Flight Log",
      "source_chunk": "021-030",
      "v3_flight_id": "chunk_021-030_p003_r0011"
    },
    {
      "date": {
        "original": "08/03/1998",
        "parsed": "1998-08-03",
        "display": "08/03/1998",
        "confidence": "high"
      },
      "aircraft": {
        "make_model": "G-1159B",
        "tail_number": "N908JE",
        "type": "Jet",
        "seats": 22,
        "confidence": "high"
      },
      "route": {
        "from": "PBI",
        "to": "TEB",
        "from_codes": [
          "PBI"
        ],
        "to_codes": [
          "TEB"
        ],
        "from_full": "West Palm Beach, FL, United States",
        "to_full": "Teterboro, NJ, United States",
        "confidence": "high"
      },
      "flight_data": {
        "flight_number": "1136",
        "iidd": "3535",
        "confidence": "high"
      },
      "passengers": [
        {
          "name": "Jeff Epstein",
          "code": "JE",
          "type": "identified",
          "notable": true,
          "confidence": "high"
        },
        {
          "name": "Ghislaine Maxwell",
          "code": "GM",
          "type": "identified",
          "notable": true,
          "confidence": "high"
        },
        {
          "name": "Adam PerryLang",
          "code": "AP",
          "type": "identified",
          "notable": true,
          "confidence": "high"
        },
        {
          "name": "Emmy Tayler",
          "code": "ET",
          "type": "identified",
          "notable": true,
          "confidence": "high"
        },
        {
          "name": "Ron ?",
          "code": "R?",
          "type": "unidentified",
          "notable": false,
          "confidence": "high"
        }
      ],
      "data_source": "Flight Log",
      "source_chunk": "021-030",
      "v3_flight_id": "chunk_021-030_p003_r0014"
    },
    {
      "date": {
        "original": "08/04/1998",
        "parsed": "1998-08-04",
        "display": "08/04/1998",
        "confidence": "high"
      },
      "aircraft": {
        "make_model": "G-1159B",
        "tail_number": "N908JE",
        "type": "Jet",
        "seats": 22,
        "confidence": "high"
      },
      "route": {
        "from": "TEB",
        "to": "HTO",
        "from_codes": [
          "TEB"
        ],
        "to_codes": [
          "HTO"
        ],
        "from_full": "Teterboro, NJ, United States",
        "to_full": "East Hampton, NY, United States",
        "confidence": "high"
      },
      "flight_data": {
        "flight_number": "1137",
        "iidd": "3540",
        "confidence": "high"
      },
      "passengers": [
        {
          "name": "Jeff Epstein",
          "code": "JE",
          "type": "identified",
          "notable": true,
          "confidence": "high"
        },
        {
          "name": "Melanie Starves",
          "code": "MS",
          "type": "identified",
          "notable": true,
          "confidence": "high"
        }
      ],
      "data_source": "Flight Log",
      "source_chunk": "021-030",
      "v3_flight_id": "chunk_021-030_p003_r0019"
    },
    {
      "date": {
        "original": "08/04/1998",
        "parsed": "1998-08-04",
        "display": "08/04/1998",
        "confidence": "high"
      },
      "aircraft": {
        "make_model": "G-1159B",
        "tail_number": "N908JE",
        "type": "Jet",
        "seats": 22,
        "confidence": "high"
      },
      "route": {
        "from": "HTO",
        "to": "OQU",
        "from_codes": [
          "HTO"
        ],
        "to_codes": [
          "OQU"
        ],
        "from_full": "East Hampton, NY, United States",
        "to_full": "Warwick, RI, United States",
        "confidence": "high"
      },
      "flight_data": {
        "flight_number": "1138",
        "iidd": "3542",
        "confidence": "high"
      },
      "passengers": [
        {
          "name": "Passenger (0)",
          "code": "?",
          "type": "unidentified",
          "notable": false,
          "confidence": "high"
        }
      ],
      "data_source": "Flight Log",
      "source_chunk": "021-030",
      "v3_flight_id": "chunk_021-030_p003_r0021"
    },
    {
      "date": {
        "original": "08/04/1998",
        "parsed": "1998-08-04",
        "display": "08/04/1998",
        "confidence": "high"
      },
      "aircraft": {
        "make_model": "G-1159B",
        "tail_number": "N908JE",
        "type": "Jet",
        "seats": 22,
        "confidence": "high"
      },
      "route": {
        "from": "OQU",
        "to": "TEB",
        "from_codes": [
          "OQU"
        ],
        "to_codes": [
          "TEB"
        ],
        "from_full": "Warwick, RI, United States",
        "to_full": "Teterboro, NJ, United States",
        "confidence": "high"
      },
      "flight_data": {
        "flight_number": "1139",
        "iidd": "3543",
        "confidence": "high"
      },
      "passengers": [
        {
          "name": "Jeff Epstein",
          "code": "JE",
          "type": "identified",
          "notable": true,
          "confidence": "high"
        }
      ],
      "data_source": "Flight Log",
      "source_chunk": "021-030",
      "v3_flight_id": "chunk_021-030_p003_r0022"
    },
    {
      "date": {
        "original": "08/05/1998",
        "parsed": "1998-08-05",
        "display": "08/05/1998",
        "confidence": "high"
      },
      "aircraft": {
        "make_model": "G-1159B",
        "tail_number": "N908JE",
        "type": "Jet",
        "seats": 22,
        "confidence": "high"
      },
      "route": {
        "from": "TEB",
        "to": "BED",
        "from_codes": [
          "TEB"
        ],
        "to_codes": [
          "BED"
        ],
        "from_full": "Teterboro, NJ, United States",
        "to_full": "Bedford, MA, United States",
        "confidence": "high"
      },
      "flight_data": {
        "flight_number": "1140",
        "iidd": "3544",
        "confidence": "high"
      },
      "passengers": [
        {
          "name": "Jeff Epstein",
          "code": "JE",
          "type": "identified",
          "notable": true,
          "confidence": "high"
        }
      ],
      "data_source": "Flight Log",
      "source_chunk": "021-030",
      "v3_flight_id": "chunk_021-030_p003_r0023"
    },
    {
      "date": {
        "original": "08/05/1998",
        "parsed": "1998-08-05",
        "display": "08/05/1998",
        "confidence": "high"
      },
      "aircraft": {
        "make_model": "G-1159B",
        "tail_number": "N908JE",
        "type": "Jet",
        "seats": 22,
        "confidence": "high"
      },
      "route": {
        "from": "BED",
        "to": "MVY",
        "from_codes": [
          "BED"
        ],
        "to_codes": [
          "MVY"
        ],
        "from_full": "Bedford, MA, United States",
        "to_full": "Martha's Vineyard, MA, United States",
        "confidence": "high"
      },
      "flight_data": {
        "flight_number": "1141",
        "iidd": "3545",
        "confidence": "high"
      },
      "passengers": [
        {
          "name": "Jeff Epstein",
          "code": "JE",
          "type": "identified",
          "notable": true,
          "confidence": "high"
        }
      ],
      "data_source": "Flight Log",
      "source_chunk": "021-030",
      "v3_flight_id": "chunk_021-030_p003_r0024"
    },
    {
      "date": {
        "original": "08/05/1998",
        "parsed": "1998-08-05",
        "display": "08/05/1998",
        "confidence": "high"
      },
      "aircraft": {
        "make_model": "G-1159B",
        "tail_number": "N908JE",
        "type": "Jet",
        "seats": 22,
        "confidence": "high"
      },
      "route": {
        "from": "MVY",
        "to": "TEB",
        "from_codes": [
          "MVY"
        ],
        "to_codes": [
          "TEB"
        ],
        "from_full": "Martha's Vineyard, MA, United States",
        "to_full": "Teterboro, NJ, United States",
        "confidence": "high"
      },
      "flight_data": {
        "flight_number": "1142",
        "iidd": "3546",
        "confidence": "high"
      },
      "passengers": [
        {
          "name": "Jeff Epstein",
          "code": "JE",
          "type": "identified",
          "notable": true,
          "confidence": "high"
        }
      ],
      "data_source": "Flight Log",
      "source_chunk": "021-030",
      "v3_flight_id": "chunk_021-030_p003_r0025"
    },
    {
      "date": {
        "original": "08/06/1998",
        "parsed": "1998-08-06",
        "display": "08/06/1998",
        "confidence": "high"
      },
      "aircraft": {
        "make_model": "G-1159B",
        "tail_number": "N908JE",
        "type": "Jet",
        "seats": 22,
        "confidence": "high"
      },
      "route": {
        "from": "TEB",
        "to": "CMH",
        "from_codes": [
          "TEB"
        ],
        "to_codes": [
          "CMH"
        ],
        "from_full": "Teterboro, NJ, United States",
        "to_full": "Columbus, OH, United States",
        "confidence": "high"
      },
      "flight_data": {
        "flight_number": "1143",
        "iidd": "3547",
        "confidence": "high"
      },
      "passengers": [
        {
          "name": "Jeff Epstein",
          "code": "JE",
          "type": "identified",
          "notable": true,
          "confidence": "high"
        }
      ],
      "data_source": "Flight Log",
      "source_chunk": "021-030",
      "v3_flight_id": "chunk_021-030_p003_r0026"
    },
    {
      "date": {
        "original": "08/06/1998",
        "parsed": "1998-08-06",
        "display": "08/06/1998",
        "confidence": "high"
      },
      "aircraft": {
        "make_model": "G-1159B",
        "tail_number": "N908JE",
        "type": "Jet",
        "seats": 22,
        "confidence": "high"
      },
      "route": {
        "from": "CMH",
        "to": "TEB",
        "from_codes": [
          "CMH"
        ],
        "to_codes": [
          "TEB"
        ],
        "from_full": "Columbus, OH, United States",
        "to_full": "Teterboro, NJ, United States",
        "confidence": "high"
      },
      "flight_data": {
        "flight_number": "1144",
        "iidd": "3548",
        "confidence": "high"
      },
      "passengers": [
        {
          "name": "Jeff Epstein",
          "code": "JE",
          "type": "identified",
          "notable": true,
          "confidence": "high"
        }
      ],
      "data_source": "Flight Log",
      "source_chunk": "021-030",
      "v3_flight_id": "chunk_021-030_p003_r0027"
    },
    {
      "date": {
        "original": "08/07/1998",
        "parsed": "1998-08-07",
        "display": "08/07/1998",
        "confidence": "high"
      },
      "aircraft": {
        "make_model": "G-1159B",
        "tail_number": "N908JE",
        "type": "Jet",
        "seats": 22,
        "confidence": "high"
      },
      "route": {
        "from": "TEB",
        "to": "TVC",
        "from_codes": [
          "TEB"
        ],
        "to_codes": [
          "TVC"
        ],
        "from_full": "Teterboro, NJ, United States",
        "to_full": "Traverse City, MI, United States",
        "confidence": "high"
      },
      "flight_data": {
        "flight_number": "1145",
        "iidd": "3549",
        "confidence": "high"
      },
      "passengers": [
        {
          "name": "Jeff Epstein",
          "code": "JE",
          "type": "identified",
          "notable": true,
          "confidence": "high"
        },
        {
          "name": "Ghislaine Maxwell",
          "code": "GM",
          "type": "identified",
          "notable": true,
          "confidence": "high"
        },
        {
          "name": "Emmy Tayler",
          "code": "ET",
          "type": "identified",
          "notable": true,
          "confidence": "high"
        },
        {
          "name": "Melinda Luntz",
          "code": "ML",
          "type": "identified",
          "notable": true,
          "confidence": "high"
        }
      ],
      "data_source": "Flight Log",
      "source_chunk": "021-030",
      "v3_flight_id": "chunk_021-030_p003_r0028"
    },
    {
      "date": {
        "original": "08/11/1998",
        "parsed": "1998-08-11",
        "display": "08/11/1998",
        "confidence": "high"
      },
      "aircraft": {
        "make_model": "G-1159B",
        "tail_number": "N908JE",
        "type": "Jet",
        "seats": 22,
        "confidence": "high"
      },
      "route": {
        "from": "TVC",
        "to": "TEB",
        "from_codes": [
          "TVC"
        ],
        "to_codes": [
          "TEB"
        ],
        "from_full": "Traverse City, MI, United States",
        "to_full": "Teterboro, NJ, United States",
        "confidence": "high"
      },
      "flight_data": {
        "flight_number": "1146",
        "iidd": "3553",
        "confidence": "high"
      },
      "passengers": [
        {
          "name": "Jeff Epstein",
          "code": "JE",
          "type": "identified",
          "notable": true,
          "confidence": "high"
        },
        {
          "name": "Ghislaine Maxwell",
          "code": "GM",
          "type": "identified",
          "notable": true,
          "confidence": "high"
        },
        {
          "name": "Emmy Tayler",
          "code": "ET",
          "type": "identified",
          "notable": true,
          "confidence": "high"
        }
      ],
      "data_source": "Flight Log",
      "source_chunk": "021-030",
      "v3_flight_id": "chunk_021-030_p003_r0032"
    },
    {
      "date": {
        "original": "08/13/1998",
        "parsed": "1998-08-13",
        "display": "08/13/1998",
        "confidence": "high"
      },
      "aircraft": {
        "make_model": "G-1159B",
        "tail_number": "N908JE",
        "type": "Jet",
        "seats": 22,
        "confidence": "high"
      },
      "route": {
        "from": "TEB",
        "to": "PBI",
        "from_codes": [
          "TEB"
        ],
        "to_codes": [
          "PBI"
        ],
        "from_full": "Teterboro, NJ, United States",
        "to_full": "West Palm Beach, FL, United States",
        "confidence": "high"
      },
      "flight_data": {
        "flight_number": "1147",
        "iidd": "3556",
        "confidence": "high"
      },
      "passengers": [
        {
          "name": "Jeff Epstein",
          "code": "JE",
          "type": "identified",
          "notable": true,
          "confidence": "high"
        },
        {
          "name": "Ghislaine Maxwell",
          "code": "GM",
          "type": "identified",
          "notable": true,
          "confidence": "high"
        },
        {
          "name": "Emmy Tayler",
          "code": "ET",
          "type": "identified",
          "notable": true,
          "confidence": "high"
        },
        {
          "name": "Paula Epstein",
          "code": "PE",
          "type": "identified",
          "notable": true,
          "confidence": "high"
        }
      ],
      "data_source": "Flight Log",
      "source_chunk": "021-030",
      "v3_flight_id": "chunk_021-030_p003_r0035"
    },
    {
      "date": {
        "original": "08/17/1998",
        "parsed": "1998-08-17",
        "display": "08/17/1998",
        "confidence": "high"
      },
      "aircraft": {
        "make_model": "G-1159B",
        "tail_number": "N908JE",
        "type": "Jet",
        "seats": 22,
        "confidence": "high"
      },
      "route": {
        "from": "PBI",
        "to": "TEB",
        "from_codes": [
          "PBI"
        ],
        "to_codes": [
          "TEB"
        ],
        "from_full": "West Palm Beach, FL, United States",
        "to_full": "Teterboro, NJ, United States",
        "confidence": "high"
      },
      "flight_data": {
        "flight_number": "1148",
        "iidd": "3560",
        "confidence": "high"
      },
      "passengers": [
        {
          "name": "Jeff Epstein",
          "code": "JE",
          "type": "identified",
          "notable": true,
          "confidence": "high"
        },
        {
          "name": "Ghislaine Maxwell",
          "code": "GM",
          "type": "identified",
          "notable": true,
          "confidence": "high"
        },
        {
          "name": "Emmy Tayler",
          "code": "ET",
          "type": "identified",
          "notable": true,
          "confidence": "high"
        }
      ],
      "data_source": "Flight Log",
      "source_chunk": "021-030",
      "v3_flight_id": "chunk_021-030_p003_r0039"
    },
    {
      "date": {
        "original": "08/21/1998",
        "parsed": "1998-08-21",
        "display": "08/21/1998",
        "confidence": "high"
      },
      "aircraft": {
        "make_model": "G-1159B",
        "tail_number": "N908JE",
        "type": "Jet",
        "seats": 22,
        "confidence": "high"
      },
      "route": {
        "from": "TEB",
        "to": "SAF",
        "from_codes": [
          "TEB"
        ],
        "to_codes": [
          "SAF"
        ],
        "from_full": "Teterboro, NJ, United States",
        "to_full": "Santa Fe, NM, United States",
        "confidence": "high"
      },
      "flight_data": {
        "flight_number": "1149",
        "iidd": "3563",
        "confidence": "high"
      },
      "passengers": [
        {
          "name": "Jeff Epstein",
          "code": "JE",
          "type": "identified",
          "notable": true,
          "confidence": "high"
        },
        {
          "name": "Ghislaine Maxwell",
          "code": "GM",
          "type": "identified",
          "notable": true,
          "confidence": "high"
        },
        {
          "name": "Emmy Tayler",
          "code": "ET",
          "type": "identified",
          "notable": true,
          "confidence": "high"
        },
        {
          "name": "Adam PerryLang",
          "code": "AP",
          "type": "identified",
          "notable": true,
          "confidence": "high"
        }
      ],
      "data_source": "Flight Log",
      "source_chunk": "021-030",
      "v3_flight_id": "chunk_021-030_p003_r0042"
    },
    {
      "date": {
        "original": "08/22/1998",
        "parsed": "1998-08-22",
        "display": "08/22/1998",
        "confidence": "high"
      },
      "aircraft": {
        "make_model": "G-1159B",
        "tail_number": "N908JE",
        "type": "Jet",
        "seats": 22,
        "confidence": "high"
      },
      "route": {
        "from": "SAF",
        "to": "ASE",
        "from_codes": [
          "SAF"
        ],
        "to_codes": [
          "ASE"
        ],
        "from_full": "Santa Fe, NM, United States",
        "to_full": "Aspen, CO, United States",
        "confidence": "high"
      },
      "flight_data": {
        "flight_number": "1150",
        "iidd": "3567",
        "confidence": "high"
      },
      "passengers": [
        {
          "name": "Jeff Epstein",
          "code": "JE",
          "type": "identified",
          "notable": true,
          "confidence": "high"
        }
      ],
      "data_source": "Flight Log",
      "source_chunk": "021-030",
      "v3_flight_id": "chunk_021-030_p003_r0046"
    },
    {
      "date": {
        "original": "08/25/1998",
        "parsed": "1998-08-25",
        "display": "08/25/1998",
        "confidence": "high"
      },
      "aircraft": {
        "make_model": "G-1159B",
        "tail_number": "N908JE",
        "type": "Jet",
        "seats": 22,
        "confidence": "high"
      },
      "route": {
        "from": "ASE",
        "to": "VNY",
        "from_codes": [
          "ASE"
        ],
        "to_codes": [
          "VNY"
        ],
        "from_full": "Aspen, CO, United States",
        "to_full": "Van Nuys, CA, United States",
        "confidence": "high"
      },
      "flight_data": {
        "flight_number": "1151",
        "iidd": "3568",
        "confidence": "high"
      },
      "passengers": [
        {
          "name": "Jeff Epstein",
          "code": "JE",
          "type": "identified",
          "notable": true,
          "confidence": "high"
        },
        {
          "name": "Joe Pagano",
          "code": "JP",
          "type": "identified",
          "notable": true,
          "confidence": "high"
        },
        {
          "name": "Gwendolyn Beck",
          "code": "GB",
          "type": "identified",
          "notable": true,
          "confidence": "high"
        }
      ],
      "data_source": "Flight Log",
      "source_chunk": "021-030",
      "v3_flight_id": "chunk_021-030_p003_r0047"
    }
  ]
}