{
  "page_number": 73,
  "source": "v3_flight_logs_pdf",
  "extraction_date": "2025-10-28T17:58:36.115693",
  "chunk": "chunk_031-040",
  "flights": [
    {
      "date": {
        "original": "02/02/2000",
        "parsed": "2000-02-02",
        "display": "02/02/2000",
        "confidence": "high"
      },
      "aircraft": {
        "make_model": "G-1159B",
        "tail_number": "N908JE",
        "type": "Jet",
        "seats": 22,
        "confidence": "high"
      },
      "route": {
        "from": "VNY",
        "to": "TEB",
        "from_codes": [
          "VNY"
        ],
        "to_codes": [
          "TEB"
        ],
        "from_full": "Van Nuys, CA, United States",
        "to_full": "Teterboro, NJ, United States",
        "confidence": "high"
      },
      "flight_data": {
        "flight_number": "1330",
        "iidd": "2628",
        "confidence": "high"
      },
      "passengers": [
        {
          "name": "Ghislaine Maxwell",
          "code": "GM",
          "type": "identified",
          "notable": true,
          "confidence": "high"
        },
        {
          "name": "Emmy Tayler",
          "code": "ET",
          "type": "identified",
          "notable": true,
          "confidence": "high"
        },
        {
          "name": "A P",
          "code": "AP",
          "type": "unidentified",
          "notable": false,
          "confidence": "high"
        },
        {
          "name": "Clare Hazell- Iveagh",
          "code": "CH",
          "type": "identified",
          "notable": true,
          "confidence": "high"
        }
      ],
      "data_source": "Flight Log",
      "source_chunk": "031-040",
      "v3_flight_id": "chunk_031-040_p005_r0006"
    },
    {
      "date": {
        "original": "02/03/2000",
        "parsed": "2000-02-03",
        "display": "02/03/2000",
        "confidence": "high"
      },
      "aircraft": {
        "make_model": "G-1159B",
        "tail_number": "N908JE",
        "type": "Jet",
        "seats": 22,
        "confidence": "high"
      },
      "route": {
        "from": "TEB",
        "to": "PBI",
        "from_codes": [
          "TEB"
        ],
        "to_codes": [
          "PBI"
        ],
        "from_full": "Teterboro, NJ, United States",
        "to_full": "West Palm Beach, FL, United States",
        "confidence": "high"
      },
      "flight_data": {
        "flight_number": "1331",
        "iidd": "2632",
        "confidence": "high"
      },
      "passengers": [
        {
          "name": "Passenger (0)",
          "code": "?",
          "type": "unidentified",
          "notable": false,
          "confidence": "high"
        }
      ],
      "data_source": "Flight Log",
      "source_chunk": "031-040",
      "v3_flight_id": "chunk_031-040_p005_r0010"
    },
    {
      "date": {
        "original": "02/23/2000",
        "parsed": "2000-02-23",
        "display": "02/23/2000",
        "confidence": "high"
      },
      "aircraft": {
        "make_model": "EC120B",
        "tail_number": "121TH",
        "type": "Helicopter",
        "seats": 5,
        "confidence": "high"
      },
      "route": {
        "from": "PBI",
        "to": "PBI",
        "from_codes": [
          "PBI"
        ],
        "to_codes": [
          "PBI"
        ],
        "from_full": "West Palm Beach, FL, United States",
        "to_full": "West Palm Beach, FL, United States",
        "confidence": "high"
      },
      "flight_data": {
        "flight_number": "",
        "iidd": "2633",
        "confidence": "high"
      },
      "passengers": [
        {
          "name": "Marx Mcafee",
          "code": "MM",
          "type": "identified",
          "notable": true,
          "confidence": "high"
        }
      ],
      "data_source": "Flight Log",
      "source_chunk": "031-040",
      "v3_flight_id": "chunk_031-040_p005_r0011"
    },
    {
      "date": {
        "original": "04/24/2000",
        "parsed": "2000-04-24",
        "display": "04/24/2000",
        "confidence": "high"
      },
      "aircraft": {
        "make_model": "G-1159B",
        "tail_number": "N908JE",
        "type": "Jet",
        "seats": 22,
        "confidence": "high"
      },
      "route": {
        "from": "PBI",
        "to": "PBI",
        "from_codes": [
          "PBI"
        ],
        "to_codes": [
          "PBI"
        ],
        "from_full": "West Palm Beach, FL, United States",
        "to_full": "West Palm Beach, FL, United States",
        "confidence": "high"
      },
      "flight_data": {
        "flight_number": "1332",
        "iidd": "2634",
        "confidence": "high"
      },
      "passengers": [
        {
          "name": "Passenger (0)",
          "code": "?",
          "type": "unidentified",
          "notable": false,
          "confidence": "high"
        }
      ],
      "data_source": "Flight Log",
      "source_chunk": "031-040",
      "v3_flight_id": "chunk_031-040_p005_r0012"
    },
    {
      "date": {
        "original": "05/03/2000",
        "parsed": "2000-05-03",
        "display": "05/03/2000",
        "confidence": "high"
      },
      "aircraft": {
        "make_model": "G-1159B",
        "tail_number": "N908JE",
        "type": "Jet",
        "seats": 22,
        "confidence": "high"
      },
      "route": {
        "from": "PBI",
        "to": "PBI",
        "from_codes": [
          "PBI"
        ],
        "to_codes": [
          "PBI"
        ],
        "from_full": "West Palm Beach, FL, United States",
        "to_full": "West Palm Beach, FL, United States",
        "confidence": "high"
      },
      "flight_data": {
        "flight_number": "1333",
        "iidd": "2635",
        "confidence": "high"
      },
      "passengers": [
        {
          "name": "Passenger (0)",
          "code": "?",
          "type": "unidentified",
          "notable": false,
          "confidence": "high"
        }
      ],
      "data_source": "Flight Log",
      "source_chunk": "031-040",
      "v3_flight_id": "chunk_031-040_p005_r0013"
    },
    {
      "date": {
        "original": "05/04/2000",
        "parsed": "2000-05-04",
        "display": "05/04/2000",
        "confidence": "high"
      },
      "aircraft": {
        "make_model": "G-1159B",
        "tail_number": "N908JE",
        "type": "Jet",
        "seats": 22,
        "confidence": "high"
      },
      "route": {
        "from": "PBI",
        "to": "TEB",
        "from_codes": [
          "PBI"
        ],
        "to_codes": [
          "TEB"
        ],
        "from_full": "West Palm Beach, FL, United States",
        "to_full": "Teterboro, NJ, United States",
        "confidence": "high"
      },
      "flight_data": {
        "flight_number": "1334",
        "iidd": "2636",
        "confidence": "high"
      },
      "passengers": [
        {
          "name": "Reposition",
          "code": "?",
          "type": "unidentified",
          "notable": false,
          "confidence": "high"
        }
      ],
      "data_source": "Flight Log",
      "source_chunk": "031-040",
      "v3_flight_id": "chunk_031-040_p005_r0014"
    },
    {
      "date": {
        "original": "05/04/2000",
        "parsed": "2000-05-04",
        "display": "05/04/2000",
        "confidence": "high"
      },
      "aircraft": {
        "make_model": "G-1159B",
        "tail_number": "N908JE",
        "type": "Jet",
        "seats": 22,
        "confidence": "high"
      },
      "route": {
        "from": "TEB",
        "to": "PBI",
        "from_codes": [
          "TEB"
        ],
        "to_codes": [
          "PBI"
        ],
        "from_full": "Teterboro, NJ, United States",
        "to_full": "West Palm Beach, FL, United States",
        "confidence": "high"
      },
      "flight_data": {
        "flight_number": "1335",
        "iidd": "2637",
        "confidence": "high"
      },
      "passengers": [
        {
          "name": "Jeff Epstein",
          "code": "JE",
          "type": "identified",
          "notable": true,
          "confidence": "high"
        },
        {
          "name": "Ghislaine Maxwell",
          "code": "GM",
          "type": "identified",
          "notable": true,
          "confidence": "high"
        },
        {
          "name": "Emmy Tayler",
          "code": "ET",
          "type": "identified",
          "notable": true,
          "confidence": "high"
        },
        {
          "name": "Joel Pashcow",
          "code": "JP",
          "type": "identified",
          "notable": true,
          "confidence": "high"
        }
      ],
      "data_source": "Flight Log",
      "source_chunk": "031-040",
      "v3_flight_id": "chunk_031-040_p005_r0015"
    },
    {
      "date": {
        "original": "05/07/2000",
        "parsed": "2000-05-07",
        "display": "05/07/2000",
        "confidence": "high"
      },
      "aircraft": {
        "make_model": "G-1159B",
        "tail_number": "N908JE",
        "type": "Jet",
        "seats": 22,
        "confidence": "high"
      },
      "route": {
        "from": "PBI",
        "to": "TIST",
        "from_codes": [
          "PBI"
        ],
        "to_codes": [
          "TIST"
        ],
        "from_full": "West Palm Beach, FL, United States",
        "to_full": "Charlotte Amalie, St. Thomas, United States Virgin Islands",
        "confidence": "high"
      },
      "flight_data": {
        "flight_number": "FOIA-133 6",
        "iidd": "4010",
        "confidence": "high"
      },
      "passengers": [],
      "data_source": "FOIA",
      "source_chunk": "031-040",
      "v3_flight_id": "chunk_031-040_p005_r0019"
    },
    {
      "date": {
        "original": "05/08/2000",
        "parsed": "2000-05-08",
        "display": "05/08/2000",
        "confidence": "high"
      },
      "aircraft": {
        "make_model": "G-1159B",
        "tail_number": "N908JE",
        "type": "Jet",
        "seats": 22,
        "confidence": "high"
      },
      "route": {
        "from": "TIST",
        "to": "TEB",
        "from_codes": [
          "TIST"
        ],
        "to_codes": [
          "TEB"
        ],
        "from_full": "Charlotte Amalie, St. Thomas, United States Virgin Islands",
        "to_full": "Teterboro, NJ, United States",
        "confidence": "high"
      },
      "flight_data": {
        "flight_number": "1337",
        "iidd": "2641",
        "confidence": "high"
      },
      "passengers": [
        {
          "name": "Jeff Epstein",
          "code": "JE",
          "type": "identified",
          "notable": true,
          "confidence": "high"
        },
        {
          "name": "Ghislaine Maxwell",
          "code": "GM",
          "type": "identified",
          "notable": true,
          "confidence": "high"
        },
        {
          "name": "Emmy Tayler",
          "code": "ET",
          "type": "identified",
          "notable": true,
          "confidence": "high"
        },
        {
          "name": "A P",
          "code": "AP",
          "type": "unidentified",
          "notable": false,
          "confidence": "high"
        },
        {
          "name": "Jean-Luc Brunel",
          "code": "JB",
          "type": "identified",
          "notable": true,
          "confidence": "high"
        },
        {
          "name": "Christina Estrada",
          "code": "CE",
          "type": "identified",
          "notable": true,
          "confidence": "high"
        },
        {
          "name": "Leticia Birkholder",
          "code": "LB",
          "type": "identified",
          "notable": true,
          "confidence": "high"
        },
        {
          "name": "Michelle Birkholder",
          "code": "MB",
          "type": "identified",
          "notable": true,
          "confidence": "high"
        }
      ],
      "data_source": "Flight Log",
      "source_chunk": "031-040",
      "v3_flight_id": "chunk_031-040_p005_r0020"
    },
    {
      "date": {
        "original": "05/12/2000",
        "parsed": "2000-05-12",
        "display": "05/12/2000",
        "confidence": "high"
      },
      "aircraft": {
        "make_model": "G-1159B",
        "tail_number": "N908JE",
        "type": "Jet",
        "seats": 22,
        "confidence": "high"
      },
      "route": {
        "from": "TEB",
        "to": "PBI",
        "from_codes": [
          "TEB"
        ],
        "to_codes": [
          "PBI"
        ],
        "from_full": "Teterboro, NJ, United States",
        "to_full": "West Palm Beach, FL, United States",
        "confidence": "high"
      },
      "flight_data": {
        "flight_number": "1338",
        "iidd": "2649",
        "confidence": "high"
      },
      "passengers": [
        {
          "name": "Jeff Epstein",
          "code": "JE",
          "type": "identified",
          "notable": true,
          "confidence": "high"
        },
        {
          "name": "Ghislaine Maxwell",
          "code": "GM",
          "type": "identified",
          "notable": true,
          "confidence": "high"
        },
        {
          "name": "Emmy Tayler",
          "code": "ET",
          "type": "identified",
          "notable": true,
          "confidence": "high"
        },
        {
          "name": "A P",
          "code": "AP",
          "type": "unidentified",
          "notable": false,
          "confidence": "high"
        },
        {
          "name": "Prince Andrew",
          "code": "PA",
          "type": "identified",
          "notable": true,
          "confidence": "high"
        },
        {
          "name": "Bodyguard ?",
          "code": "B?",
          "type": "unidentified",
          "notable": false,
          "confidence": "high"
        },
        {
          "name": "Alexia Wallert",
          "code": "AW",
          "type": "identified",
          "notable": true,
          "confidence": "high"
        },
        {
          "name": "Male (1)",
          "code": "?",
          "type": "unidentified",
          "notable": false,
          "confidence": "high"
        }
      ],
      "data_source": "Flight Log",
      "source_chunk": "031-040",
      "v3_flight_id": "chunk_031-040_p005_r0028"
    },
    {
      "date": {
        "original": "05/15/2000",
        "parsed": "2000-05-15",
        "display": "05/15/2000",
        "confidence": "high"
      },
      "aircraft": {
        "make_model": "G-1159B",
        "tail_number": "N908JE",
        "type": "Jet",
        "seats": 22,
        "confidence": "high"
      },
      "route": {
        "from": "PBI",
        "to": "TEB",
        "from_codes": [
          "PBI"
        ],
        "to_codes": [
          "TEB"
        ],
        "from_full": "West Palm Beach, FL, United States",
        "to_full": "Teterboro, NJ, United States",
        "confidence": "high"
      },
      "flight_data": {
        "flight_number": "1339",
        "iidd": "2657",
        "confidence": "high"
      },
      "passengers": [
        {
          "name": "Jeff Epstein",
          "code": "JE",
          "type": "identified",
          "notable": true,
          "confidence": "high"
        },
        {
          "name": "A P",
          "code": "AP",
          "type": "unidentified",
          "notable": false,
          "confidence": "high"
        },
        {
          "name": "Paula Epstein",
          "code": "PE",
          "type": "identified",
          "notable": true,
          "confidence": "high"
        },
        {
          "name": "Alexandria ?",
          "code": "A?",
          "type": "unidentified",
          "notable": false,
          "confidence": "high"
        }
      ],
      "data_source": "Flight Log",
      "source_chunk": "031-040",
      "v3_flight_id": "chunk_031-040_p005_r0036"
    },
    {
      "date": {
        "original": "05/16/2000",
        "parsed": "2000-05-16",
        "display": "05/16/2000",
        "confidence": "high"
      },
      "aircraft": {
        "make_model": "G-1159B",
        "tail_number": "N908JE",
        "type": "Jet",
        "seats": 22,
        "confidence": "high"
      },
      "route": {
        "from": "TEB",
        "to": "TIST",
        "from_codes": [
          "TEB"
        ],
        "to_codes": [
          "TIST"
        ],
        "from_full": "Teterboro, NJ, United States",
        "to_full": "Charlotte Amalie, St. Thomas, United States Virgin Islands",
        "confidence": "high"
      },
      "flight_data": {
        "flight_number": "1340",
        "iidd": "2661",
        "confidence": "high"
      },
      "passengers": [
        {
          "name": "Jeff Epstein",
          "code": "JE",
          "type": "identified",
          "notable": true,
          "confidence": "high"
        },
        {
          "name": "Shelley Lewis",
          "code": "SL",
          "type": "identified",
          "notable": true,
          "confidence": "high"
        }
      ],
      "data_source": "Flight Log",
      "source_chunk": "031-040",
      "v3_flight_id": "chunk_031-040_p005_r0040"
    }
  ]
}