{
  "page_number": 121,
  "source": "v3_flight_logs_pdf",
  "extraction_date": "2025-10-28T17:59:26.733348",
  "chunk": "chunk_081-090",
  "flights": [
    {
      "date": {
        "original": "10/07/2003",
        "parsed": "2003-10-07",
        "display": "10/07/2003",
        "confidence": "high"
      },
      "aircraft": {
        "make_model": "G-1159B",
        "tail_number": "N909JE",
        "type": "Jet",
        "seats": 22,
        "confidence": "high"
      },
      "route": {
        "from": "BED",
        "to": "TEB",
        "from_codes": [
          "BED"
        ],
        "to_codes": [
          "TEB"
        ],
        "from_full": "Bedford, MA, United States",
        "to_full": "Teterboro, NJ, United States",
        "confidence": "high"
      },
      "flight_data": {
        "flight_number": "1669",
        "iidd": "1087",
        "confidence": "high"
      },
      "passengers": [
        {
          "name": "Jeff Epstein",
          "code": "JE",
          "type": "identified",
          "notable": true,
          "confidence": "high"
        },
        {
          "name": "Susan Hamblin",
          "code": "SH",
          "type": "identified",
          "notable": true,
          "confidence": "high"
        }
      ],
      "data_source": "Flight Log",
      "source_chunk": "081-090",
      "v3_flight_id": "chunk_081-090_p003_r0002"
    },
    {
      "date": {
        "original": "10/11/2003",
        "parsed": "2003-10-11",
        "display": "10/11/2003",
        "confidence": "high"
      },
      "aircraft": {
        "make_model": "G-1159B",
        "tail_number": "N909JE",
        "type": "Jet",
        "seats": 22,
        "confidence": "high"
      },
      "route": {
        "from": "TEB",
        "to": "PBI",
        "from_codes": [
          "TEB"
        ],
        "to_codes": [
          "PBI"
        ],
        "from_full": "Teterboro, NJ, United States",
        "to_full": "West Palm Beach, FL, United States",
        "confidence": "high"
      },
      "flight_data": {
        "flight_number": "1670",
        "iidd": "1089",
        "confidence": "high"
      },
      "passengers": [
        {
          "name": "Jeff Epstein",
          "code": "JE",
          "type": "identified",
          "notable": true,
          "confidence": "high"
        },
        {
          "name": "Brent Tindall",
          "code": "BT",
          "type": "identified",
          "notable": true,
          "confidence": "high"
        },
        {
          "name": "Ghislaine Maxwell",
          "code": "GM",
          "type": "identified",
          "notable": true,
          "confidence": "high"
        },
        {
          "name": "Teala Davies",
          "code": "TD",
          "type": "identified",
          "notable": true,
          "confidence": "high"
        },
        {
          "name": "Carolina ?",
          "code": "C?",
          "type": "unidentified",
          "notable": false,
          "confidence": "high"
        }
      ],
      "data_source": "Flight Log",
      "source_chunk": "081-090",
      "v3_flight_id": "chunk_081-090_p003_r0004"
    },
    {
      "date": {
        "original": "10/14/2003",
        "parsed": "2003-10-14",
        "display": "10/14/2003",
        "confidence": "high"
      },
      "aircraft": {
        "make_model": "G-1159B",
        "tail_number": "N909JE",
        "type": "Jet",
        "seats": 22,
        "confidence": "high"
      },
      "route": {
        "from": "PBI",
        "to": "TEB",
        "from_codes": [
          "PBI"
        ],
        "to_codes": [
          "TEB"
        ],
        "from_full": "West Palm Beach, FL, United States",
        "to_full": "Teterboro, NJ, United States",
        "confidence": "high"
      },
      "flight_data": {
        "flight_number": "1671",
        "iidd": "1094",
        "confidence": "high"
      },
      "passengers": [
        {
          "name": "Jeff Epstein",
          "code": "JE",
          "type": "identified",
          "notable": true,
          "confidence": "high"
        },
        {
          "name": "Brent Tindall",
          "code": "BT",
          "type": "identified",
          "notable": true,
          "confidence": "high"
        },
        {
          "name": "Ghislaine Maxwell",
          "code": "GM",
          "type": "identified",
          "notable": true,
          "confidence": "high"
        },
        {
          "name": "Sarah Kellen",
          "code": "SK",
          "type": "identified",
          "notable": true,
          "confidence": "high"
        }
      ],
      "data_source": "Flight Log",
      "source_chunk": "081-090",
      "v3_flight_id": "chunk_081-090_p003_r0009"
    },
    {
      "date": {
        "original": "10/16/2003",
        "parsed": "2003-10-16",
        "display": "10/16/2003",
        "confidence": "high"
      },
      "aircraft": {
        "make_model": "G-1159B",
        "tail_number": "N909JE",
        "type": "Jet",
        "seats": 22,
        "confidence": "high"
      },
      "route": {
        "from": "TEB",
        "to": "PBI",
        "from_codes": [
          "TEB"
        ],
        "to_codes": [
          "PBI"
        ],
        "from_full": "Teterboro, NJ, United States",
        "to_full": "West Palm Beach, FL, United States",
        "confidence": "high"
      },
      "flight_data": {
        "flight_number": "1672",
        "iidd": "1098",
        "confidence": "high"
      },
      "passengers": [
        {
          "name": "Jeff Epstein",
          "code": "JE",
          "type": "identified",
          "notable": true,
          "confidence": "high"
        },
        {
          "name": "Brent Tindall",
          "code": "BT",
          "type": "identified",
          "notable": true,
          "confidence": "high"
        },
        {
          "name": "Ghislaine Maxwell",
          "code": "GM",
          "type": "identified",
          "notable": true,
          "confidence": "high"
        },
        {
          "name": "Sarah Kellen",
          "code": "SK",
          "type": "identified",
          "notable": true,
          "confidence": "high"
        }
      ],
      "data_source": "Flight Log",
      "source_chunk": "081-090",
      "v3_flight_id": "chunk_081-090_p003_r0013"
    },
    {
      "date": {
        "original": "10/19/2003",
        "parsed": "2003-10-19",
        "display": "10/19/2003",
        "confidence": "high"
      },
      "aircraft": {
        "make_model": "G-1159B",
        "tail_number": "N909JE",
        "type": "Jet",
        "seats": 22,
        "confidence": "high"
      },
      "route": {
        "from": "PBI",
        "to": "TEB",
        "from_codes": [
          "PBI"
        ],
        "to_codes": [
          "TEB"
        ],
        "from_full": "West Palm Beach, FL, United States",
        "to_full": "Teterboro, NJ, United States",
        "confidence": "high"
      },
      "flight_data": {
        "flight_number": "1673",
        "iidd": "1102",
        "confidence": "high"
      },
      "passengers": [
        {
          "name": "Jeff Epstein",
          "code": "JE",
          "type": "identified",
          "notable": true,
          "confidence": "high"
        },
        {
          "name": "Ghislaine Maxwell",
          "code": "GM",
          "type": "identified",
          "notable": true,
          "confidence": "high"
        },
        {
          "name": "Brent Tindall",
          "code": "BT",
          "type": "identified",
          "notable": true,
          "confidence": "high"
        },
        {
          "name": "Sarah Kellen",
          "code": "SK",
          "type": "identified",
          "notable": true,
          "confidence": "high"
        },
        {
          "name": "Jerry Goldsmith",
          "code": "JG",
          "type": "identified",
          "notable": true,
          "confidence": "high"
        },
        {
          "name": "Gary Roxburgh",
          "code": "GR",
          "type": "identified",
          "notable": true,
          "confidence": "high"
        }
      ],
      "data_source": "Flight Log",
      "source_chunk": "081-090",
      "v3_flight_id": "chunk_081-090_p003_r0017"
    },
    {
      "date": {
        "original": "10/21/2003",
        "parsed": "2003-10-21",
        "display": "10/21/2003",
        "confidence": "high"
      },
      "aircraft": {
        "make_model": "G-1159B",
        "tail_number": "N909JE",
        "type": "Jet",
        "seats": 22,
        "confidence": "high"
      },
      "route": {
        "from": "TEB",
        "to": "MTN",
        "from_codes": [
          "TEB"
        ],
        "to_codes": [
          "MTN"
        ],
        "from_full": "Teterboro, NJ, United States",
        "to_full": "Baltimore, MD, United States",
        "confidence": "high"
      },
      "flight_data": {
        "flight_number": "1674",
        "iidd": "1108",
        "confidence": "high"
      },
      "passengers": [
        {
          "name": "Jeff Epstein",
          "code": "JE",
          "type": "identified",
          "notable": true,
          "confidence": "high"
        },
        {
          "name": "Sarah Kellen",
          "code": "SK",
          "type": "identified",
          "notable": true,
          "confidence": "high"
        }
      ],
      "data_source": "Flight Log",
      "source_chunk": "081-090",
      "v3_flight_id": "chunk_081-090_p003_r0023"
    },
    {
      "date": {
        "original": "10/26/2003",
        "parsed": "2003-10-26",
        "display": "10/26/2003",
        "confidence": "high"
      },
      "aircraft": {
        "make_model": "G-1159B",
        "tail_number": "N909JE",
        "type": "Jet",
        "seats": 22,
        "confidence": "high"
      },
      "route": {
        "from": "TIST",
        "to": "TEB",
        "from_codes": [
          "TIST"
        ],
        "to_codes": [
          "TEB"
        ],
        "from_full": "Charlotte Amalie, St. Thomas, United States Virgin Islands",
        "to_full": "Teterboro, NJ, United States",
        "confidence": "high"
      },
      "flight_data": {
        "flight_number": "1676",
        "iidd": "1110",
        "confidence": "high"
      },
      "passengers": [
        {
          "name": "Jeff Epstein",
          "code": "JE",
          "type": "identified",
          "notable": true,
          "confidence": "high"
        },
        {
          "name": "Brent Tindall",
          "code": "BT",
          "type": "identified",
          "notable": true,
          "confidence": "high"
        },
        {
          "name": "Sarah Kellen",
          "code": "SK",
          "type": "identified",
          "notable": true,
          "confidence": "high"
        },
        {
          "name": "Teala Davies",
          "code": "TD",
          "type": "identified",
          "notable": true,
          "confidence": "high"
        },
        {
          "name": "L C",
          "code": "LC",
          "type": "unidentified",
          "notable": false,
          "confidence": "high"
        }
      ],
      "data_source": "Flight Log",
      "source_chunk": "081-090",
      "v3_flight_id": "chunk_081-090_p003_r0025"
    },
    {
      "date": {
        "original": "10/27/2003",
        "parsed": "2003-10-27",
        "display": "10/27/2003",
        "confidence": "high"
      },
      "aircraft": {
        "make_model": "B-727-31H",
        "tail_number": "N908JE",
        "type": "Jet",
        "seats": 134,
        "confidence": "high"
      },
      "route": {
        "from": "JAX",
        "to": "JAX",
        "from_codes": [
          "JAX"
        ],
        "to_codes": [
          "JAX"
        ],
        "from_full": "Jacksonville, FL, United States",
        "to_full": "Jacksonville, FL, United States",
        "confidence": "high"
      },
      "flight_data": {
        "flight_number": "FOIA-221",
        "iidd": "4054",
        "confidence": "high"
      },
      "passengers": [],
      "data_source": "FOIA",
      "source_chunk": "081-090",
      "v3_flight_id": "chunk_081-090_p003_r0030"
    },
    {
      "date": {
        "original": "10/28/2003",
        "parsed": "2003-10-28",
        "display": "10/28/2003",
        "confidence": "high"
      },
      "aircraft": {
        "make_model": "B-727-31H",
        "tail_number": "N908JE",
        "type": "Jet",
        "seats": 134,
        "confidence": "high"
      },
      "route": {
        "from": "JAX",
        "to": "PBI",
        "from_codes": [
          "JAX"
        ],
        "to_codes": [
          "PBI"
        ],
        "from_full": "Jacksonville, FL, United States",
        "to_full": "West Palm Beach, FL, United States",
        "confidence": "high"
      },
      "flight_data": {
        "flight_number": "FOIA-222",
        "iidd": "4055",
        "confidence": "high"
      },
      "passengers": [],
      "data_source": "FOIA",
      "source_chunk": "081-090",
      "v3_flight_id": "chunk_081-090_p003_r0031"
    },
    {
      "date": {
        "original": "10/30/2003",
        "parsed": "2003-10-30",
        "display": "10/30/2003",
        "confidence": "high"
      },
      "aircraft": {
        "make_model": "B-727-31H",
        "tail_number": "N908JE",
        "type": "Jet",
        "seats": 134,
        "confidence": "high"
      },
      "route": {
        "from": "JFK",
        "to": "LFPB",
        "from_codes": [
          "JFK"
        ],
        "to_codes": [
          "LFPB"
        ],
        "from_full": "New York, NY, United States",
        "to_full": "Paris, France",
        "confidence": "high"
      },
      "flight_data": {
        "flight_number": "223",
        "iidd": "1115",
        "confidence": "high"
      },
      "passengers": [
        {
          "name": "Jeff Epstein",
          "code": "JE",
          "type": "identified",
          "notable": true,
          "confidence": "high"
        },
        {
          "name": "A M",
          "code": "AM",
          "type": "unidentified",
          "notable": false,
          "confidence": "high"
        }
      ],
      "data_source": "Flight Log",
      "source_chunk": "081-090",
      "v3_flight_id": "chunk_081-090_p003_r0032"
    },
    {
      "date": {
        "original": "11/04/2003",
        "parsed": "2003-11-04",
        "display": "11/04/2003",
        "confidence": "high"
      },
      "aircraft": {
        "make_model": "B-727-31H",
        "tail_number": "N908JE",
        "type": "Jet",
        "seats": 134,
        "confidence": "high"
      },
      "route": {
        "from": "LFPB",
        "to": "EBBR",
        "from_codes": [
          "LFPB"
        ],
        "to_codes": [
          "EBBR"
        ],
        "from_full": "Paris, France",
        "to_full": "Brussels, Belgium",
        "confidence": "high"
      },
      "flight_data": {
        "flight_number": "224",
        "iidd": "1117",
        "confidence": "high"
      },
      "passengers": [
        {
          "name": "Jeff Epstein",
          "code": "JE",
          "type": "identified",
          "notable": true,
          "confidence": "high"
        },
        {
          "name": "Andrea Mitrovich",
          "code": "AM",
          "type": "identified",
          "notable": true,
          "confidence": "high"
        },
        {
          "name": "Sarah Kellen",
          "code": "SK",
          "type": "identified",
          "notable": true,
          "confidence": "high"
        }
      ],
      "data_source": "Flight Log",
      "source_chunk": "081-090",
      "v3_flight_id": "chunk_081-090_p003_r0034"
    },
    {
      "date": {
        "original": "11/04/2003",
        "parsed": "2003-11-04",
        "display": "11/04/2003",
        "confidence": "high"
      },
      "aircraft": {
        "make_model": "B-727-31H",
        "tail_number": "N908JE",
        "type": "Jet",
        "seats": 134,
        "confidence": "high"
      },
      "route": {
        "from": "EBBR",
        "to": "ENGM",
        "from_codes": [
          "EBBR"
        ],
        "to_codes": [
          "ENGM"
        ],
        "from_full": "Brussels, Belgium",
        "to_full": "Oslo, Norway",
        "confidence": "high"
      },
      "flight_data": {
        "flight_number": "225",
        "iidd": "1120",
        "confidence": "high"
      },
      "passengers": [
        {
          "name": "Jeff Epstein",
          "code": "JE",
          "type": "identified",
          "notable": true,
          "confidence": "high"
        },
        {
          "name": "Andrea Mitrovich",
          "code": "AM",
          "type": "identified",
          "notable": true,
          "confidence": "high"
        },
        {
          "name": "Doug Band",
          "code": "DB",
          "type": "identified",
          "notable": true,
          "confidence": "high"
        },
        {
          "name": "Secret Service (4)",
          "code": "?",
          "type": "unidentified",
          "notable": false,
          "confidence": "high"
        },
        {
          "name": "Bill Clinton",
          "code": "BC",
          "type": "identified",
          "notable": true,
          "confidence": "high"
        },
        {
          "name": "Sarah Kellen",
          "code": "SK",
          "type": "identified",
          "notable": true,
          "confidence": "high"
        }
      ],
      "data_source": "Flight Log",
      "source_chunk": "081-090",
      "v3_flight_id": "chunk_081-090_p003_r0037"
    },
    {
      "date": {
        "original": "11/04/2003",
        "parsed": "2003-11-04",
        "display": "11/04/2003",
        "confidence": "high"
      },
      "aircraft": {
        "make_model": "B-727-31H",
        "tail_number": "N908JE",
        "type": "Jet",
        "seats": 134,
        "confidence": "high"
      },
      "route": {
        "from": "ENGM",
        "to": "ESSA",
        "from_codes": [
          "ENGM"
        ],
        "to_codes": [
          "ESSA"
        ],
        "from_full": "Oslo, Norway",
        "to_full": "Stockholm, Sweden",
        "confidence": "high"
      },
      "flight_data": {
        "flight_number": "226",
        "iidd": "1126",
        "confidence": "high"
      },
      "passengers": [
        {
          "name": "Jeff Epstein",
          "code": "JE",
          "type": "identified",
          "notable": true,
          "confidence": "high"
        },
        {
          "name": "Andrea Mitrovich",
          "code": "AM",
          "type": "identified",
          "notable": true,
          "confidence": "high"
        },
        {
          "name": "Ghislaine Maxwell",
          "code": "GM",
          "type": "identified",
          "notable": true,
          "confidence": "high"
        },
        {
          "name": "Sarah Kellen",
          "code": "SK",
          "type": "identified",
          "notable": true,
          "confidence": "high"
        }
      ],
      "data_source": "Flight Log",
      "source_chunk": "081-090",
      "v3_flight_id": "chunk_081-090_p003_r0043"
    },
    {
      "date": {
        "original": "11/05/2003",
        "parsed": "2003-11-05",
        "display": "11/05/2003",
        "confidence": "high"
      },
      "aircraft": {
        "make_model": "B-727-31H",
        "tail_number": "N908JE",
        "type": "Jet",
        "seats": 134,
        "confidence": "high"
      },
      "route": {
        "from": "ESSA",
        "to": "ENGM",
        "from_codes": [
          "ESSA"
        ],
        "to_codes": [
          "ENGM"
        ],
        "from_full": "Stockholm, Sweden",
        "to_full": "Oslo, Norway",
        "confidence": "high"
      },
      "flight_data": {
        "flight_number": "227",
        "iidd": "1130",
        "confidence": "high"
      },
      "passengers": [
        {
          "name": "Jeff Epstein",
          "code": "JE",
          "type": "identified",
          "notable": true,
          "confidence": "high"
        },
        {
          "name": "Andrea Mitrovich",
          "code": "AM",
          "type": "identified",
          "notable": true,
          "confidence": "high"
        },
        {
          "name": "Ghislaine Maxwell",
          "code": "GM",
          "type": "identified",
          "notable": true,
          "confidence": "high"
        },
        {
          "name": "Sarah Kellen",
          "code": "SK",
          "type": "identified",
          "notable": true,
          "confidence": "high"
        }
      ],
      "data_source": "Flight Log",
      "source_chunk": "081-090",
      "v3_flight_id": "chunk_081-090_p003_r0047"
    }
  ]
}