{
  "page_number": 59,
  "source": "v3_flight_logs_pdf",
  "extraction_date": "2025-10-28T17:58:25.407056",
  "chunk": "chunk_021-030",
  "flights": [
    {
      "date": {
        "original": "04/24/1998",
        "parsed": "1998-04-24",
        "display": "04/24/1998",
        "confidence": "high"
      },
      "aircraft": {
        "make_model": "G-1159B",
        "tail_number": "N908JE",
        "type": "Jet",
        "seats": 22,
        "confidence": "high"
      },
      "route": {
        "from": "TEB",
        "to": "PBI",
        "from_codes": [
          "TEB"
        ],
        "to_codes": [
          "PBI"
        ],
        "from_full": "Teterboro, NJ, United States",
        "to_full": "West Palm Beach, FL, United States",
        "confidence": "high"
      },
      "flight_data": {
        "flight_number": "1102",
        "iidd": "3433",
        "confidence": "high"
      },
      "passengers": [
        {
          "name": "Jeff Epstein",
          "code": "JE",
          "type": "identified",
          "notable": true,
          "confidence": "high"
        },
        {
          "name": "Ghislaine Maxwell",
          "code": "GM",
          "type": "identified",
          "notable": true,
          "confidence": "high"
        },
        {
          "name": "Cocoa Brown",
          "code": "CB",
          "type": "identified",
          "notable": true,
          "confidence": "high"
        },
        {
          "name": "Emmy Tayler",
          "code": "ET",
          "type": "identified",
          "notable": true,
          "confidence": "high"
        },
        {
          "name": "Linda Pinto",
          "code": "LP",
          "type": "identified",
          "notable": true,
          "confidence": "high"
        }
      ],
      "data_source": "Flight Log",
      "source_chunk": "021-030",
      "v3_flight_id": "chunk_021-030_p001_r0001"
    },
    {
      "date": {
        "original": "04/26/1998",
        "parsed": "1998-04-26",
        "display": "04/26/1998",
        "confidence": "high"
      },
      "aircraft": {
        "make_model": "G-1159B",
        "tail_number": "N908JE",
        "type": "Jet",
        "seats": 22,
        "confidence": "high"
      },
      "route": {
        "from": "PBI",
        "to": "TEB",
        "from_codes": [
          "PBI"
        ],
        "to_codes": [
          "TEB"
        ],
        "from_full": "West Palm Beach, FL, United States",
        "to_full": "Teterboro, NJ, United States",
        "confidence": "high"
      },
      "flight_data": {
        "flight_number": "1103",
        "iidd": "3438",
        "confidence": "high"
      },
      "passengers": [
        {
          "name": "Jeff Epstein",
          "code": "JE",
          "type": "identified",
          "notable": true,
          "confidence": "high"
        },
        {
          "name": "Ghislaine Maxwell",
          "code": "GM",
          "type": "identified",
          "notable": true,
          "confidence": "high"
        },
        {
          "name": "Emmy Tayler",
          "code": "ET",
          "type": "identified",
          "notable": true,
          "confidence": "high"
        }
      ],
      "data_source": "Flight Log",
      "source_chunk": "021-030",
      "v3_flight_id": "chunk_021-030_p001_r0006"
    },
    {
      "date": {
        "original": "05/01/1998",
        "parsed": "1998-05-01",
        "display": "05/01/1998",
        "confidence": "high"
      },
      "aircraft": {
        "make_model": "G-1159B",
        "tail_number": "N908JE",
        "type": "Jet",
        "seats": 22,
        "confidence": "high"
      },
      "route": {
        "from": "TEB",
        "to": "PBI",
        "from_codes": [
          "TEB"
        ],
        "to_codes": [
          "PBI"
        ],
        "from_full": "Teterboro, NJ, United States",
        "to_full": "West Palm Beach, FL, United States",
        "confidence": "high"
      },
      "flight_data": {
        "flight_number": "1104",
        "iidd": "3441",
        "confidence": "high"
      },
      "passengers": [
        {
          "name": "Jeff Epstein",
          "code": "JE",
          "type": "identified",
          "notable": true,
          "confidence": "high"
        },
        {
          "name": "Ghislaine Maxwell",
          "code": "GM",
          "type": "identified",
          "notable": true,
          "confidence": "high"
        },
        {
          "name": "Emmy Tayler",
          "code": "ET",
          "type": "identified",
          "notable": true,
          "confidence": "high"
        },
        {
          "name": "Glenn Dubin",
          "code": "GD",
          "type": "identified",
          "notable": true,
          "confidence": "high"
        },
        {
          "name": "Celina Dubin",
          "code": "CD",
          "type": "identified",
          "notable": true,
          "confidence": "high"
        },
        {
          "name": "Jordan Dubin",
          "code": "JD",
          "type": "identified",
          "notable": true,
          "confidence": "high"
        },
        {
          "name": "Nanny (1)",
          "code": "?",
          "type": "unidentified",
          "notable": false,
          "confidence": "high"
        }
      ],
      "data_source": "Flight Log",
      "source_chunk": "021-030",
      "v3_flight_id": "chunk_021-030_p001_r0009"
    },
    {
      "date": {
        "original": "05/03/1998",
        "parsed": "1998-05-03",
        "display": "05/03/1998",
        "confidence": "high"
      },
      "aircraft": {
        "make_model": "G-1159B",
        "tail_number": "N908JE",
        "type": "Jet",
        "seats": 22,
        "confidence": "high"
      },
      "route": {
        "from": "PBI",
        "to": "TEB",
        "from_codes": [
          "PBI"
        ],
        "to_codes": [
          "TEB"
        ],
        "from_full": "West Palm Beach, FL, United States",
        "to_full": "Teterboro, NJ, United States",
        "confidence": "high"
      },
      "flight_data": {
        "flight_number": "1105",
        "iidd": "3448",
        "confidence": "high"
      },
      "passengers": [
        {
          "name": "Jeff Epstein",
          "code": "JE",
          "type": "identified",
          "notable": true,
          "confidence": "high"
        },
        {
          "name": "Gwendolyn Beck",
          "code": "GB",
          "type": "identified",
          "notable": true,
          "confidence": "high"
        },
        {
          "name": "Ghislaine Maxwell",
          "code": "GM",
          "type": "identified",
          "notable": true,
          "confidence": "high"
        },
        {
          "name": "Emmy Tayler",
          "code": "ET",
          "type": "identified",
          "notable": true,
          "confidence": "high"
        },
        {
          "name": "Nadia Bjorlin",
          "code": "NB",
          "type": "identified",
          "notable": true,
          "confidence": "high"
        },
        {
          "name": "Glenn Dubin",
          "code": "GD",
          "type": "identified",
          "notable": true,
          "confidence": "high"
        },
        {
          "name": "Eva Dubin",
          "code": "ED",
          "type": "identified",
          "notable": true,
          "confidence": "high"
        },
        {
          "name": "Celina Dubin",
          "code": "CD",
          "type": "identified",
          "notable": true,
          "confidence": "high"
        },
        {
          "name": "Jordan Dubin",
          "code": "JD",
          "type": "identified",
          "notable": true,
          "confidence": "high"
        },
        {
          "name": "Nanny (1)",
          "code": "?",
          "type": "unidentified",
          "notable": false,
          "confidence": "high"
        }
      ],
      "data_source": "Flight Log",
      "source_chunk": "021-030",
      "v3_flight_id": "chunk_021-030_p001_r0016"
    },
    {
      "date": {
        "original": "05/05/1998",
        "parsed": "1998-05-05",
        "display": "05/05/1998",
        "confidence": "high"
      },
      "aircraft": {
        "make_model": "G-1159B",
        "tail_number": "N908JE",
        "type": "Jet",
        "seats": 22,
        "confidence": "high"
      },
      "route": {
        "from": "TEB",
        "to": "BED",
        "from_codes": [
          "TEB"
        ],
        "to_codes": [
          "BED"
        ],
        "from_full": "Teterboro, NJ, United States",
        "to_full": "Bedford, MA, United States",
        "confidence": "high"
      },
      "flight_data": {
        "flight_number": "1106",
        "iidd": "3458",
        "confidence": "high"
      },
      "passengers": [
        {
          "name": "Jeff Epstein",
          "code": "JE",
          "type": "identified",
          "notable": true,
          "confidence": "high"
        },
        {
          "name": "Robin ?",
          "code": "R?",
          "type": "unidentified",
          "notable": false,
          "confidence": "high"
        }
      ],
      "data_source": "Flight Log",
      "source_chunk": "021-030",
      "v3_flight_id": "chunk_021-030_p001_r0026"
    },
    {
      "date": {
        "original": "05/05/1998",
        "parsed": "1998-05-05",
        "display": "05/05/1998",
        "confidence": "high"
      },
      "aircraft": {
        "make_model": "G-1159B",
        "tail_number": "N908JE",
        "type": "Jet",
        "seats": 22,
        "confidence": "high"
      },
      "route": {
        "from": "BED",
        "to": "TEB",
        "from_codes": [
          "BED"
        ],
        "to_codes": [
          "TEB"
        ],
        "from_full": "Bedford, MA, United States",
        "to_full": "Teterboro, NJ, United States",
        "confidence": "high"
      },
      "flight_data": {
        "flight_number": "1107",
        "iidd": "3460",
        "confidence": "high"
      },
      "passengers": [
        {
          "name": "Jeff Epstein",
          "code": "JE",
          "type": "identified",
          "notable": true,
          "confidence": "high"
        },
        {
          "name": "Robin ?",
          "code": "R?",
          "type": "unidentified",
          "notable": false,
          "confidence": "high"
        },
        {
          "name": "Steven ?",
          "code": "S?",
          "type": "unidentified",
          "notable": false,
          "confidence": "high"
        }
      ],
      "data_source": "Flight Log",
      "source_chunk": "021-030",
      "v3_flight_id": "chunk_021-030_p001_r0028"
    },
    {
      "date": {
        "original": "05/07/1998",
        "parsed": "1998-05-07",
        "display": "05/07/1998",
        "confidence": "high"
      },
      "aircraft": {
        "make_model": "G-1159B",
        "tail_number": "N908JE",
        "type": "Jet",
        "seats": 22,
        "confidence": "high"
      },
      "route": {
        "from": "TEB",
        "to": "PBI",
        "from_codes": [
          "TEB"
        ],
        "to_codes": [
          "PBI"
        ],
        "from_full": "Teterboro, NJ, United States",
        "to_full": "West Palm Beach, FL, United States",
        "confidence": "high"
      },
      "flight_data": {
        "flight_number": "1108",
        "iidd": "3463",
        "confidence": "high"
      },
      "passengers": [
        {
          "name": "Jeff Epstein",
          "code": "JE",
          "type": "identified",
          "notable": true,
          "confidence": "high"
        },
        {
          "name": "Emmy Tayler",
          "code": "ET",
          "type": "identified",
          "notable": true,
          "confidence": "high"
        }
      ],
      "data_source": "Flight Log",
      "source_chunk": "021-030",
      "v3_flight_id": "chunk_021-030_p001_r0031"
    },
    {
      "date": {
        "original": "05/09/1998",
        "parsed": "1998-05-09",
        "display": "05/09/1998",
        "confidence": "high"
      },
      "aircraft": {
        "make_model": "G-1159B",
        "tail_number": "N908JE",
        "type": "Jet",
        "seats": 22,
        "confidence": "high"
      },
      "route": {
        "from": "PBI",
        "to": "TIST",
        "from_codes": [
          "PBI"
        ],
        "to_codes": [
          "TIST"
        ],
        "from_full": "West Palm Beach, FL, United States",
        "to_full": "Charlotte Amalie, St. Thomas, United States Virgin Islands",
        "confidence": "high"
      },
      "flight_data": {
        "flight_number": "1109",
        "iidd": "3465",
        "confidence": "high"
      },
      "passengers": [
        {
          "name": "Jeff Epstein",
          "code": "JE",
          "type": "identified",
          "notable": true,
          "confidence": "high"
        },
        {
          "name": "Emmy Tayler",
          "code": "ET",
          "type": "identified",
          "notable": true,
          "confidence": "high"
        },
        {
          "name": "Sherrie Crape",
          "code": "SC",
          "type": "identified",
          "notable": true,
          "confidence": "high"
        },
        {
          "name": "Clare Hazell- Iveagh",
          "code": "CH",
          "type": "identified",
          "notable": true,
          "confidence": "high"
        }
      ],
      "data_source": "Flight Log",
      "source_chunk": "021-030",
      "v3_flight_id": "chunk_021-030_p001_r0033"
    },
    {
      "date": {
        "original": "05/11/1998",
        "parsed": "1998-05-11",
        "display": "05/11/1998",
        "confidence": "high"
      },
      "aircraft": {
        "make_model": "G-1159B",
        "tail_number": "N908JE",
        "type": "Jet",
        "seats": 22,
        "confidence": "high"
      },
      "route": {
        "from": "TIST",
        "to": "TEB",
        "from_codes": [
          "TIST"
        ],
        "to_codes": [
          "TEB"
        ],
        "from_full": "Charlotte Amalie, St. Thomas, United States Virgin Islands",
        "to_full": "Teterboro, NJ, United States",
        "confidence": "high"
      },
      "flight_data": {
        "flight_number": "1110",
        "iidd": "3469",
        "confidence": "high"
      },
      "passengers": [
        {
          "name": "Jeff Epstein",
          "code": "JE",
          "type": "identified",
          "notable": true,
          "confidence": "high"
        },
        {
          "name": "Ghislaine Maxwell",
          "code": "GM",
          "type": "identified",
          "notable": true,
          "confidence": "high"
        },
        {
          "name": "Emmy Tayler",
          "code": "ET",
          "type": "identified",
          "notable": true,
          "confidence": "high"
        },
        {
          "name": "Clare Hazell- Iveagh",
          "code": "CH",
          "type": "identified",
          "notable": true,
          "confidence": "high"
        },
        {
          "name": "Chori Krove",
          "code": "CK",
          "type": "identified",
          "notable": true,
          "confidence": "high"
        }
      ],
      "data_source": "Flight Log",
      "source_chunk": "021-030",
      "v3_flight_id": "chunk_021-030_p001_r0037"
    },
    {
      "date": {
        "original": "05/15/1998",
        "parsed": "1998-05-15",
        "display": "05/15/1998",
        "confidence": "high"
      },
      "aircraft": {
        "make_model": "G-1159B",
        "tail_number": "N908JE",
        "type": "Jet",
        "seats": 22,
        "confidence": "high"
      },
      "route": {
        "from": "TEB",
        "to": "PBI",
        "from_codes": [
          "TEB"
        ],
        "to_codes": [
          "PBI"
        ],
        "from_full": "Teterboro, NJ, United States",
        "to_full": "West Palm Beach, FL, United States",
        "confidence": "high"
      },
      "flight_data": {
        "flight_number": "1111",
        "iidd": "3474",
        "confidence": "high"
      },
      "passengers": [
        {
          "name": "Jeff Epstein",
          "code": "JE",
          "type": "identified",
          "notable": true,
          "confidence": "high"
        },
        {
          "name": "Mandy Ellison",
          "code": "ME",
          "type": "identified",
          "notable": true,
          "confidence": "high"
        }
      ],
      "data_source": "Flight Log",
      "source_chunk": "021-030",
      "v3_flight_id": "chunk_021-030_p001_r0042"
    },
    {
      "date": {
        "original": "05/17/1998",
        "parsed": "1998-05-17",
        "display": "05/17/1998",
        "confidence": "high"
      },
      "aircraft": {
        "make_model": "G-1159B",
        "tail_number": "N908JE",
        "type": "Jet",
        "seats": 22,
        "confidence": "high"
      },
      "route": {
        "from": "PBI",
        "to": "TEB",
        "from_codes": [
          "PBI"
        ],
        "to_codes": [
          "TEB"
        ],
        "from_full": "West Palm Beach, FL, United States",
        "to_full": "Teterboro, NJ, United States",
        "confidence": "high"
      },
      "flight_data": {
        "flight_number": "1112",
        "iidd": "3476",
        "confidence": "high"
      },
      "passengers": [
        {
          "name": "Jeff Epstein",
          "code": "JE",
          "type": "identified",
          "notable": true,
          "confidence": "high"
        }
      ],
      "data_source": "Flight Log",
      "source_chunk": "021-030",
      "v3_flight_id": "chunk_021-030_p001_r0044"
    },
    {
      "date": {
        "original": "05/18/1998",
        "parsed": "1998-05-18",
        "display": "05/18/1998",
        "confidence": "high"
      },
      "aircraft": {
        "make_model": "G-1159B",
        "tail_number": "N908JE",
        "type": "Jet",
        "seats": 22,
        "confidence": "high"
      },
      "route": {
        "from": "TEB",
        "to": "MDW",
        "from_codes": [
          "TEB"
        ],
        "to_codes": [
          "MDW"
        ],
        "from_full": "Teterboro, NJ, United States",
        "to_full": "Chicago, IL, United States",
        "confidence": "high"
      },
      "flight_data": {
        "flight_number": "1113",
        "iidd": "3477",
        "confidence": "high"
      },
      "passengers": [
        {
          "name": "Ghislaine Maxwell",
          "code": "GM",
          "type": "identified",
          "notable": true,
          "confidence": "high"
        },
        {
          "name": "Emmy Tayler",
          "code": "ET",
          "type": "identified",
          "notable": true,
          "confidence": "high"
        },
        {
          "name": "Shannon Healy",
          "code": "SH",
          "type": "identified",
          "notable": true,
          "confidence": "high"
        },
        {
          "name": "Alberto Pinto",
          "code": "AP",
          "type": "identified",
          "notable": true,
          "confidence": "high"
        },
        {
          "name": "Male (1)",
          "code": "?",
          "type": "unidentified",
          "notable": false,
          "confidence": "high"
        }
      ],
      "data_source": "Flight Log",
      "source_chunk": "021-030",
      "v3_flight_id": "chunk_021-030_p001_r0045"
    }
  ]
}